"ProductId","Image Url","Video Url","Product Desc","Origin Price","Discount Price","Discount","Currency","Commission Rate","Commission","Sales180Day","Positive Feedback","Promotion Url","Code Name","Code Start Time","Code End Time","Code Value","Code Quantity","Code Minimum Spend"
"1005004431697948","https://ae04.alicdn.com/kf/Sf2763331dd164b5e9182a41655074aafP.jpg",,"Classic Black Red High Heels Shoes Woman Pumps 12cm Tacones Pointed Toe Stilettos Sexy Deep Cleavage Wedding QKOU011 ROVICIYA","USD 68.00","USD 34.00","50%","USD","7","USD 2.38","40","100.0%","https://s.click.aliexpress.com/e/_DkTzYon",,,,,,
"1005004308522869","https://ae04.alicdn.com/kf/Sefba47631a2345f0a9f9f66ec1ea9d1eK.jpg","http://cloud.video.taobao.com/play/u/2675628091/p/1/e/6/t/1/1100032342622.mp4","Eilyken Golden Ankle Lace-Up Women Sandals Summer Sexy Crystal Rhinestones Pointed Toe Wedding Party Shoes Ladies Stilettos","USD 49.92","USD 24.46","51%","USD","7","USD 1.71","79","97.1%","https://s.click.aliexpress.com/e/_Dk0iLt9",,,,,,
"4000525357183","https://ae04.alicdn.com/kf/S1f098bb23af948c192f1990d31f9418dT.jpg","http://cloud.video.taobao.com/play/u/2675628091/p/1/e/6/t/1/248872391374.mp4","Eilyken Gladiator Sandals High Heels Women Fall Best Street Look Females Square Head Open Toe Clip-On Strappy Shoes","USD 40.11","USD 18.85","53%","USD","7","USD 1.32","915","93.5%","https://s.click.aliexpress.com/e/_DcJD5gx",,,,,,
"1005004368119277","https://ae04.alicdn.com/kf/S35623f2ced7c43c5ad62931411007da2z.jpg",,"Brand Women High Heels Party Shoes Chunky Sandals 2022 New Summer Cross Tied Sexy Pumps Rome Ladies Shoes Slippers Mujer Zapatos","USD 23.72","USD 16.60","30%","USD","7","USD 1.16","124","91.3%","https://s.click.aliexpress.com/e/_DlWO5dz",,,,,,
"1005004514118586","https://ae04.alicdn.com/kf/S4e6e56ed9177425c96ce3c27c5348b9cR.jpg",,"Aphixta 2022 New 10cm Square Heels Pumps Women Shoes Patent Leather Sexy Wedding Party Official Leisure Super Big Szie 31-50","USD 22.91","USD 11.91","48%","USD","7","USD 0.83","96","98.1%","https://s.click.aliexpress.com/e/_DEiKOsR",,,,,,
"1005004027262147","https://ae04.alicdn.com/kf/S1063dd0d78624cc29ecf0f3c5d8b7fe3Q.jpg",,"Design sense niche transparent high heels women's stiletto 2022 spring and autumn new champagne color single shoes dress shoes","USD 30.47","USD 15.54","49%","USD","7","USD 1.09","61","92.0%","https://s.click.aliexpress.com/e/_Dm8Emgn",,,,,,
"1005004064754062","https://ae04.alicdn.com/kf/S59760f75261744058e583cdd0b364bdfj.jpg",,"New Fashion show Black Net Fabric Cross strap Sexy high heel Sandals Woman shoes Pumps Lace-up Peep Toe Sandals Casual Mesh","USD 29.02","USD 15.67","46%","USD","7","USD 1.10","1366","94.3%","https://s.click.aliexpress.com/e/_DdfjXOR",,,,,,
"1005004216029312","https://ae04.alicdn.com/kf/Sa6c39ae949c344b3beffe94f24427d57u.jpg",,"2022 Solid Color Single Shoes Women Low-Heeled Square Toe Shoes Spring Autumn Knitting Shoes Plus Size 43","USD 34.97","USD 20.63","41%","USD","7","USD 1.44","97","91.7%","https://s.click.aliexpress.com/e/_Ded0XJt",,,,,,
"1005003777088996","https://ae04.alicdn.com/kf/Se147bdd6ab1144a19cd1375c66124cd25.jpg",,"Women High Heels Slippers Fashion Thin High Heels Sandals Woman Lace-up Slides Female Shoes Fashion Sandals Lady Party Shoes","USD 23.10","USD 12.01","48%","USD","7","USD 0.84","61","86.7%","https://s.click.aliexpress.com/e/_DeC7G9v",,,,,,
"1005003990065940","https://ae04.alicdn.com/kf/Sc6e80c10792c4031b3148a879028dca2Z.jpg",,"Women Flats Sandals Wedges Sport Women Shoes 2022 Summer New Casual Mujer Slides Women Shoes Slingback Ladies Slippers Zapatos","USD 17.15","USD 12.00","30%","USD","7","USD 0.84","122","82.6%","https://s.click.aliexpress.com/e/_DDt91g7",,,,,,
"1005003920349680","https://ae04.alicdn.com/kf/Sb1fa385c66fb4cab98bcd67d46d3657a7.jpg",,"2022 wild new sexy pointed toe net red French stiletto high heels Gradient pink wedding shoes single shoes female spring","USD 21.90","USD 17.08","22%","USD","8.0","USD 1.37","41","78.5%","https://s.click.aliexpress.com/e/_DmOfLvH",,,,,,
"1005003892530271","https://ae04.alicdn.com/kf/Se71f57bdf2e84cdf92cbe67f2483da602.jpg","http://cloud.video.taobao.com/play/u/2675628091/p/1/e/6/t/1/347874126722.mp4","Patent Leather Stripper Heels Girls Shoe for Party Club Women Sexy Show Sandals 15 17 CM High Heels Sexy Platform Sandals Pumps","USD 20.90","USD 13.17","37%","USD","7","USD 0.92","78","92.9%","https://s.click.aliexpress.com/e/_DBFk1TZ",,,,,,
"1005004367369100","https://ae04.alicdn.com/kf/S87b1439081bd485f8436c63ca190d1e5F.jpg","http://cloud.video.taobao.com/play/u/2675628091/p/1/e/6/t/1/1100043681065.mp4","Summer Children‘s Girls Gladiator Sandals Rhinestone Crystal Princess Solf Shoes Non-slip Breathable Fashion Kids Sandals","USD 27.46","USD 27.46","0%","USD","7","USD 1.92","24","100.0%","https://s.click.aliexpress.com/e/_DE50Gkn",,,,,,
"1005004528678835","https://ae04.alicdn.com/kf/S01474209fedb4670bde963a1e3354eb6A.jpg","http://cloud.video.taobao.com/play/u/2675628091/p/1/e/6/t/1/1100066193217.mp4","Eilyken Fashion Summer Rhinestone Feather Women Sandals Lace-up Cross-Tied Sexy Gladiator Square Toe Ladies High Heel Shoes","USD 41.85","USD 20.51","51%","USD","7","USD 1.44","121","90.0%","https://s.click.aliexpress.com/e/_DFVd5Dl",,,,,,
"1005004434727562","https://ae04.alicdn.com/kf/S97a43333898f4f328de62a642dec23fd7.jpg","http://cloud.video.taobao.com/play/u/2675628091/p/1/e/6/t/1/1100053657123.mp4","NIUFUNI Pointed Toe Mesh Breathable Elastic Strap Slingback Women's Sandals Summer Elegant Ladies Shoes Stiletto Heels Fashion","USD 58.35","USD 30.93","47%","USD","9.0","USD 2.78","44","90.0%","https://s.click.aliexpress.com/e/_DDDDSdh",,,,,,
"1005004026269611","https://ae04.alicdn.com/kf/Se30b8df4770d40ad9379b7c98edaf4b7f.jpg",,"Children Sandals for Girls 2022 Summer New Girls Covered Toes Flat Leather Slippers Casual Lazy Metal Korean Kids Fashion Flats","USD 24.62","USD 12.31","50%","USD","7","USD 0.86","25","100.0%","https://s.click.aliexpress.com/e/_DF4P5M3",,,,,,
"1005004008410811","https://ae04.alicdn.com/kf/S1d31839fa6224ac2a634598ace22b603p.jpg","http://cloud.video.taobao.com/play/u/2675628091/p/1/e/6/t/1/351540975472.mp4","Sexy Pointed Toe Rhinestone Pumps Women Crystal Ankle Strap High Heels Sandals Female 2022 Summer Silk Satin Wedding Shoes Woman","USD 38.67","USD 23.59","39%","USD","7","USD 1.65","71","95.6%","https://s.click.aliexpress.com/e/_DlgLCP9",,,,,,
"1005004444574138","https://ae04.alicdn.com/kf/S6a3681d43a154c4a91c81c17d4ce1f2fh.jpg",,"Children's Slippers New Female Princess Girl's Blue Cool Sandals Child Procrastinate High Frozen Elsa Baby Slipper Pink Shoes","USD 28.27","USD 14.13","50%","USD","7","USD 0.99","22","100.0%","https://s.click.aliexpress.com/e/_DEvkcyn",,,,,,
"1005003280172756","https://ae04.alicdn.com/kf/H5bb16521333e4e8486eed8c34522ac03z.jpg","http://cloud.video.taobao.com/play/u/2675628091/p/1/e/6/t/1/326430149918.mp4","Aneikeh Gladiator Rivet Women High Sandals Summer Sexy Stripper 2023 17.5CM Thin Heels Shoes Platform Fashion Narrow Band Pumps","USD 54.96","USD 29.13","47%","USD","7","USD 2.04","66","100.0%","https://s.click.aliexpress.com/e/_DcJl1vz",,,,,,
"1005004682998478","https://ae04.alicdn.com/kf/S202e32dbb3cf487b8700b48514c9093as.jpg","http://cloud.video.taobao.com/play/u/2675628091/p/1/e/6/t/1/1100083794726.mp4","Women Shoes 2022 New Fashion Retro Square Toe Hollow Out Casual Mary Jane Shoes Women Waterproof Platform Shoes Zapatillas Mujer","USD 25.67","USD 15.40","40%","USD","7","USD 1.08","60","93.3%","https://s.click.aliexpress.com/e/_Dk0IXSf",,,,,,
"1005004308701366","https://ae04.alicdn.com/kf/A6f46651581a7445f92e1999ebd4a3273b.jpg","http://cloud.video.taobao.com/play/u/2675628091/p/1/e/6/t/1/1100034594015.mp4","Dream Pairs Kids Girls Low Heel Sandals Sweet Party Dress Princess Sandals Rhinestones Studs Embellishment Fashion Girls Shoes","USD 49.26","USD 22.17","55%","USD","7","USD 1.55","70","100.0%","https://s.click.aliexpress.com/e/_DmPmixd",,,,,,
"1005004989670288","https://ae04.alicdn.com/kf/S857c85555e784a70a2e4aef74f34fcefy.jpg","http://cloud.video.taobao.com/play/u/2675628091/p/1/e/6/t/1/1100103555939.mp4","Liyke Fashion Design Double Buckle Strap Platform Sandals Women Pumps Sexy Peep Toe 16.5CM Super High Heels Stripper Shoes White","USD 50.75","USD 25.37","50%","USD","7","USD 1.78","62","100.0%","https://s.click.aliexpress.com/e/_DdIVmcn",,,,,,
"1005002964071888","https://ae04.alicdn.com/kf/S06572cdf4b0e41519a287c6d06172604G.jpg","http://cloud.video.taobao.com/play/u/2675628091/p/1/e/6/t/1/317914222509.mp4","2022 New Gothic High-heeled Shoes Women Pumps Korean Version of The Wild Thick with Square Head Retro Mary Jane Women's Shoes","USD 31.10","USD 24.88","20%","USD","9.0","USD 2.24","92","90.0%","https://s.click.aliexpress.com/e/_DeypBAP",,,,,,
"33053516880","https://ae04.alicdn.com/kf/HTB1jyddXoH1gK0jSZSyq6xtlpXaL.jpg",,"Girls Leather Shoes Autumn Bowtie Sandals 2022 New Children Shoes High Heels Princess Sweet Sandals For Girls","USD 17.98","USD 9.53","47%","USD","8.0","USD 0.76","271","97.4%","https://s.click.aliexpress.com/e/_Dl9nvZl",,,,,,
"1005004615864667","https://ae04.alicdn.com/kf/S32f445bfbe45433e8797e7a1ce0befebN.jpg",,"TRAF Rhinestone Bow Heels Women Pumps Green Butterfly High Heels Women's Wedding Pumps Fashion Woman Spring Summer 2022 Shoes","USD 35.00","USD 21.00","40%","USD","7","USD 1.47","38","89.1%","https://s.click.aliexpress.com/e/_DE5Va5p",,,,,,
"4000813909827","https://ae04.alicdn.com/kf/H0fdfcb72b3204b0fb31936c4bab182d4c.jpg",,"Kids Crystal Jelly Sandals Princess Cosplay Party 2021 Girls Dance Shoes Kids Summer shoes Girls Princess Shoes","USD 15.50","USD 8.52","45%","USD","7","USD 0.60","35","100.0%","https://s.click.aliexpress.com/e/_DmklfQR",,,,,,
"1005003811135197","https://ae04.alicdn.com/kf/S7e47c701a71942118837a592184e1fdfa.jpg",,"2022 New spring and autumn pointy soft leather kitten heel professional single shoes for women","USD 21.90","USD 17.08","22%","USD","8.0","USD 1.37","61","92.6%","https://s.click.aliexpress.com/e/_DD0PC5v",,,,,,
"4001223653982","https://ae04.alicdn.com/kf/H857e1dde8cac4b8ba778779b293c40309.jpg",,"Crystal Queen Ankle Strap Women Sweet Fashion White Colored Floral Stilettos Party Tassel Bridal Wedding Shoes High Heel","USD 32.85","USD 26.28","20%","USD","7","USD 1.84","48","100.0%","https://s.click.aliexpress.com/e/_DdeW4gr",,,,,,
"1005002543045016","https://ae04.alicdn.com/kf/S6965a71fd54a470c8aec5a7c672b26b3a.jpg","http://cloud.video.taobao.com/play/u/2675628091/p/1/e/6/t/1/1100061799446.mp4","New Women Sandals 14CM Super High Heels Sexy Open Toe Platform Sandals Gladiator Party Dress Red Wedding Shoes Plus Size","USD 24.98","USD 12.49","50%","USD","8.0","USD 1.00","100","95.0%","https://s.click.aliexpress.com/e/_DlsRqeT",,,,,,
"1005004192606057","https://ae04.alicdn.com/kf/S1c80510034654569ae604858cd8a7094M.jpg",,"Rimocy Summer Retro Wedges Sandals Women 2022 Peep Toe Non-slip Casual Beach Shoes Ladies Comfortable Med Heel Sandalias Mujer","USD 20.43","USD 11.44","44%","USD","7","USD 0.80","60","80.0%","https://s.click.aliexpress.com/e/_Dcgrfl9",,,,,,
"1005003751330070","https://ae04.alicdn.com/kf/S3219f3d1149a49ea9e1592ac085a3d950.jpg",,"Lucyever 2022 Ankle Strap Platform Pumps Women Pu Leather Square Toe Mary Jane Shoes Woman Goth Thick High Heels Shoes Ladies","USD 41.66","USD 22.91","45%","USD","7","USD 1.60","313","94.0%","https://s.click.aliexpress.com/e/_DBKXkgR",,,,,,
"1005002673356375","https://ae04.alicdn.com/kf/Hdbdbe179dd514dd6a097cd223567af2bw.jpg","http://cloud.video.taobao.com/play/u/2675628091/p/1/e/6/t/1/316234776037.mp4","INS Office Lady Brand Square Toe Buckle Strappy Block Heel Platform Goth Elegant women's Pumps 2021 Summer Dress Party Footwear","USD 41.13","USD 24.68","40%","USD","7","USD 1.73","29","94.5%","https://s.click.aliexpress.com/e/_DDu4dXp",,,,,,
"1005001779450899","https://ae04.alicdn.com/kf/Hd4d4eed10cc54f44bbe8aec012252fc95.jpg","http://cloud.video.taobao.com/play/u/2675628091/p/1/e/6/t/1/287555564349.mp4","Eilyken 2023 New Ankle Buckle Strap Green High Heels Sandals Women's Pointed Toe Party Female Shoes Sandalias Mujer","USD 37.72","USD 18.48","51%","USD","7","USD 1.29","50","88.9%","https://s.click.aliexpress.com/e/_DC03eNp",,,,,,
"1005003744795571","https://ae04.alicdn.com/kf/S43b4a482332f439185a1c365aebacbe7f.jpg",,"Green Silk Bowtie High Heels Pumps for Women Sexy Pointed Toe Metal Stiletto Heels Wedding Party Shoes Woman 2022 Spring Bombas","USD 27.16","USD 14.94","45%","USD","7","USD 1.05","77","99.2%","https://s.click.aliexpress.com/e/_DEm7bNz",,,,,,
"1005004842402872","https://ae04.alicdn.com/kf/S0664649f5e9d446d8bba54af8c7cdc69X.jpg",,"Liyke Sexy Gold Crystal Ankle Cross Strap Sandals Women Summer Party Wedding Banquet Shoes Fashion Open Toe Club Stripper Heels","USD 43.19","USD 20.73","52%","USD","7","USD 1.45","121","94.0%","https://s.click.aliexpress.com/e/_DkdZIzh",,,,,,
"1005004354876555","https://ae04.alicdn.com/kf/Sfdb8856d4e4e44a5a7d1b814e24d5518y.jpg",,"Aphixta New 7cm Square Heel Patent Leather Shoes Women Pumps Dark Green Flowers Officile Pointed Toe Plus Size 49 50","USD 25.66","USD 13.60","47%","USD","9.0","USD 1.22","80","100.0%","https://s.click.aliexpress.com/e/_DEmfnWR",,,,,,
"1005003475444791","https://ae04.alicdn.com/kf/H24a631926595493ab2b2f262c0872b67b.jpg","http://cloud.video.taobao.com/play/u/2675628091/p/1/e/6/t/1/334227499114.mp4","Eilyken Spring Women Pumps Mesh Sandals Shoes Female Square Toe High Heel Lace Up Cross-tied Stiletto Hollow tacones de mujer","USD 36.65","USD 17.96","51%","USD","7","USD 1.26","128","93.3%","https://s.click.aliexpress.com/e/_DkKaGGP",,,,,,
"1005004177171823","https://ae04.alicdn.com/kf/Sb44665a5c2fa4b7c8f1b051d8656f6b38.jpg",,"Women Sandals Fashion High Heels Women's 2022 Summer New Korean Style Versatile Closed Toe Sandals Mary Jane Chunky Heel Pumps","USD 28.16","USD 14.36","49%","USD","7","USD 1.01","27","95.0%","https://s.click.aliexpress.com/e/_DdfqoNh",,,,,,
"1005004233920502","https://ae04.alicdn.com/kf/S5607c22a239741348fd2d408c6df43c75.jpg","http://cloud.video.taobao.com/play/u/2675628091/p/1/e/6/t/1/1100060402058.mp4","ZOKI Bling Gold Silver Women's Pumps 2022 Sexy Point Toe Thin Heel Party Wedding Shoes Woman Summer Ankle Strap High Heels Shoes","USD 24.92","USD 14.71","41%","USD","7","USD 1.03","160","98.8%","https://s.click.aliexpress.com/e/_DeHaEEb",,,,,,
"4000163179470","https://ae04.alicdn.com/kf/S700ff7aa8a984f879c35a1098e2dcfa3d.jpg","http://cloud.video.taobao.com/play/u/2675628091/p/1/e/6/t/1/1100105979732.mp4","Plus Size 32 43 Platform Catwalk Shoes Women Wedding Shoes Bride 2022 Shallow High Heels Platform Pumps Elegant Dress Court Shoe","USD 47.81","USD 31.07","35%","USD","8.0","USD 2.49","36","92.7%","https://s.click.aliexpress.com/e/_DlP8A0f",,,,,,
"1005004285628253","https://ae04.alicdn.com/kf/S50ba42770e414710bb4485ed30fcf852q.jpg","http://cloud.video.taobao.com/play/u/2675628091/p/1/e/6/t/1/1100050311408.mp4","2022 NEW Women Platform Pumps Satin Sandals BrandSexy Chunky Silk High Shoes Wedding Brides Rhinestone Heels","USD 31.44","USD 22.01","30%","USD","7","USD 1.54","26","91.1%","https://s.click.aliexpress.com/e/_Dly6UIT",,,,,,
"1005003891063104","https://ae04.alicdn.com/kf/S39ed1c606fb14a9683ea3fb6bb1b4f6bq.jpg","http://cloud.video.taobao.com/play/u/2675628091/p/1/e/6/t/1/287980393418.mp4","Stripper Heels Women Sandal Female Model T Station Catwalk Sexy Crystal Transparent Shoes High Heels Waterproof Head Sandals","USD 30.00","USD 20.40","32%","USD","7","USD 1.43","96","97.5%","https://s.click.aliexpress.com/e/_DmVsYkR",,,,,,
"4000302523799","https://ae04.alicdn.com/kf/Hb73ee2476fbd46edbae49c8abb399ad9J.jpg",,"Crystal Queen Large Size Women's White Lace High Heels Banquet Wedding Shoes Bridal Pointed Pumps Sweet Wild Single Sandals","USD 21.66","USD 21.66","0%","USD","7","USD 1.52","33","100.0%","https://s.click.aliexpress.com/e/_DDarx0T",,,,,,
"1005004104678665","https://ae04.alicdn.com/kf/S84bc6339dec3472c9a238ba5dccaea82s.jpg","http://cloud.video.taobao.com/play/u/2675628091/p/1/e/6/t/1/1100060407832.mp4","Rimocy Bling Shiny Crystal Pumps Women Sexy Pointed Toe Thin Heels Wedding Party Shoes Woman 2022 Ankle Strap High Heels Shoes","USD 28.23","USD 15.52","45%","USD","7","USD 1.09","23","91.4%","https://s.click.aliexpress.com/e/_Ddqazz9",,,,,,
"33055231510","https://ae04.alicdn.com/kf/Hf24ba97c475248509a41083808263addF.jpg",,"DiJiGirls 2021 New Womens Super High Heels Night Club Pumps 16 cm High-heeled Shallow Mouth Stiletto Patent Leather Single Shoes","USD 23.07","USD 23.07","0%","USD","7","USD 1.61","20","100.0%","https://s.click.aliexpress.com/e/_DBBWDGx",,,,,,
"1005003772496227","https://ae04.alicdn.com/kf/S5d6965310a3545968505992f8cd2ecffu.jpg","http://cloud.video.taobao.com/play/u/2675628091/p/1/e/6/t/1/344375062138.mp4","Luxury Women Pumps Transparent High Heels Sexy Pointed Toe Slip-on Wedding Party Brand Fashion Shoes for Lady PVC","USD 23.23","USD 16.26","30%","USD","7","USD 1.14","46","72.0%","https://s.click.aliexpress.com/e/_DeL8JZz",,,,,,
"1005001784695132","https://ae04.alicdn.com/kf/H379cd41a7f6547e98ab9ac90de263af6k.jpg","http://cloud.video.taobao.com/play/u/2675628091/p/1/e/6/t/1/287980393418.mp4","Crystal Show Stripper Heels Clear Shoes Women 2020 Platforms High Heels Sandals Female Transparent Sexy Wedding Shoes Slipper","USD 33.00","USD 23.76","28%","USD","7","USD 1.66","539","93.6%","https://s.click.aliexpress.com/e/_DcJdDXv",,,,,,
"1005003855712236","https://ae04.alicdn.com/kf/Sa14e6a5e4102425cb6000c0bb27821329.jpg","http://cloud.video.taobao.com/play/u/2675628091/p/1/e/6/t/1/346524317090.mp4","Large size women's pointed high heels casual breathable woven pointed shoes fashionable and beautiful square heel shoes new in 2","USD 26.00","USD 13.00","50%","USD","7","USD 0.91","246","96.5%","https://s.click.aliexpress.com/e/_DlPgwZh",,,,,,
"1005004836746234","https://ae04.alicdn.com/kf/S8d08e374fa7140d8931ef5e51341ef683.jpg",,"Elegant Women's High Heels Soft Leather Spring Autumn Pumps Low Heeled Shoes","USD 35.99","USD 19.43","46%","USD","8.0","USD 1.55","24","100.0%","https://s.click.aliexpress.com/e/_DDngAqx",,,,,,
"1005004066108394","https://ae04.alicdn.com/kf/Sd22c37879bdd466289662908bb516b39q.jpg","http://cloud.video.taobao.com/play/u/2675628091/p/1/e/6/t/1/353018574500.mp4","Women Summer Shoes 2022 New Fashion Pointed Toe Stiletto Medium Heel High Heels Women Back Empty Toe Sandals Green Women's Shoes","USD 22.07","USD 11.26","49%","USD","7","USD 0.79","46","94.3%","https://s.click.aliexpress.com/e/_DE5MYbl",,,,,,
"1005002354918892","https://ae04.alicdn.com/kf/H96381e95e4dc4e76afba8ef14aad8da8X.jpg","http://cloud.video.taobao.com/play/u/2675628091/p/1/e/6/t/1/303150170441.mp4","2021 Star style Luxury Rhinestones Women Sandals Elegant stiletto High heels Slingback Gladiator sandals Summer Party Prom shoes","USD 39.99","USD 23.99","40%","USD","7","USD 1.68","406","96.0%","https://s.click.aliexpress.com/e/_DFl9AJd",,,,,,
"1005004144692414","https://ae04.alicdn.com/kf/S7f7f4eb9d69f4f9cb1e4738e84f5eeb2H.jpg",,"Black Burgundy Mesh Velvet Pointed Toe Bling Crystal Rhinestone Hollow Pumps Women Shallow 6 8 10 CM High Heels Banquet Shoes","USD 99.98","USD 58.99","41%","USD","7","USD 4.13","30","100.0%","https://s.click.aliexpress.com/e/_Dmrhov1",,,,,,
"1005003892564278","https://ae04.alicdn.com/kf/Se1048851938547ba8488e64416c54e8bZ.jpg","http://cloud.video.taobao.com/play/u/2675628091/p/1/e/6/t/1/347874126722.mp4","New Cross-Strap Stripper Heels Girls Shoe for Party Club Women Sexy Show Sandals 15 17 CM High Heels Sexy Platform Sandals Pumps","USD 20.90","USD 13.17","37%","USD","7","USD 0.92","44","96.7%","https://s.click.aliexpress.com/e/_DnNNEVh",,,,,,
"1005003921743862","https://ae04.alicdn.com/kf/S407a5ae1a60d4858b8c6684907549e9f9.jpg","http://cloud.video.taobao.com/play/u/2675628091/p/1/e/6/t/1/349009703432.mp4","Rimocy Elegant Pointed Toe Crystal Bowtie Pumps Women Pearl Ankle Strap High Heels Shoes Woman White Slik Wedding Shoes Lady","USD 30.19","USD 16.60","45%","USD","7","USD 1.16","45","100.0%","https://s.click.aliexpress.com/e/_Dc6D9if",,,,,,
"1005003861743719","https://ae04.alicdn.com/kf/S63b64c3493284627b169fb885a5536c0V.jpg","http://cloud.video.taobao.com/play/u/2675628091/p/1/e/6/t/1/236154669474.mp4","Dance Shoes Women Brand New Sexy Strippers Catwalk Show Sandals 13 15 17 CM High Heels Platform Girls Shoe Party Club Drop Sales","USD 18.00","USD 13.14","27%","USD","7","USD 0.92","64","100.0%","https://s.click.aliexpress.com/e/_Dk3tYT5",,,,,,
"1005001879930055","https://ae04.alicdn.com/kf/Heb96f8c29b444d499138d0ac8dd1826fz.jpg","http://cloud.video.taobao.com/play/u/2675628091/p/1/e/6/t/1/290604840855.mp4","Aneikeh Spring/Autumn 2023 Women's Shoes Fashion Butterfly-Knot Narrow Band Bling Patchwork Cross-Tied Crystal Pointed Toe Pumps","USD 41.34","USD 21.50","48%","USD","9.0","USD 1.94","1826","88.7%","https://s.click.aliexpress.com/e/_DFuesdp",,,,,,
"1005003777163756","https://ae04.alicdn.com/kf/S4676ed5983bd4eaaaacdeb40ea5875a0a.jpg",,"Women High Heels Slippers Fashion Thin High Heels Sandals Woman Lace-up Slides Female Shoes Fashion Sandals Lady Party Shoes","USD 23.10","USD 11.78","49%","USD","9.0","USD 1.06","43","100.0%","https://s.click.aliexpress.com/e/_Dkzgpf1",,,,,,
"1005004685323786","https://ae04.alicdn.com/kf/Sb7d391e155074d7d899c67a123d83a7fD.jpg","http://cloud.video.taobao.com/play/u/2675628091/p/1/e/6/t/1/1100083976493.mp4","Women's large high-heeled shoes Multicolor pointy knit breathable comfortable anti-skid rubber sole work shoes 2023 new autumn","USD 27.00","USD 13.50","50%","USD","7","USD 0.94","68","97.8%","https://s.click.aliexpress.com/e/_DmdMFLh",,,,,,
"1005004826439906","https://ae04.alicdn.com/kf/S65f7086c19df4a74b4eb0091cc5fd5b4g.jpg",,"High Heels Women Wedding Shoes Bride Gold Heels Luxury Designer Elegant Party Sandals Dress Strip Pole Dance Sexy Silver Heels","USD 29.02","USD 14.51","50%","USD","8.0","USD 1.16","65","88.0%","https://s.click.aliexpress.com/e/_DCEFaj9",,,,,,
"1005001872766685","https://ae04.alicdn.com/kf/H73dd5ada56f2491ab4aceb323073fd9cl.jpg","http://cloud.video.taobao.com/play/u/2675628091/p/1/e/6/t/1/312664774551.mp4","Eilyken Summer Autumn Sexy Mesh Pumps Sandals Female Square Toe High Heel Lace Up Cross-tied Stiletto Hollow Dress Stripper Shoe","USD 38.60","USD 18.91","51%","USD","7","USD 1.32","80","80.0%","https://s.click.aliexpress.com/e/_DcgLxqf",,,,,,
"1005004492473473","https://ae04.alicdn.com/kf/Sb75475b100e04c18ba1e4799d9e142944.jpg",,"TRAF Woman Pumps Rhinestone High Heels Women Spring Summer 2022 Black Heeled Slingback Heels Sandals With Heel Shoes Pointe","USD 40.31","USD 24.19","40%","USD","7","USD 1.69","41","80.0%","https://s.click.aliexpress.com/e/_DdIBHaR",,,,,,
"1005004207803272","https://ae04.alicdn.com/kf/Scf8a7c1efd2746638841c29690ccd46ao.jpg",,"Women Pumps Hot Sale Black High Heels Shoes Sandals Summer 2022 New Party Sexy Thick Mules Shoes Slippers Ladies Wedding Zapatos","USD 18.43","USD 18.43","0%","USD","7","USD 1.29","441","92.2%","https://s.click.aliexpress.com/e/_DCoILnv",,,,,,
"1005004531045323","https://ae04.alicdn.com/kf/S9057aa2f0fd1484799b0af84c86602a07.jpg","http://cloud.video.taobao.com/play/u/2675628091/p/1/e/6/t/1/1100093594081.mp4","Lucyever Ankle Strap Thick Heels Pumps for Women 2023 Pu Leather Office High Heel Shoes Woman Elegant Platform Mary Jane Shoes","USD 26.39","USD 14.51","45%","USD","7","USD 1.02","27","92.0%","https://s.click.aliexpress.com/e/_DDaH41h",,,,,,
"4000009864540","https://ae04.alicdn.com/kf/S3fe310d5fcd6455a9d2a45777171b328Y.jpg","http://cloud.video.taobao.com/play/u/2675628091/p/1/e/6/t/1/231378947994.mp4","EilyKen Fashion Golden Rhinestone PVC Transparent Women Pumps Spring Autumn High Heels Sexy Party Wedding Pole Dance Shoes","USD 33.45","USD 20.40","39%","USD","7","USD 1.43","119","96.8%","https://s.click.aliexpress.com/e/_DDj0Fpz",,,,,,
"1005003127840519","https://ae04.alicdn.com/kf/H1fd5a6434f094e3f860dfc883d55af91u.jpg","http://cloud.video.taobao.com/play/u/2675628091/p/1/e/6/t/1/322122578805.mp4","2022 Women 7cm 9.5cm High Heels Sequins Glitter Luxury Designer Pumps Plus Size 43 Wedding Bridal Gold Valentine Scarpins Shoes","USD 26.79","USD 13.39","50%","USD","7","USD 0.94","89","100.0%","https://s.click.aliexpress.com/e/_DEC1mmb",,,,,,
"1005003909025431","https://ae04.alicdn.com/kf/Sa1d9c55713464db6a3f3f9c56100ecc4H.jpg","http://cloud.video.taobao.com/play/u/2675628091/p/1/e/6/t/1/1100096476778.mp4","AIYUQI 2023 spring  genuine leather shoes women elegant spike heels office lady Business dress  fashion big size women shoes","USD 62.34","USD 36.16","42%","USD","8.0","USD 2.89","31","100.0%","https://s.click.aliexpress.com/e/_DkKFnCT",,,,,,
"1005001890748254","https://ae04.alicdn.com/kf/H1dad5a8e02594709817f4835c4e24bc2C.jpg","http://cloud.video.taobao.com/play/u/2675628091/p/1/e/6/t/1/291203929734.mp4","Patent Leather Woman Pumps BIGTREE Shoes New High Heels Shoes Sexy Women Heels Pointed Toe Women Basic Pump Heels Plus Size 43","USD 26.72","USD 17.10","36%","USD","7","USD 1.20","43","100.0%","https://s.click.aliexpress.com/e/_DlPHCij",,,,,,
"32966492564","https://ae04.alicdn.com/kf/S9abe7a48741e4deba20310a4b14ce02dx.jpg",,"Rimocy high heels platform pumps women 2022 spring new fashion buckle solid black shoes woman PU leather waterproof shoes femme","USD 21.13","USD 16.06","24%","USD","7","USD 1.12","112","95.2%","https://s.click.aliexpress.com/e/_DFmlBu3",,,,,,
"1005004235227793","https://ae04.alicdn.com/kf/Sc8b859d3e0914100bc2b7975750e2a62T.jpg",,"Summer Party Women Sandals 2022 New Elegant Flowers Design High-heeled Stylish Light Breathable Stiletto Shoes Zapatos De Mujer","USD 20.00","USD 10.00","50%","USD","7","USD 0.70","166","97.8%","https://s.click.aliexpress.com/e/_DBcT52P",,,,,,
