"ProductId","Image Url","Video Url","Product Desc","Origin Price","Discount Price","Discount","Currency","Commission Rate","Commission","Sales180Day","Positive Feedback","Promotion Url","Code Name","Code Start Time","Code End Time","Code Value","Code Quantity","Code Minimum Spend"
"33011905093","https://ae04.alicdn.com/kf/HTB1nLK0UW6qK1RjSZFmq6x0PFXai.jpg","http://cloud.video.taobao.com/play/u/2675628091/p/1/e/6/t/1/244138412586.mp4","ACILICI1904030 New Fashion Silver Transparent Film Water Drill Chain High Heel Sandals Women Shoes","USD 47.99","USD 47.99","0%","USD","7","USD 3.36","27","100.0%","https://s.click.aliexpress.com/e/_Dcgv4rz",,,,,,
"1005001861127702","https://ae04.alicdn.com/kf/H67711bd5756d4b0b9a6734038a103a251.jpg","http://cloud.video.taobao.com/play/u/2675628091/p/1/e/6/t/1/290484914084.mp4","Women's High-heeled Shoes New Toe Monochrome Belt Buckle Fashion Single Shoes Pink Black Apricot Size 34 - 43","USD 22.56","USD 16.69","26%","USD","7","USD 1.17","22","100.0%","https://s.click.aliexpress.com/e/_DCEnmyf",,,,,,
"1005003315913949","https://ae04.alicdn.com/kf/H01df8683adb74e2c907062a47f41d34f9.jpg","http://cloud.video.taobao.com/play/u/2675628091/p/1/e/6/t/1/327981234427.mp4","Voesnees Sandals Women Shoes  Size 43 Thin Heels Summer Naked Color Peep Toe High Heels Sexy Nightclub Party Slides Heels Shoes","USD 28.00","USD 17.08","39%","USD","7","USD 1.20","29","95.0%","https://s.click.aliexpress.com/e/_DCKjmZZ",,,,,,
"1005003559794134","https://ae04.alicdn.com/kf/H73f03e82b2174b17b3da598ce65abd8bP.jpg",,"Summer Kids Leather Shoes Girls Wedding Dress Shoes Children Princess Flower Sandals For Girls Casual Dance Shoes Flat Sandals","USD 15.82","USD 9.81","38%","USD","8.0","USD 0.78","77","97.1%","https://s.click.aliexpress.com/e/_DCbwRKf",,,,,,
"1005004477999124","https://ae04.alicdn.com/kf/S9e6ceebd7b074ca5a399b2fcf548a7261.jpg",,"2022  new  Sexy Women Pumps  Buckles Pumps Peep Toe Super High Heels Rome Style Pumps Mature Lady Shoes  women shoes","USD 27.72","USD 13.31","52%","USD","7","USD 0.93","43","100.0%","https://s.click.aliexpress.com/e/_DczuwqF",,,,,,
"32946469040","https://ae04.alicdn.com/kf/HTB1aVwvXsvrK1Rjy0Feq6ATmVXaM.jpg",,"2022 New Elegant Pearl Metal Buckle High Heels Women Sandals Korean Fashion Soft Silk Pointed Ladies Shoes Party Sandals Shallow","USD 19.28","USD 10.99","43%","USD","8.0","USD 0.88","39","96.7%","https://s.click.aliexpress.com/e/_Dk0wj7h",,,,,,
"1005003309390514","https://ae04.alicdn.com/kf/Hd7097bf4d5524f04af98fe417906a556P.jpg","http://cloud.video.taobao.com/play/u/2675628091/p/1/e/6/t/1/327598870507.mp4","BIGTREE Shoes Designer New Women Pumps Pointed Toe High Heels Ladies Shoes Fashion Heels Pumps Sexy Party Shoes Plus Size 43","USD 27.94","USD 16.76","40%","USD","7","USD 1.17","500","94.3%","https://s.click.aliexpress.com/e/_DEWFaaF",,,,,,
"1005002419321671","https://ae04.alicdn.com/kf/S32f3c0117f084b9aa482144723f27dc3Y.jpg",,"2022 New Rhinestone Ruffles Open Toe Sandals High Heels Gladiator Stiletto Summer Crystal Slingbacks Black Shoes Woman","USD 12.52","USD 8.76","30%","USD","7","USD 0.61","45","88.0%","https://s.click.aliexpress.com/e/_DF7Gv8L",,,,,,
"1005003768925267","https://ae04.alicdn.com/kf/H99b4aa96d4a24d9cb7822ca01c98e084I.jpg","http://cloud.video.taobao.com/play/u/2675628091/p/1/e/6/t/1/343294316841.mp4","QSGFC Gold Comfortable Streamline Pointed Shoes Noble Ladies Stiletto Shoes Matching Bag Wedding Or A Pair Of Shoes","USD 50.88","USD 32.05","37%","USD","7","USD 2.24","196","93.8%","https://s.click.aliexpress.com/e/_DDDWveR",,,,,,
