"ProductId","Image Url","Video Url","Product Desc","Origin Price","Discount Price","Discount","Currency","Commission Rate","Commission","Sales180Day","Positive Feedback","Promotion Url","Code Name","Code Start Time","Code End Time","Code Value","Code Quantity","Code Minimum Spend"
"1005004233692010","https://ae04.alicdn.com/kf/Sf7e0f12ad09e493fa478577803c01439g.jpg",,"Kawaii Vintage Anime panda Print T Shirt Funny Men Summer Casual Short Sleeve Tshirts Male plus size Tops ropa y2k hombre Tees","USD 7.92","USD 3.56","55%","USD","9","USD 0.32","749","85.4%","https://s.click.aliexpress.com/e/_DFHYWWF",,,,,,
"1005003150779967","https://ae04.alicdn.com/kf/Hdcc9592abae54ec889291bd3445a37c14.jpg",,"SIMWOOD 2022 Autumn Winter New Letter Print Long Sleeve T-shirts Men 100% Cotton Pullovers Plus Size Brand Clothing","USD 31.33","USD 15.98","49%","USD","9","USD 1.44","265","98.6%","https://s.click.aliexpress.com/e/_DCQ65Yj",,,,,,
"1005003825923135","https://ae04.alicdn.com/kf/Scb5fa892ca0745da99903c71e1aa97a6h.jpg","http://cloud.video.taobao.com/play/u/2675628091/p/1/e/6/t/1/347934915508.mp4","SIMWOOD 2022 Spring Summer New Back Motorcycle Print T-shirts Men 100% Cotton Tops Loose  Plus Size Tees Tshirts","USD 33.79","USD 17.23","49%","USD","9","USD 1.55","118","99.3%","https://s.click.aliexpress.com/e/_Dex8Gq3",,,,,,
"1005004543750949","https://ae04.alicdn.com/kf/S3bd4d1c2d5124a908c9088c7929bab94s.jpg",,"Summer Men Shirts Casual Plus Size Shorts Sleeve T-shirts Man Male Shirt Collar T-shirt Polo for Men Lapel Polo Shirts S-5XL","USD 15.98","USD 7.99","50%","USD","9.0","USD 0.72","44","95.0%","https://s.click.aliexpress.com/e/_Dd6tnWP","493S8IA0EVLB","2022/11/18 00:00:00","2023/01/31 23:59:59","USD 1.00","7013","USD 2.00"
"1005001645903788","https://ae04.alicdn.com/kf/Sdb08212adc0644da8989b8a55e861a4fa.jpg","http://cloud.video.taobao.com/play/u/2675628091/p/1/e/6/t/1/284537559339.mp4","Modal Long Sleeve Women T Shirt 2022 Autumn Korean Round Neck Slim Top Solid Color Plus Size Basic TShirt Harajuku Soft","USD 9.99","USD 5.79","42%","USD","11.5","USD 0.67","107","98.4%","https://s.click.aliexpress.com/e/_DCxKwZp",,,,,,
"4000166468636","https://ae04.alicdn.com/kf/H5fa90d5cb3e5458dbf1879d76a083b909.jpg",,"Time Circuits T-Shirts Men Back To The Future Fiction Movie Tshirt Birthday Gift Cotton Tops Adult T Shirt Plus Size Sweatshirts","USD 13.95","USD 13.95","0%","USD","9","USD 1.26","33","100.0%","https://s.click.aliexpress.com/e/_DCEE4Vh",,,,,,
"1005004230465744","https://ae04.alicdn.com/kf/S8f13f8b6314b452d8184de59ab6a9f89P.jpg",,"New Summer Men's V Neck T Shirt Fitness Bodybuilding Tshirt High Street Short Sleeved Zipper Casual Cotton Top Plus Size S-5XL","USD 17.98","USD 8.99","50%","USD","9.0","USD 0.81","234","90.7%","https://s.click.aliexpress.com/e/_DFLFRYT",,,,,,
"1005004661327198","https://ae04.alicdn.com/kf/S2cc119f5ec4147ebb9be246dc7f253aes.jpg","http://cloud.video.taobao.com/play/u/2675628091/p/1/e/6/t/1/1100094134762.mp4","VONDA Plus Size Dress 2023 Women Long Maxi Sundress O-Neck Printed Casual Bohemian Robe Femme Lantern Sleeve Party Vestido 5XL","USD 26.67","USD 16.80","37%","USD","9.0","USD 1.51","486","86.6%","https://s.click.aliexpress.com/e/_DFTFCGr",,,,,,
"1005001556780609","https://ae04.alicdn.com/kf/H76ef90d5b3c945a5895edb8047988848X.jpg","http://cloud.video.taobao.com/play/u/2675628091/p/1/e/6/t/1/320925023618.mp4","Bikoles Spring Autumn Hooded Drawstring Women's Sweatshirt Dress Fashion Solid Pocket Package Hip Ladies Mini Dresses Plus Size","USD 13.61","USD 8.85","35%","USD","9","USD 0.80","227","88.8%","https://s.click.aliexpress.com/e/_DkJZwK7",,,,,,
"1005004291906394","https://ae04.alicdn.com/kf/S18d233eefee7466eb80c2aed9039e462I.jpg",,"VONDA Plus Size Summer Mini Dress 2022 Women Flare Sleeve Holiday Party A-Line Robe Stand Collar Casual Bow Ruffled Vestidos 5XL","USD 29.05","USD 18.30","37%","USD","9","USD 1.65","37","100.0%","https://s.click.aliexpress.com/e/_DmU7y0f",,,,,,
"1005003792756766","https://ae04.alicdn.com/kf/Hea0c57d7a0bf4d8f9cc1fe860480e4b0x.jpg",,"TOLEEN Chic Elegant Plus Size Maxi Dresses For Women 2022 Spring Luxury Bodycon Green Oversized Long Evening Party Prom Clothing","USD 67.98","USD 33.99","50%","USD","9","USD 3.06","136","95.8%","https://s.click.aliexpress.com/e/_DBbAp4F",,,,,,
"1005003098903610","https://ae04.alicdn.com/kf/S8fa9672e34ff4670af17e943c140d399G.jpg",,"Bohemian Plus Size Dress VONDA 2022 Women O-Neck Long Sleeve Satin Party Dress Vintage Casual Floral Printed Maxi Long Sundress","USD 28.11","USD 18.83","33%","USD","9.0","USD 1.69","160","91.3%","https://s.click.aliexpress.com/e/_Dk0Bf9N",,,,,,
"1005004857663625","https://ae04.alicdn.com/kf/S68a6a1fa39bb45ca92769aae8e3a5001U.jpg",,"Plus Size Women Dress Elegant Mesh Print Midi Party Dresses 2022 Autumn Lady Casual Slim Christmas Evening Outfits Blue 3XL 4XL","USD 43.98","USD 30.79","30%","USD","9.0","USD 2.77","40","100.0%","https://s.click.aliexpress.com/e/_De8KTKR",,,,,,
"1005002840471629","https://ae04.alicdn.com/kf/Hf48ae69406f54623ab6cca0efc63bbe6z.jpg","http://cloud.video.taobao.com/play/u/2675628091/p/1/e/6/t/1/1100069824260.mp4","2022 Plus Size Sequin Mesh Mermaid Slim Evening Dress Beaded Leaves Pattern Formal  Women Elegant Party Prom Gowns Short Sleeve","USD 54.98","USD 39.04","29%","USD","8.0","USD 3.12","245","93.5%","https://s.click.aliexpress.com/e/_DlatllH",,,,,,
"4001029582686","https://ae04.alicdn.com/kf/H2aae2370d914429cbdabf188ea8fa052X.jpg","http://cloud.video.taobao.com/play/u/2675628091/p/1/e/6/t/1/278558471510.mp4","2022 Spring Summer Knit Cartoon Embroidered Polo Dress Woman Plus Size Black Casual Knee-length Straight Dresses Female","USD 39.99","USD 22.79","43%","USD","9","USD 2.05","511","97.6%","https://s.click.aliexpress.com/e/_DmkIRnt",,,,,,
"1005003463493224","https://ae04.alicdn.com/kf/H1326804362c540c89c33ded92af242473.jpg",,"Women Plus Size Sequin Mesh Embroidery Mermaid  Evening Dress Formal Short Sleeve Elegant Party Prom Gowns 2020 New Long Dress","USD 49.98","USD 36.99","26%","USD","8.0","USD 2.96","66","98.6%","https://s.click.aliexpress.com/e/_DkEibG3",,,,,,
"1005004694528842","https://ae04.alicdn.com/kf/Sf4d6a5ee2c0544229dd005cbf8ae478e2.jpg",,"LW Plus Size Casual Half A Turtleneck Fold Design Shirt Dress Lantern Sleeve Loose Mock Neck Straight Drawstring Women Clothings","USD 27.60","USD 16.56","40%","USD","9","USD 1.49","53","90.8%","https://s.click.aliexpress.com/e/_DC9licP",,,,,,
"1005003241132594","https://ae04.alicdn.com/kf/Hed6431f547bc4dd5a56f046251f9d2e3j.jpg",,"2021 Autumn Print Vintage Turtleneck Wool Sweater Dresses Winter Casual 3XL Plus Size Knitting Sweaters Elegant Women Vestidos","USD 50.00","USD 31.00","38%","USD","9.0","USD 2.79","54","97.6%","https://s.click.aliexpress.com/e/_DExiQKT",,,,,,
"1005001565368787","https://ae04.alicdn.com/kf/H6b8555e6a88842349d278fb9dcf1ae740.jpg","http://cloud.video.taobao.com/play/u/2675628091/p/1/e/6/t/1/293481067268.mp4","U21O39 Plus Size 16 Light Blue Gray Pink Champagne Junior Bridesmaid Dresses Sweet Memory Wedding Party Dress Graduation Robes","USD 40.00","USD 18.40","54%","USD","7","USD 1.29","35","98.3%","https://s.click.aliexpress.com/e/_Dd6QQvh",,,,,,
"1005004294756076","https://ae04.alicdn.com/kf/S8194c7cbfade4bc0985e56a7ea45021dO.jpg",,"TOLEEN 2022 Summer Plus Size Maxi Dresses For Women Luxury Designer Purple Long Large Chic Elegant Evening Party Turkey Clothing","USD 75.98","USD 37.99","50%","USD","9","USD 3.42","80","99.5%","https://s.click.aliexpress.com/e/_DEZcAcX",,,,,,
"1005004398659644","https://ae04.alicdn.com/kf/S064fe6d350fe4b7c9e82d0629c842e84Y.jpg","http://cloud.video.taobao.com/play/u/2675628091/p/1/e/6/t/1/1100097625059.mp4","White Blazer Dress Plus Size 4XL V Neck See Through Long Sleeve High Waist Bodycon Button Up Mini Outfits for Women Office Party","USD 69.98","USD 36.39","48%","USD","9.0","USD 3.28","45","88.6%","https://s.click.aliexpress.com/e/_DCRXd7p",,,,,,
"1005004594448330","https://ae04.alicdn.com/kf/Sc20e17fd54034ca58a38b457b95fe4bdF.jpg",,"4XL 5XL Plus Size Dresses for Women Full Sleeve Bodycon High Waisted Mid Calf Elegant Evening Night Party Club Vestidos Mujer","USD 49.96","USD 21.98","56%","USD","9.0","USD 1.98","72","98.9%","https://s.click.aliexpress.com/e/_DmRg4hZ",,,,,,
"1005004682375681","https://ae04.alicdn.com/kf/Sff9cab3910144419a3780248189119c7o.jpg",,"New Year Sequins Sexy Hollow Bodycon Evening Party Elegant Plus Size Dresses for Women Autumn Winter Fashion Red Midi Dress Robe","USD 40.51","USD 24.31","40%","USD","10.0","USD 2.43","120","97.9%","https://s.click.aliexpress.com/e/_DFdkq3d",,,,,,
"1005004295394321","https://ae04.alicdn.com/kf/Sc37e639c37ac4e988cf9d6e361e6c404t.jpg",,"TOLEEN Women's Plus Size Large Maxi Dresses 2022 Summer Green Long Luxury Elegant Formal Muslim Evening Party Festival Clothing","USD 51.98","USD 28.59","45%","USD","9","USD 2.57","95","99.6%","https://s.click.aliexpress.com/e/_DEmcTwf",,,,,,
"1005004294864863","https://ae04.alicdn.com/kf/Scdd08bf0ae544146b61d0cc6397a7f454.jpg",,"TOLEEN Women's Plus Size Large Maxi Dresses 2022 Spring Luxury Designer Chic Elegant Long Sleeve Evening Party Festival Clothing","USD 73.98","USD 36.99","50%","USD","9","USD 3.33","93","97.3%","https://s.click.aliexpress.com/e/_DdyCTgx",,,,,,
"32994027573","https://ae04.alicdn.com/kf/HTB1fC0zNmzqK1RjSZPxq6A4tVXa9.jpg",,"Big size 9XL dress for Fat MM 2022 Women Summer Dress Loose pocket design solid plus size dresses women clothing dress vestidos","USD 18.56","USD 12.99","30%","USD","9","USD 1.17","30","100.0%","https://s.click.aliexpress.com/e/_DeweCH1",,,,,,
"1005004763112643","https://ae04.alicdn.com/kf/Sa73c8011689347819bf70068df30d0faD.jpg",,"TOLEEN Women's Plus Size Maxi Long Dresses 2022 Spring Autumn Luxury Chic Elegant Turkish African Evening Party Wedding Clothing","USD 53.98","USD 26.99","50%","USD","9","USD 2.43","21","100.0%","https://s.click.aliexpress.com/e/_DlOD0xd",,,,,,
"1005004496476964","https://ae04.alicdn.com/kf/S77eb44e14c2749249a14541d2063b02b4.jpg",,"TOLEEN Women Plus Size Large Maxi Dress 2022 Summer Luxury Chic Elegant Long Muslim Turkish Party Evening Festival Robe Clothing","USD 61.98","USD 30.99","50%","USD","9","USD 2.79","54","100.0%","https://s.click.aliexpress.com/e/_DCC1XeR",,,,,,
"1005004682502561","https://ae04.alicdn.com/kf/S64cd24d41f584abc8f0314a00ccf283f2.jpg",,"Plus Size Women Clothing Sexy Slit Mesh Patchwork Elegant Evening Party Ladies Dresses Autumn Fashion Solid Midi Dress Vestidos","USD 34.05","USD 20.43","40%","USD","13.0","USD 2.66","57","98.4%","https://s.click.aliexpress.com/e/_DBvRsEb",,,,,,
"1005004402993864","https://ae04.alicdn.com/kf/S89ca60d355dc4de38dbe0da4763898d9w.jpg",,"TOLEEN Women Plus Size Large Maxi Dresses 2022 Summer Luxury Designer Long Chic Elegant Evening Party Wedding Festival Clothing","USD 71.98","USD 35.99","50%","USD","9","USD 3.24","81","99.2%","https://s.click.aliexpress.com/e/_DebxK39",,,,,,
"32953112093","https://ae04.alicdn.com/kf/HTB1yajaXIrrK1RjSspaq6AREXXay.jpg",,"new Summer woman Loose Short sleeve Ruffles Chiffon dress Plus Size woman clothing vestidos S-5XL","USD 14.99","USD 14.99","0%","USD","9","USD 1.35","244","83.5%","https://s.click.aliexpress.com/e/_DkUbCF5",,,,,,
"1005004642163594","https://ae04.alicdn.com/kf/Sc18685675ad3476abfe577fa4cea487ey.jpg",,"Women Plus Size Dress Sexy Hollow Out Net Yarn Lace Sequins Fashionable Tassel Women Clothing Solid Color Club Party Dresses","USD 35.77","USD 21.46","40%","USD","12.0","USD 2.58","132","96.6%","https://s.click.aliexpress.com/e/_DC4BBR1",,,,,,
"1005004605458623","https://ae04.alicdn.com/kf/Sa8d7ad7c612548aa8874b074b31096beq.jpg",,"New Elegant Lace Mesh Plus Size Dresses Women Sexy Hollow Out Oversize Dress Loose Casual Vestidos De Fiesta Midi Robes Femme","USD 26.95","USD 17.52","35%","USD","9.0","USD 1.58","222","95.7%","https://s.click.aliexpress.com/e/_DCqRSpv",,,,,,
"1005003534550675","https://ae04.alicdn.com/kf/Sc8efb1b124dd40e796f860bd79828d90r.jpg","http://cloud.video.taobao.com/play/u/2675628091/p/1/e/6/t/1/338939542380.mp4","Black Velvet Dresses Sequined Patchwork Sheath Plus Size Embroidery Cocktail Evening Birthday Party Outfits for Ladies Winter","USD 62.98","USD 31.49","50%","USD","10.0","USD 3.15","38","100.0%","https://s.click.aliexpress.com/e/_Ddykfvz",,,,,,
"4000210440068","https://ae04.alicdn.com/kf/H77e4593fd0a64da49e5051254bb2035bA.jpg",,"Autumn Winter Dress Women Sexy Tight Snake Print Turtleneck Long Sleeve Elastic Dress Ladies Fashion Casual Bodycon Mini Dresses","USD 12.00","USD 7.20","40%","USD","9","USD 0.65","39","93.3%","https://s.click.aliexpress.com/e/_DdDGR1z",,,,,,
"1005003809104958","https://ae04.alicdn.com/kf/Hf7b51c467edd4af1b652a384bdfdbcecM.jpg",,"Plus Size Black Abaya Arabic Hijab Muslim Long Dress Turkish Dresses Abayas For Women Vestidos Kaftan Dubai Islamic Clothing","USD 30.00","USD 18.00","40%","USD","9","USD 1.62","28","90.0%","https://s.click.aliexpress.com/e/_DCMGsi7",,,,,,
"1005004770255969","https://ae04.alicdn.com/kf/Se5e251c8ec5f449dbf1cdae910f2d6f6n.jpg",,"TOLEEN Women's Plus Size Maxi Long Dresses 2022 Spring Autumn Luxury Chic Elegant Turkish African Evening Party Wedding Clothing","USD 57.98","USD 28.99","50%","USD","9","USD 2.61","37","95.6%","https://s.click.aliexpress.com/e/_DF9IdHN",,,,,,
"1005004336351166","https://ae04.alicdn.com/kf/Ace5f118eedef4f6e9155666be4393cdfL.jpg","http://cloud.video.taobao.com/play/u/2675628091/p/1/e/6/t/1/1100055183855.mp4","Plus Size Dresses Women Elegant Embroidery Evening Party Dress 2022 New Summer Blue Mesh Sleeveless Casual Dress Club Outfits","USD 28.56","USD 19.99","30%","USD","9","USD 1.80","144","94.4%","https://s.click.aliexpress.com/e/_DesoFRt",,,,,,
"1005004633556586","https://ae04.alicdn.com/kf/S3ef1f1ed2c304f208273287c859ec6420.jpg",,"Autumn Women Trend Printing Plaid X-shaped Plus Size Midi Dress Women's Fashionable Butterfly Sleeve Elegant Party Dresses Robe","USD 37.05","USD 22.23","40%","USD","10.0","USD 2.22","102","99.6%","https://s.click.aliexpress.com/e/_DkKaCWT",,,,,,
"1005001441299885","https://ae04.alicdn.com/kf/Hbe7e46e2f0f5477ea818ed4694765ba0x.jpg",,"Cheap Royal Blue Velvet Evening Dresses One Shoulder Formal Party Gown Long Maxi Dress Plus Size Special Occasion Gowns","USD 88.00","USD 37.84","57%","USD","8.0","USD 3.03","268","95.9%","https://s.click.aliexpress.com/e/_DBOIjAB",,,,,,
"4001149240314","https://ae04.alicdn.com/kf/Hff6a3fa496d44fb79f93fe8e96a9d0c0R.jpg",,"Women Casual V Neck Jeans Dress Knee Length Vintage Denim Elegant Vestidos plus size dress","USD 20.99","USD 20.99","0%","USD","9","USD 1.89","47","93.3%","https://s.click.aliexpress.com/e/_DFHUKND",,,,,,
"4000281604785","https://ae04.alicdn.com/kf/H157953d6f24a4997a1afd919013123a7G.jpg","http://cloud.video.taobao.com/play/u/2675628091/p/1/e/6/t/1/241621763796.mp4","New Spring Lace Appliques Wedding Dresses Long Sleeve Vestidos De Novia 2022 White V-Neck Princess Bride Wedding Gowns Plus Size","USD 84.40","USD 53.17","37%","USD","7","USD 3.72","220","96.0%","https://s.click.aliexpress.com/e/_Ddrsk6L",,,,,,
"1005004555789522","https://ae04.alicdn.com/kf/S93be8062a9f04b1cb3a390c870d4f0faQ.jpg",,"Plus Size Dress 2022 Summer New Fashion Temperament Commuter Print Elegant V-neck Bag Hip  Party Skirt Wholesale Drop Shipping","USD 45.60","USD 15.96","65%","USD","20.0","USD 3.19","25","100.0%","https://s.click.aliexpress.com/e/_DlbRu8X",,,,,,
"1005002318169329","https://ae04.alicdn.com/kf/H4c62484ac75a40ed8e41d038a4553c20v.jpg",,"Plus Size Summer Women Sexy Plaid Suspender Dress Fashion Backless Houndstooth Tight Bodycon Split Mini Dress","USD 4.20","USD 4.20","0%","USD","9","USD 0.38","36","95.0%","https://s.click.aliexpress.com/e/_De2P1XZ",,,,,,
"1005004402619195","https://ae04.alicdn.com/kf/Sa702c07cd38546588e1198d6e2d4da5et.jpg",,"Plus Size Women Flower Print Chiffon Sexy V Neck  Out Long Sleeve Dress Female Elegant  Party Dresses Wholesale DropShipping","USD 38.88","USD 17.50","55%","USD","20.0","USD 3.50","132","94.2%","https://s.click.aliexpress.com/e/_Dekp0m7",,,,,,
"1005004443092865","https://ae04.alicdn.com/kf/S1553400bc48f45fb81bd685bccef7eb6P.jpg",,"TOLEEN Women Plus Size Maxi Dresses 2022 Luxury Designer Chic Elegant Large Long Sleeve Evening Party Prom Wedding Robe Clothing","USD 89.98","USD 43.19","52%","USD","9","USD 3.89","90","99.4%","https://s.click.aliexpress.com/e/_DESzex9",,,,,,
"1005004603244211","https://ae04.alicdn.com/kf/Sbb8be087f1e04716a3d759d94f86ed55C.jpg",,"Plus Size Leopard Print Midi Dress Women One Shoulder 2022 Summer Elegant Oversized 4XL Casual Fashion Dresses Large Clothing","USD 28.13","USD 13.50","52%","USD","9","USD 1.22","20","80.0%","https://s.click.aliexpress.com/e/_DlyAchZ",,,,,,
"1005004420171931","https://ae04.alicdn.com/kf/S154abd4b5f244697a04b992285a11b240.jpg",,"Elegant Sequin Long Sleeve Plus Size Women Midi Dress Sexy Casual Evening Party Dresses Wedding Luxury Women Robe Rouge Vestido","USD 63.28","USD 32.27","49%","USD","9","USD 2.90","241","99.1%","https://s.click.aliexpress.com/e/_DB1Mpp5",,,,,,
"1005004898491800","https://ae04.alicdn.com/kf/Sdd914c6539bb4c2da7af918f78ba0b695.jpg","http://cloud.video.taobao.com/play/u/2675628091/p/1/e/6/t/1/1100103301607.mp4","Plus Size Green Evening Party Dress For Women 3XL Elegant Wedding Formal Clothing Simple Design Sequin Long Dresses Large Sizes","USD 67.92","USD 32.60","52%","USD","10.0","USD 3.26","39","96.0%","https://s.click.aliexpress.com/e/_DmdPZqJ",,,,,,
"1005004637725964","https://ae04.alicdn.com/kf/Sc84647db30554f22b1cfcdd654c6e54bF.jpg",,"Plus Size 5XL VONDA Bohemian Women Printed Maxi Dress Autumn Sexy V-Neck Bat Sleeve Long Party Robe Femme Casual Loose Sundress","USD 26.02","USD 16.39","37%","USD","9","USD 1.48","271","91.0%","https://s.click.aliexpress.com/e/_DnLyDFD",,,,,,
"1005004767766861","https://ae04.alicdn.com/kf/S14f25e2f84614688b8c4a9760623d438L.jpg",,"Summer Autumn Sexy Plus Size Sequins Beaded Evening Party Dresses Women Hollow Elegant Fashion Pencil Dress Oversized Vestido","USD 30.41","USD 18.25","40%","USD","9.0","USD 1.64","65","100.0%","https://s.click.aliexpress.com/e/_DmaQty7",,,,,,
"1005002962999143","https://ae04.alicdn.com/kf/Sc0561f6932314892b41305de1f629e86o.jpg","http://cloud.video.taobao.com/play/u/2675628091/p/1/e/6/t/1/1100037437809.mp4","2022 NEW Plus Size Dress  Robe De Soiree Sparkle Evening Dresses Long A-Line O-Neck Short Sleeve LONG Formal Dresses","USD 59.99","USD 42.59","29%","USD","8.5","USD 3.62","101","98.1%","https://s.click.aliexpress.com/e/_DBAzMth",,,,,,
"1005002686666462","https://ae04.alicdn.com/kf/S173a9314ac764d8289827ef7112deb60f.jpg","http://cloud.video.taobao.com/play/u/2675628091/p/1/e/6/t/1/326539667236.mp4","Fashion Long Sleeve Button Shirt+strap Dresstwo Piece Set Women Korean Style Plus Size 4xl Dress Suit Casual High Waist Dresses","USD 19.32","USD 11.59","40%","USD","9","USD 1.04","58","85.0%","https://s.click.aliexpress.com/e/_Dns8AFV",,,,,,
"1005004662572824","https://ae04.alicdn.com/kf/Seafcb407c78a4ce1a426bf2def2e5b4cY.jpg",,"TOLEEN Women Plus Size Maxi Dresses 2022 Luxury Chic Elegant Long Sleeve Embroidery Muslim Turkey Evening Party Wedding Clothing","USD 79.98","USD 39.99","50%","USD","9","USD 3.60","34","97.8%","https://s.click.aliexpress.com/e/_DBQO3gF",,,,,,
"1005004745661357","https://ae04.alicdn.com/kf/Sb6f632db40314302996845dd3a8bd09dN.jpg",,"Plus Size Pricness Girls Flower Dress Children Kids Long Floral Wedding Party Dresses Kids Princess Christmas Dress Clothing","USD 28.86","USD 18.18","37%","USD","9","USD 1.64","110","96.0%","https://s.click.aliexpress.com/e/_DBvKaHZ",,,,,,
"1005002176067137","https://ae04.alicdn.com/kf/S11ef02bbcb8f4204ba079d7504b4fefew.jpg","http://cloud.video.taobao.com/play/u/2675628091/p/1/e/6/t/1/1100079631301.mp4","Plus Size Evening Dresses Long XUCTHHC Elegant A Line V Neck Ruffles Chiffon Formal Wedding Party Dress Robe De Soiree 2021","USD 55.99","USD 39.19","30%","USD","8.0","USD 3.14","49","100.0%","https://s.click.aliexpress.com/e/_De0Upwr",,,,,,
"1005004642189761","https://ae04.alicdn.com/kf/Sd68f5bf51a8c4c8d993395d7eccec0989.jpg",,"Women Plus Size Dress Summer Autumn Street Sexi Fashionable Midi Dress Ladies V-neck Batwing Sleeve Lace Soft Women Clothes","USD 37.05","USD 22.23","40%","USD","12.0","USD 2.67","93","95.0%","https://s.click.aliexpress.com/e/_DmNNKxl",,,,,,
"1005003673350396","https://ae04.alicdn.com/kf/H769792d88f0f4c23b1f5c13795a2880dg.jpg",,"Plus Size 3xl Women Staight Leg Demin Pants Sexy Jeans High Cut Ladies Skinny Trouser Harajuku 2022 Spring New Fashion Pants","USD 34.27","USD 21.25","38%","USD","9.0","USD 1.91","0","null%","https://s.click.aliexpress.com/e/_DdnwYYJ",,,,,,
"1005003705370202","https://ae04.alicdn.com/kf/He631eb95e8ce417b964d0299dbe632f2u.jpg",,"2022 New Arrival High Quality Elastic Slim Jeans Men ,men's Skiny Jeans ,grey Jeans Men,plus-Size 28-40 11 Choices High Quality","USD 30.38","USD 15.19","50%","USD","9.0","USD 1.37","5","100.0%","https://s.click.aliexpress.com/e/_DE84DcF",,,,,,
"1005002318802868","https://ae04.alicdn.com/kf/H74652c37f37c4d298392566066876708A.jpg",,"Plus Size Men Jeans Sexy Demin Pants 2021 Motorcycle Pants Male Zipper Pockets Trouser New Patchwork Hole Ripped Hip Hop Pant","USD 32.28","USD 18.40","43%","USD","9.0","USD 1.66","0","null%","https://s.click.aliexpress.com/e/_DneztRD",,,,,,
"1005003979857077","https://ae04.alicdn.com/kf/Sa4aaa14bb6ae4c8f8b225eba937e0926z.png","http://cloud.video.taobao.com/play/u/2675628091/p/1/e/6/t/1/349989050054.mp4","Ripped Denim Shorts for Men Summer Ins Fashion Five-Point Pants Vintage Jeans Streetwear Male Trousers Casual Bottoms Plus Size","USD 25.93","USD 13.74","47%","USD","9.0","USD 1.24","10","100.0%","https://s.click.aliexpress.com/e/_DFZw9tV",,,,,,
"1005003501099958","https://ae04.alicdn.com/kf/S7ab2d811b8ae43468ec81cc4d658429fz.jpg",,"Ladiguard Plus Size Men Fashion Mid Waist Crimping Denim Shorts Light Blue Vintage Hole Ripped Short Jeans Male Summer Hotpants","USD 39.20","USD 22.35","43%","USD","9.0","USD 2.01","0","null%","https://s.click.aliexpress.com/e/_DmwyKMr",,,,,,
"1005004525634855","https://ae04.alicdn.com/kf/Hc5ed2be9ed8142bea7b9caf5b91b4c095.jpg",,"Ropa Hombre 2022 Men's New Camouflage Jeans Fashion Slim Fit Male Denim Trousers Hip Hop Plus Size Skinny Mannen Jeans Man Pants","USD 53.43","USD 26.72","50%","USD","9","USD 2.40","0","null%","https://s.click.aliexpress.com/e/_DnFh4qL",,,,,,
"1005004463118495","https://ae04.alicdn.com/kf/S283bcc8a972040bfb168cd443a4ce16cQ.jpg","http://cloud.video.taobao.com/play/u/2675628091/p/1/e/6/t/1/1100064138303.mp4","Four Seasons Men's Jeans Trend Hip Hop Straight Loose Wide Leg Pants Skateboard Pants Street Men Plus Size Trousers Ins Hot Sale","USD 77.69","USD 23.31","70%","USD","9.0","USD 2.10","0","null%","https://s.click.aliexpress.com/e/_Dnb9QRV",,,,,,
"1005005052139194","https://ae04.alicdn.com/kf/Sfe298ef2437b4764b52dc47e4a26ea24y.jpg",,"3D Printed Stretch Jeans Men's Personalized Casual Men Slim Fit Denim Pants Fashion Trousers Plus Size Male Slacks 28-38 40 42","USD 37.30","USD 18.65","50%","USD","9","USD 1.68","0","null%","https://s.click.aliexpress.com/e/_DEL1SwF",,,,,,
"1005003702282418","https://ae04.alicdn.com/kf/Sb5f98bfb51284756b242667299ff3d28x.jpg",,"ICCLEK  New Jeans Ripped Jeans Men's Jeans Straight Loose Pants Casual Pants Distressed Jeans  Plus Size Jeans  Denim Jeans","USD 36.00","USD 18.36","49%","USD","9.0","USD 1.65","0","null%","https://s.click.aliexpress.com/e/_DeFVSgr",,,,,,
"4001122896571","https://ae04.alicdn.com/kf/H017c878f3fe742989901ba6ceb85405b2.jpg",,"3xl Men Solid Color Mid Rise Elastic Pockets Drawstring Long Pant Breathable Trousers Casual Men's Clothing Streetwear Plus Size","USD 7.78","USD 4.05","48%","USD","9","USD 0.36","16","100.0%","https://s.click.aliexpress.com/e/_DB6h3rh",,,,,,
"1005004815770654","https://ae04.alicdn.com/kf/Sde0f6412d067413ab77e357e0c2f283fA.jpg",,"Plus Size Men Baggy Cargo Jeans Multiple Pockets Zipper Fly Loose Straight Wide Leg Pants Autumn Denim Trousers Streetwear","USD 8.34","USD 5.84","30%","USD","9","USD 0.53","0","null%","https://s.click.aliexpress.com/e/_DmFV2Nh",,,,,,
"32950549670","https://ae04.alicdn.com/kf/HTB1EgxLXPzuK1RjSsppq6xz0XXal.jpg",,"XXXL Plus Size Jeans Boyfriend Black Jeans Mujer Low Waist Zipper Open Crotch Denim Jean Femme Sexy Leggins Trousers Women Pants","USD 24.60","USD 19.19","22%","USD","9","USD 1.73","7","100.0%","https://s.click.aliexpress.com/e/_Ddk7nZ5",,,,,,
"1005004032721782","https://ae04.alicdn.com/kf/Scc5e12fc4c4c48dd9cf99b149d21e0a6K.jpg",,"Ladiguard Plus Size Mens Jeans Demin Pants 2022 Summer New Hip Hop Pants Fashion Zipper Pockets Trouser Mens Patchwork Camo Pant","USD 60.98","USD 34.76","43%","USD","9.0","USD 3.13","0","null%","https://s.click.aliexpress.com/e/_DDTsGsr",,,,,,
"1005004525668329","https://ae04.alicdn.com/kf/Hbe7d112faed646888feeb86006ce81f3P.jpg",,"2022Autumn New Mens Camouflage Denim Trousers Fashion Slim Fit Male Jeans Hip Hop Plus Size Skinny Jeans Man Homme Pantalones 바지","USD 53.43","USD 26.72","50%","USD","9.0","USD 2.40","0","null%","https://s.click.aliexpress.com/e/_DFAAXAJ",,,,,,
"1005004674509620","https://ae04.alicdn.com/kf/See5072b2c72349beb396353c1f65f3d7C.jpg",,"American Denim Jeans Men's Retro Loose Straight Plus Size Jeans for Men Tide Brand Casual Washed Cargo Pants City Boy Streetwear","USD 45.50","USD 27.30","40%","USD","9","USD 2.46","0","null%","https://s.click.aliexpress.com/e/_DkEoO6b",,,,,,
"1005005100595887","https://ae04.alicdn.com/kf/S463982628b48483a93a0530807a2c2120.jpg",,"2022New Autumn Spring Summer Ankle-Length Baggy Jeans Men Streetwear Jogger Jeans Denim Harem Pants Plus Size Male Cargo pants","USD 24.81","USD 9.92","60%","USD","40.0","USD 3.97","0","null%","https://s.click.aliexpress.com/e/_DeiYUjz",,,,,,
