"ProductId","Image Url","Video Url","Product Desc","Origin Price","Discount Price","Discount","Currency","Commission Rate","Commission","Sales180Day","Positive Feedback","Promotion Url","Code Name","Code Start Time","Code End Time","Code Value","Code Quantity","Code Minimum Spend"
"1005002844164620","https://ae04.alicdn.com/kf/H4f11eb19ea654db39ef0c1b675694ac1O.jpg",,"Plus Size 3xl Women Casual Halter Shirt Leopard Print Blouse Summer Chiffon Shirt Sleeveless Basic Tops Femme Clothing  2021","USD 18.58","USD 10.96","41%","USD","9.0","USD 0.99","0","null%","https://s.click.aliexpress.com/e/_Ddpu4Ij",,,,,,
"1005004939595303","https://ae04.alicdn.com/kf/Se696836a43314699b3984ab37af8e772t.jpg",,"Trendy Spring Blouse  Ruffle Loose Lady Spring Shirt  Plus Size Women Shirt","USD 11.42","USD 6.28","45%","USD","9","USD 0.57","0","null%","https://s.click.aliexpress.com/e/_DB74ISb",,,,,,
"1005003251189317","https://ae04.alicdn.com/kf/H08966fc3ec98473b92536394f466e6507.jpg",,"Plus Size Women Clothing T Shirt Vintage Flower Printed Tops Pullovers Harajuku Shirts Casual Loose O-Neck Tops Women Blouses","USD 19.98","USD 9.99","50%","USD","9.0","USD 0.90","0","0.0%","https://s.click.aliexpress.com/e/_DB3nC6T",,,,,,
"1005003320289510","https://ae04.alicdn.com/kf/H316e26d2bf22411590c44df32e17e1ffj.jpg",,"Sexy V Neck Button Chiffon Shirt Autumn Spring Vintage Printed Shirts Blouses Women Plus Size 5XL Tops Sweet Long Sleeve Blouse","USD 17.12","USD 10.44","39%","USD","9","USD 0.94","0","null%","https://s.click.aliexpress.com/e/_DEUoj95",,,,,,
"1005004165064706","https://ae04.alicdn.com/kf/Sbcc3dc6b7afc48f2bdf496db90a22c33G.jpg",,"Fashion Off Shoulder Tops Sexy Lace Sleeve Patchwork Loose Blouses Tops Casual Plus Size Zipper V Neck Female Tunic Tops T-shirt","USD 5.99","USD 5.33","11%","USD","9","USD 0.48","0","null%","https://s.click.aliexpress.com/e/_DEjd9Xt",,,,,,
"1005003421013101","https://ae04.alicdn.com/kf/H03ff466b13a64562a64a9f98d243ed6ay.jpg",,"Women Plus Size Tie-dye Printed Gradient Pullover Long Sleeve Sweatshirt Top Fashion Casual Sweatshirt Top Female Outwear","USD 17.23","USD 10.51","39%","USD","9","USD 0.95","0","null%","https://s.click.aliexpress.com/e/_DEHbtH5",,,,,,
"1005004947052187","https://ae04.alicdn.com/kf/S129692e1218f4e4ca92a384ea16a36ddm.jpg",,"Trendy Women Shirt Flower Print Casual Plus Size Long Sleeves Lady Spring Shirt  Oversized Autumn Blouse Female Clothes","USD 10.22","USD 6.64","35%","USD","9","USD 0.60","0","null%","https://s.click.aliexpress.com/e/_DF9hJ8L",,,,,,
"1005004481978595","https://ae04.alicdn.com/kf/S35f76eb6ff094f168273d2dd8faa285fw.jpg",,"Fashion Women Summer Elegant V Neck Oversized Plus Size Top Lady Casual Solid Long Sleeve Loose Fit Blouse 2022 New","USD 17.35","USD 10.06","42%","USD","9","USD 0.91","0","null%","https://s.click.aliexpress.com/e/_DFJNuSb",,,,,,
"10000279840118","https://ae04.alicdn.com/kf/H5f9f7090d83144cf990f577c47540682L.jpg",,"Women'S Shirt New Layered Trumpet Plus Size Women V Neck Polka Dot Shirt Tops Long Sleeve Loose Blouse Ladies Tops","USD 10.45","USD 5.85","44%","USD","9","USD 0.53","0","0.0%","https://s.click.aliexpress.com/e/_DEAJUVt",,,,,,
"1005004817978283","https://ae04.alicdn.com/kf/S37de2d9706c94aac9b595665a05e0daci.jpg",,"Fashion Women's Blouse Tops Summer Sleeveless Chiffon Shirt Solid Casual Button-embellished Crew Neck Plus Size Tank Top","USD 18.74","USD 9.37","50%","USD","9","USD 0.84","0","null%","https://s.click.aliexpress.com/e/_DDwwRdV",,,,,,
"1005002632540334","https://ae04.alicdn.com/kf/S2920cc51e3434cfdbfb18ae3051a40e5L.jpg",,"Autumn Slash Neck Blouse Plus Size Long Blouses Shirt 2023 Off Shoulder Tops For Women Irregular Kimono Hem Cape Korean Clothing","USD 10.49","USD 6.29","40%","USD","9","USD 0.57","0","null%","https://s.click.aliexpress.com/e/_DBuIb6P",,,,,,
"1005001860194296","https://ae04.alicdn.com/kf/H6baf7398e00d449f988d2a6b29fb475aA.jpg",,"Women Sexy Solid Color Lace Patchwork Deep V Neck Short Sleeve Blouse Shirt Top Plus Size Basic Tops Blouse All-match Tops","USD 6.04","USD 4.77","21%","USD","9","USD 0.43","17","88.0%","https://s.click.aliexpress.com/e/_Dnt4POJ",,,,,,
"1005004547818825","https://ae04.alicdn.com/kf/H0aff3ed750504f4ebab94686bea5b058V.jpg",,"Off Shoulder Blouses Women Plus Size Printed Women Top Fashion Women Button Puff Short Sleeve Shirt Chemise Femme","USD 6.19","USD 4.15","33%","USD","9","USD 0.37","0","null%","https://s.click.aliexpress.com/e/_DmMvLgb",,,,,,
"1005004017334639","https://ae04.alicdn.com/kf/Sc454019033ed4b04a501154ff980f674F.jpg",,"Casual Long Sleeve Birds Print Loose Shirts Women Cotton And Linen Blouses 2022 Female Vintage Streetwear Plus Size Tops Blusa","USD 13.07","USD 7.84","40%","USD","9","USD 0.71","0","0.0%","https://s.click.aliexpress.com/e/_DkceZKB",,,,,,
"1005002762892912","https://ae04.alicdn.com/kf/H0591658d65fc48bca0e65229df59f8ecX.jpg",,"Women Polka Dot Blusas Shirts  Spring Fashion O Neck Long Sleeve Blouse Femininas Casual Tops Plus Size 4XL 5XL Shirt","USD 8.12","USD 5.28","35%","USD","9","USD 0.48","0","null%","https://s.click.aliexpress.com/e/_DeuCMXV",,,,,,
"1005005074722343","https://ae04.alicdn.com/kf/S9f8351037ce8425980b60584aa14f62cl.jpg",,"Fashion Women's Blouse Tops Summer Sleeveless Chiffon Shirt Solid Casual Button-embellished Crew Neck Plus Size Tank Top","USD 18.74","USD 9.93","47%","USD","9","USD 0.89","0","null%","https://s.click.aliexpress.com/e/_Dcf7d1N",,,,,,
"1005003193261509","https://ae04.alicdn.com/kf/H44b22b3cfc4e4bd5af4987fe114d0ee08.jpg",,"Women Casual Shirt Summer Plus Size Short Ruffles Sleeves Bow Neck Polka Dot Female Loose Shirt Streetwear Fashion","USD 8.94","USD 5.36","40%","USD","9","USD 0.48","0","null%","https://s.click.aliexpress.com/e/_DEd6pIf",,,,,,
"1005004571833104","https://ae04.alicdn.com/kf/Sdbff44ab39094cb181b7432e7aa99224c.jpg",,"Fashion Women's Blouse Tops Summer Sleeveless Chiffon Shirt Solid Casual Button-embellished Crew Neck Plus Size Tank Top","USD 18.74","USD 10.12","46%","USD","9","USD 0.91","0","null%","https://s.click.aliexpress.com/e/_Dkpadnp",,,,,,
"1005003983792930","https://ae04.alicdn.com/kf/S2fc75e490a594a55aae09f770ca7853dz.jpg","http://cloud.video.taobao.com/play/u/2675628091/p/1/e/6/t/1/349117008175.mp4","Color Block Hot Drill Letters Printed Summer Woman Blouses 2022 Retro Patchwork Fashion Plus-size 3XL Short Sleeve Women's Shirt","USD 16.60","USD 11.62","30%","USD","9","USD 1.05","0","null%","https://s.click.aliexpress.com/e/_DCQWDPh",,,,,,
"1005004724835405","https://ae04.alicdn.com/kf/S88b9dc2ba7954934a45b3417f174bdb1B.jpg",,"Women's shirt spring and summer Irregular Hem Plus Size Women Shirt Waist Tight Adjustable Belt Pullover Shirt Top Female","USD 6.34","USD 6.34","0%","USD","9","USD 0.57","0","null%","https://s.click.aliexpress.com/e/_DkpXGST",,,,,,
"1005001855947533","https://ae04.alicdn.com/kf/H2f7b30f4ba804788a697fcf22b69bec3G.jpg",,"Women Autumn Long Sleeve O Neck Solid Color Ripped Hole Loose Blouse T-shirt Plus Size Female Top Pullover","USD 2.53","USD 1.49","41%","USD","9","USD 0.13","0","null%","https://s.click.aliexpress.com/e/_DFypiJ5",,,,,,
"1005003606522148","https://ae04.alicdn.com/kf/H8cded3d73304490cb54234898095a765J.jpg",,"Women Blouses Office Lady Oversize Plus Size Tops Lace Transparent Long Sleeve 2022 Spring Summer Korean Fashion Office Shirts","USD 8.09","USD 6.31","22%","USD","9","USD 0.57","0","null%","https://s.click.aliexpress.com/e/_DlSxL2r",,,,,,
"1005004133964213","https://ae04.alicdn.com/kf/Se14b3bdf892a4f4cbfbb88e81aa05b1fF.jpg",,"Plus Size Women's Chiffon Blouses Shirt Women's Spring Autumn Style Knitted Button Long Sleeve Solid Color Lace Patchwork Tops","USD 24.67","USD 12.58","49%","USD","10.0","USD 1.26","0","null%","https://s.click.aliexpress.com/e/_DEzrPg3",,,,,,
"1005002970331996","https://ae04.alicdn.com/kf/H73e62032607748ae8590a49c97fb089fw.jpg",,"Women Polka Dot Blusas Shirts Spring Fashion O Neck Long Sleeve Blouse Femininas Casual Tops Plus Size Shirt 2021 New","USD 9.52","USD 9.52","0%","USD","9","USD 0.86","0","null%","https://s.click.aliexpress.com/e/_DDEyBh9",,,,,,
"1005003986352886","https://ae04.alicdn.com/kf/S37344507da6d43719ee84d6aca1bbc9de.jpg",,"Plus Size 3xl Ladies Elegant Fashion Plaid Shirt Blusas Sexy Women's Tops Pullovers 2022 Summer New Casual Loose Vintage Blouse","USD 20.40","USD 11.01","46%","USD","9","USD 0.99","0","null%","https://s.click.aliexpress.com/e/_DCagy9p",,,,,,
"1005002679725844","https://ae04.alicdn.com/kf/H5bc6edd31c344c7996db1ad867bb609dZ.jpg",,"Plus Size Turtleneck Cotton Women V Neck Chiffon Blouses 2021 Casual Blouse Top Solid Color Top Short Sleeve Women's Pullover","USD 5.38","USD 2.64","51%","USD","9","USD 0.24","2","92.0%","https://s.click.aliexpress.com/e/_DBp5YVZ",,,,,,
"1005001899817234","https://ae04.alicdn.com/kf/H3f92c0814e774ea59dc899975c914918W.jpg",,"OL Work Wear White Blue Blouse Plus Size Long Sleeve Turn-down Collar Formal Elegant Ladies Female Shirt Ladies Tops School","USD 9.70","USD 7.37","24%","USD","9","USD 0.66","0","null%","https://s.click.aliexpress.com/e/_DFeDe51",,,,,,
"1005004004597840","https://ae04.alicdn.com/kf/Scf6582db69374245b325d1e657b0783af.jpg",,"New Chic Shirts 2022 New Summer Women Blouses And Tops Elegant V-Neck Short Sleeve Loose Plus Size O-Neck Casual Ladies Blouse","USD 19.58","USD 11.75","40%","USD","9","USD 1.06","0","0.0%","https://s.click.aliexpress.com/e/_DmuCk4R",,,,,,
"4001066162858","https://ae04.alicdn.com/kf/Hd1584dff47864b2691bc6ea187b125c9q.jpg",,"Fashion Women'S Flare Sleeve Loose Polka Dot Shirt Ladies Casual Blouse Tops Office Ladies Shirt Blouse Plus Size","USD 14.00","USD 8.40","40%","USD","9","USD 0.76","0","null%","https://s.click.aliexpress.com/e/_DlVwb7h",,,,,,
"1005004296780926","https://ae04.alicdn.com/kf/Sb571c65175ec4f09913a163736be6343b.jpg",,"Summer Boho Lace Blouse Women Sleeveless Tank Tops Plus Size Beachwear Holiday Loose Ladies Backless Shirts Casual Camis Blusa","USD 8.51","USD 4.94","42%","USD","9","USD 0.44","0","null%","https://s.click.aliexpress.com/e/_DmOW5tH",,,,,,
"1005003891300693","https://ae04.alicdn.com/kf/Saa42da489bfb414d9cad464b4e50292f6.jpg",,"Plus Size 3xl Ladies Elegant Fashion 3D Print T-shirt Women's Sexy V-neck Chiffon Top Pullovers 2022 Summer Loose shirt Clothing","USD 19.75","USD 10.66","46%","USD","9.0","USD 0.96","0","null%","https://s.click.aliexpress.com/e/_DdHyA0R",,,,,,
"1005003431604911","https://ae04.alicdn.com/kf/H13d4deffefad40c4884ca6a322fa3dfet.jpg",,"Fashion Strapless Long Sleeve T-shirt Women Sleeve Print Loose Plus Size Tops Spring Lantern Tee Lugentolo dropshipping","USD 14.83","USD 9.05","39%","USD","9","USD 0.81","0","null%","https://s.click.aliexpress.com/e/_DlP8a2j",,,,,,
"1005003435987316","https://ae04.alicdn.com/kf/H323fb71dbe814c93b4333cfd500f5411e.jpg",,"Cashiona Plus Size Women Fashion Shirt Blouse Long Sleeve Open Stitch Top Streetwear Ladies Hollow Out Shirts blusas Femme 3XL","USD 21.36","USD 12.60","41%","USD","9","USD 1.13","0","null%","https://s.click.aliexpress.com/e/_DCUS9Kr",,,,,,
"1005003891389515","https://ae04.alicdn.com/kf/S383eeff694a54030a3a345734be21266P.jpg",,"Plus Size 4xl 5xl Ladies Elegant Fashion Dots T-shirt Sexy V-neck Top Women's Pullovers 2022 Summer Casual Loose shirts Clothing","USD 23.50","USD 12.69","46%","USD","9.0","USD 1.14","0","null%","https://s.click.aliexpress.com/e/_DEfu0gJ",,,,,,
"1005004286406662","https://ae04.alicdn.com/kf/S787ccb7db6c3400bbb95fe2fb35715a27.jpg",,"Fashion Plaid Shirt Printed Lapel Button Short Sleeve Chiffon Blouse Summer Plus Size Commute Tops Loose Casual Women Clothing","USD 23.68","USD 12.08","49%","USD","9.0","USD 1.09","2","60.0%","https://s.click.aliexpress.com/e/_DC743zV",,,,,,
"1005002442585325","https://ae04.alicdn.com/kf/Hed4646b7f9b44e04824d89dccdaa1531U.jpg",,"Elegant Women Off Shoulder Blouse Summer Fashion Solid Color Pleated Chiffon Sexy Shirt Office Street Tops Blouses Plus size","USD 5.78","USD 3.41","41%","USD","9","USD 0.31","0","null%","https://s.click.aliexpress.com/e/_Dnnr8dD",,,,,,
"4001238087823","https://ae04.alicdn.com/kf/Hf835a307580a4b9fac1156c66c47c07c8.jpg",,"2022 Fashion White Blue Solid Long Sleeve Turn-down Collar Formal Elegant Women Shirt Ladies Tops School Blouse Plus Size","USD 8.76","USD 5.78","34%","USD","9","USD 0.52","6","100.0%","https://s.click.aliexpress.com/e/_DkXT3AR",,,,,,
"32917938034","https://ae04.alicdn.com/kf/HTB13kJbKr1YBuNjSszeq6yblFXar.jpg",,"2018 Spring Long Sleeve Blouses Shirt Office Lady Cotton Lace up Shirt Tunic Casual Tops Plus Size Blusas Women Plaid Shirts","USD 23.38","USD 15.20","35%","USD","9","USD 1.37","0","0.0%","https://s.click.aliexpress.com/e/_DkdBVVV",,,,,,
"4000341283443","https://ae04.alicdn.com/kf/H2d30157795364bd7aa030c558fbe3a5aj.jpg",,"Fashion Women Halter Choker Leopard Blouse Shirts Tops Ladies Casual Long Sleeve Print Plus Size Blouses Shirts Fashion Clothes","USD 13.72","USD 9.19","33%","USD","9","USD 0.83","5","100.0%","https://s.click.aliexpress.com/e/_DdXjidp",,,,,,
"1005002475631546","https://ae04.alicdn.com/kf/H7c3ca8efdd964c0d8b9970f87c51d1979.jpg",,"Women Latest Casual Shirt Vintage Print Blouse Long Sleeve Summer Top Plus Size Womens Elegant blusas Tunic Sexy Femme Clothing","USD 19.01","USD 11.22","41%","USD","9","USD 1.01","0","null%","https://s.click.aliexpress.com/e/_Dmv676f",,,,,,
"1005003760760605","https://ae04.alicdn.com/kf/Saa3d8aa76f1949b584cfed187a88d93ai.jpg",,"Women Shirts Spring White Black Loose Oversized Lady Long Sleeve Shirt Two Pockets Plus Size Top Casual Turndown Collar Blouses","USD 32.85","USD 16.75","49%","USD","9.0","USD 1.51","0","null%","https://s.click.aliexpress.com/e/_DkFJkEj",,,,,,
"1005004286467254","https://ae04.alicdn.com/kf/S25d870091cd24c46b60410ed53ff61c6B.jpg",,"Vintage Oversized Loose Print Tee O Neck Aesthetic Short Sleeved T-shirt Womens 2022 Summer Plus Size Y2k Top Tshirt 2022 New","USD 5.02","USD 2.56","49%","USD","25.0","USD 0.64","59","77.1%","https://s.click.aliexpress.com/e/_DElQrh9",,,,,,
"1005003369768146","https://ae04.alicdn.com/kf/H699f7f41aca548fea2d333a675892855U.jpg",,"2021 Summer New casual  t-shirt men crossfit hip hop streetwear black tshirt artist print plus size 100% cotton Male Camisetas","USD 18.31","USD 11.90","35%","USD","9","USD 1.07","27","100.0%","https://s.click.aliexpress.com/e/_DktqFEn",,,,,,
"1005004439999468","https://ae04.alicdn.com/kf/Sf5560a6c070c48f3bdb8064e5a8f03dc4.jpg",,"Nostalgic Indians New 3D Printed T Shirts Men Ladies Street Casual Plus Size Oversized","USD 8.80","USD 3.52","60%","USD","9.0","USD 0.32","56","92.3%","https://s.click.aliexpress.com/e/_DlD8qx5",,,,,,
"1005003806076562","https://ae04.alicdn.com/kf/Sb3d334d9abc24ac58f63041101d6d6a0Q.jpg",,"WYWM New Cotton Women Tshirts Summer Harajuku Loose Solid Basic T Shirts Korean Casual O Neck Tees Plus Size Female Sexy Tops","USD 15.32","USD 12.26","20%","USD","9","USD 1.10","540","94.0%","https://s.click.aliexpress.com/e/_DliseP9",,,,,,
"4000789646338","https://ae04.alicdn.com/kf/H5074d3d103d14e70ab732f2d360811f1x.jpg",,"T Shirt Men Plus Size Men T Shirts 6 Xl 7xl 8xl 9xl Large Size Black White Basic Summer T-shirts Oversize Hip Hop","USD 14.15","USD 9.76","31%","USD","9","USD 0.88","40","100.0%","https://s.click.aliexpress.com/e/_DFufX3Z",,,,,,
"1005002289231103","https://ae04.alicdn.com/kf/H14a67772627b4cd0b61280a183a1d00bv.jpg",,"Japanese Manga Berserk Guts T-Shirts Men 100% Cotton T Shirts Swordsman Gatsu Manga Anime Tee Shirt Plus Size Clothes","USD 13.94","USD 5.58","60%","USD","9","USD 0.50","448","88.2%","https://s.click.aliexpress.com/e/_DBieNBp",,,,,,
"1005002289731380","https://ae04.alicdn.com/kf/H0ae3f4d00fe04ab891e331847416bfe74.jpg","http://cloud.video.taobao.com/play/u/2675628091/p/1/e/6/t/1/310744887180.mp4","2021 Summer Men's T Shirt Casual Printed Tshirt Short Sleeve Men T-shirt  Women's Funny Cotton Tee Plus Size S 6XL Men Clothes","USD 11.33","USD 7.25","36%","USD","9","USD 0.65","80","97.6%","https://s.click.aliexpress.com/e/_DFR1lIJ",,,,,,
"1005004384054799","https://ae04.alicdn.com/kf/Sc1192d87dfd94432a3d06f1f81bba86cG.jpg",,"Berserk Gust Anime Japanese Manga T-Shirts for Men Funny Cotton Tees O Neck Short Sleeve T Shirt Plus Size Clothes","USD 13.94","USD 5.58","60%","USD","9","USD 0.50","85","90.0%","https://s.click.aliexpress.com/e/_DBNHJSX",,,,,,
"1005001609800433","https://ae04.alicdn.com/kf/Sf2c0290373f74edb9e4bc045de58b2a24.jpg","http://cloud.video.taobao.com/play/u/2675628091/p/1/e/6/t/1/270382933607.mp4","2021 Autumn Winter New 100% Cotton T-shirt Men O-Neck Solid Color Casual T Shirt Basic Tees Plus Size Long Sleeve Tops","USD 30.13","USD 15.06","50%","USD","9","USD 1.36","27","100.0%","https://s.click.aliexpress.com/e/_DnEPVUj",,,,,,
"1005002310894207","https://ae04.alicdn.com/kf/H3010b295b7bc4c56a81ef8636f6a4657V.jpg","http://cloud.video.taobao.com/play/u/2675628091/p/1/e/6/t/1/302090450025.mp4","Lady 2022 Summer Blue White Striped Short Sleeve Cotton T-Shirt Women Button O-Neck Elegant Plus Size Tshirt Female Fashion Tops","USD 21.47","USD 13.96","35%","USD","9","USD 1.26","84","96.3%","https://s.click.aliexpress.com/e/_DDIDeA3",,,,,,
"4000830453371","https://ae04.alicdn.com/kf/H3252a1e247594531a2cc10e7a1be5af54.jpg",,"Michael Scott Homage The Office Men T Shirts Tv Series Dwight Schrute Jim Halpert Tees Short Sleeve T-Shirts Cotton Plus Size","USD 15.00","USD 6.00","60%","USD","9","USD 0.54","166","94.3%","https://s.click.aliexpress.com/e/_DnppkEb",,,,,,
"32919684577","https://ae04.alicdn.com/kf/Sccd1e3b33fbf43ab877bd56ccfbd244e2.jpg",,"BROWON Autumn Brand T Shirt Men Long Sleeve Zipper Collar Print Casual Tshirt Cotton Slim Fit T-shirt Plus Size Men Clothing","USD 26.47","USD 15.09","43%","USD","9","USD 1.36","35","96.5%","https://s.click.aliexpress.com/e/_DBA3OxN",,,,,,
"1005004083283237","https://ae04.alicdn.com/kf/Sa83c6ef7f52a4552a696263348176663L.jpg","http://cloud.video.taobao.com/play/u/2675628091/p/1/e/6/t/1/353602866346.mp4","SIMWOOD 2022 Summer New 240g Heavyweight 100% Cotton T-shirts Men Cartoon Car Print Plus Size Tops Brand Clothing","USD 33.79","USD 17.23","49%","USD","9","USD 1.55","88","98.0%","https://s.click.aliexpress.com/e/_DnSV5M3",,,,,,
"1005003036533176","https://ae04.alicdn.com/kf/Hf8aba4c0ffd84b8c8f909324e1e94d4aC.jpg",,"Funny God Of War 2 Ragnarok Is Coming T-Shirts Men O Neck Cotton T Shirt Classic Short Sleeve Tee Shirt Plus Size Clothing","USD 15.57","USD 15.57","0%","USD","9","USD 1.40","207","95.3%","https://s.click.aliexpress.com/e/_Dlk6zqf",,,,,,
"1005003511361804","https://ae04.alicdn.com/kf/H69ee51c7a3094c1eb48e82cc3db7544bU.jpg",,"Men's Team MMA Hasbulla Fight Meme T Shirts Pure Cotton Clothes Amazing Short Sleeve Crewneck Tees Plus Size T-Shirt","USD 13.94","USD 5.58","60%","USD","9","USD 0.50","21","92.0%","https://s.click.aliexpress.com/e/_Dd8y7D9",,,,,,
"1005003119145648","https://ae04.alicdn.com/kf/H6b69018742374308a8be511cba7fdb7da.jpg",,"Just A Proud Single Dad Who Commits Tax Fraud And Loves Rock N' Roll for Men Women T Shirt Crew Neck T-Shirts Plus Size Clothing","USD 15.00","USD 6.00","60%","USD","9","USD 0.54","25","100.0%","https://s.click.aliexpress.com/e/_DdZ92EF",,,,,,
"1005004229944197","https://ae04.alicdn.com/kf/Seb6bcef346694db399dd38969ec93eafj.jpg",,"Baki Hanma Vintage 90s T-Shirts Men Manga Anime Casual Pure Cotton Tee Shirt Round Collar Short Sleeve T Shirt Plus Size Clothes","USD 15.00","USD 6.00","60%","USD","9","USD 0.54","68","100.0%","https://s.click.aliexpress.com/e/_DktKr3p",,,,,,
"1005002995719765","https://ae04.alicdn.com/kf/Hbbdabf27d3584bffafc2d64a5d441fb4V.jpg",,"Darkthrone Tshirts Bathory T Shirt Short Sleeve Percent Cotton Tee Shirt Funny Streetwear Graphic Man Plus Size Tshirt","USD 9.52","USD 7.52","21%","USD","9.0","USD 0.68","143","98.5%","https://s.click.aliexpress.com/e/_Dm1HAtt",,,,,,
"32993511683","https://ae04.alicdn.com/kf/HTB13gDNM4YaK1RjSZFnq6y80pXaT.jpg",,"new Glitter Rock Band Queen t shirt women plus size 100% cotton summer tshirt women, vintage streetwear tee shirt homme harajuku","USD 8.49","USD 8.07","5%","USD","9","USD 0.73","150","98.0%","https://s.click.aliexpress.com/e/_DDBLwmb",,,,,,
"1005004920902419","https://ae04.alicdn.com/kf/Sb2e5b0cea50c40e0bc328595052100daL.jpg",,"ROSEGAL Heart Ring Layered Long Sleeves T-Shirt  Women Solid Tunic Tops S-4XL Autumn Scoop Neck Blouse Tees Three Colors Choose","USD 25.99","USD 18.19","30%","USD","9","USD 1.64","77","95.4%","https://s.click.aliexpress.com/e/_DDknGT5",,,,,,
"1005004686065424","https://ae04.alicdn.com/kf/Sf62f22f5ee1649cfac3ba54ceef1d02aD.jpg",,"ROSEGAL Corset T-Shirt Cable Knit Panel Mixed Media Lace Up Blouses Women's Tees 4XL 2022 New Fashion Fall,Winter Clothes Tops","USD 25.29","USD 16.44","35%","USD","9","USD 1.48","146","93.5%","https://s.click.aliexpress.com/e/_DFrVXvH",,,,,,
"32995237179","https://ae04.alicdn.com/kf/Sea034344c9d94953aa5107aabf41b74df.jpg",,"Short Sleeve T Shirt Men Tops Tees V Neck Short Sleeve Slim Fit T-Shirt Men Casual Summer Tshirt fashion trand Plus Size 5XL Tee","USD 16.55","USD 16.55","0%","USD","9","USD 1.49","55","94.7%","https://s.click.aliexpress.com/e/_DmYX4yX",,,,,,
"4001284327387","https://ae04.alicdn.com/kf/Hbeb6f7f4a22f4bd6a9fce1238b233b2cG.jpg",,"Summer 2022 New Embossed Lettering Pattern for European American Men's Short Sleeve O-neck 100% Cotton T-shirt Plus Size Tops","USD 19.89","USD 17.90","10%","USD","9","USD 1.61","29","96.9%","https://s.click.aliexpress.com/e/_DdRzAdh",,,,,,
"1005004310956129","https://ae04.alicdn.com/kf/S4203786947f7496681050c0995d814e0z.jpg",,"2022 Plus Size Summer Men's Tops Linen T Shirts Brief Breathable Comfy Solid Long Sleeve T-shirt Loose T shirt Hommes Clothing","USD 5.55","USD 3.22","42%","USD","9","USD 0.29","39","78.0%","https://s.click.aliexpress.com/e/_Dmfsv1H",,,,,,
"1005002747386707","https://ae04.alicdn.com/kf/H98cdba58effc4f599ca3370ccea17ad9J.jpg",,"Cryptocurrency Crypto Miner Bitcoin BTC And Crypto Design TShirt Men Alternative Plus Size Punk   T Shirt","USD 6.29","USD 5.66","10%","USD","9","USD 0.51","50","98.0%","https://s.click.aliexpress.com/e/_Dmi35in",,,,,,
"1005003065585644","https://ae04.alicdn.com/kf/H472cce51be3b43c4a2bd6f9dafc8fc90T.jpg",,"Men's T-Shirt Naoki Urasawa's Monster Anime Manga Casual Pure Cotton Tees Short Sleeve T Shirts Round Neck Clothes Plus Size","USD 13.94","USD 5.58","60%","USD","9","USD 0.50","25","97.5%","https://s.click.aliexpress.com/e/_DESr5YL",,,,,,
"4000557511027","https://ae04.alicdn.com/kf/H60adb2b0ed7f4650903daf8b19e9e34ft.jpg",,"SIMWOOD 2022 Summer new 100% cotton t-shirt men o-neck solid color t shirt basic tees plus size short sleeve tops 190402","USD 27.64","USD 17.14","38%","USD","9","USD 1.54","269","98.6%","https://s.click.aliexpress.com/e/_Dljta7l",,,,,,
"4001184397648","https://ae04.alicdn.com/kf/Hcc905ac6c69548c88b65b6b05f428c80r.jpg","http://cloud.video.taobao.com/play/u/2675628091/p/1/e/6/t/1/270182713479.mp4","Women's t-shirts Plus Size 5XL 6XL Overweight Women Tops Tees Womens Clothing Fashion Chiffon Summer Style Cloths Free Shipping","USD 30.00","USD 16.50","45%","USD","9","USD 1.48","92","96.7%","https://s.click.aliexpress.com/e/_DdkfLir",,,,,,
"1005003779906854","https://ae04.alicdn.com/kf/S7bc75903139341eab29a7db8197483a3F.jpg",,"Nintendo- N64 Logo Apparel T-Shirt L Black Casual Plus Size T-Shirts Hip Hop Style Tops Tee S-2Xl Fashion T Shirt Brand","USD 16.90","USD 9.97","41%","USD","9","USD 0.90","34","80.0%","https://s.click.aliexpress.com/e/_DDamGQT",,,,,,
"1005004694770485","https://ae04.alicdn.com/kf/S3eb3a27e0bf248afacd095ae7cca8923c.jpg",,"LW Plus Size Tee Women Rhinestone Faith Letter Gradient Geometric Print T-shirt Short Sleeve O Neck Fashion Lady Clothings","USD 20.03","USD 12.02","40%","USD","9","USD 1.08","122","83.5%","https://s.click.aliexpress.com/e/_DD5Qb1z",,,,,,
"4000558860202","https://ae04.alicdn.com/kf/H54bfc2bbf76d4bae85cf01d3a0c91513H.jpg",,"SIMWOOD 2022 Autumn New Long Sleeve T Shirt Men Solid Color 100% Cotton O-neck Tops Plus Size High Quality T-shirt  SJ120967","USD 35.37","USD 18.04","49%","USD","9","USD 1.62","2350","99.1%","https://s.click.aliexpress.com/e/_DexYYlp",,,,,,
"1005002733251594","https://ae04.alicdn.com/kf/H3da27184bf1143e4a6e75d11d4cf8e82G.jpg",,"Men Donkey Kong T Shirts Arcade Game Collage Vintage Retro Tops Crew Neck Big Tall Tees Plus Size 4XL 5XL 6XL T-Shirts","USD 15.00","USD 6.00","60%","USD","9","USD 0.54","52","94.5%","https://s.click.aliexpress.com/e/_DDZpJcF",,,,,,
"1005002327842905","https://ae04.alicdn.com/kf/H56356b5a4e124f62a5321d79f391c804D.jpg",,"Women's T-shirts Harajuku Girls Plus Oversize Tops O-neck Short Sleeves Loose Summer Tshirt Embroidery Bear White Black Tees","USD 19.80","USD 13.86","30%","USD","15.0","USD 2.08","70","93.8%","https://s.click.aliexpress.com/e/_DmGIh5N",,,,,,
"1005004677310510","https://ae04.alicdn.com/kf/S6d0394566d5447dfac32453ec9dfd8a9s.jpg",,"ROSEGAL Women's V-Neck Tees 2022 New Style Female Lace Trim Hollow Out Cinched Flare Sleeves T Shirt Long Sleeve Tops White 4XL","USD 26.79","USD 15.54","42%","USD","9","USD 1.40","34","96.7%","https://s.click.aliexpress.com/e/_Dkxo4Dt",,,,,,
"1005002735165054","https://ae04.alicdn.com/kf/H8324bd77bc5641aa87aee2c0dcf74c6ez.jpg",,"Leisure Asterix And Obelix T-Shirts Men O Neck Cotton T Shirt Short Sleeve Big Tall Tees Plus Size 4XL 5XL 6XL Tops","USD 15.00","USD 6.00","60%","USD","9","USD 0.54","30","80.0%","https://s.click.aliexpress.com/e/_Dk9h5Dz",,,,,,
"1005004762889625","https://ae04.alicdn.com/kf/Sb42d36f1561940c8ab3a00e6af33dd13T.jpg",,"Plus Size 4XL Black Blouses Women's Autumn 2022 Flare Sleeve Peplum Tops V Neck Oversized T Shirts Elegant Casual Solid Clothing","USD 19.89","USD 9.75","51%","USD","9","USD 0.88","132","89.7%","https://s.click.aliexpress.com/e/_DEjf7d9",,,,,,
