"ProductId","Image Url","Video Url","Product Desc","Origin Price","Discount Price","Discount","Currency","Commission Rate","Commission","Sales180Day","Positive Feedback","Promotion Url","Code Name","Code Start Time","Code End Time","Code Value","Code Quantity","Code Minimum Spend"
"1005004896492031","https://ae04.alicdn.com/kf/S61b3851e2de54890a80f06a8c1b10f30n.jpeg",,"LW Plus Size Dresses Hooded Collar Line Stitching Bodycon Dress 2022 Autumn winter NEW party dresses for women evening dresses","USD 35.59","USD 21.35","40%","USD","9","USD 1.92","25","80.0%","https://s.click.aliexpress.com/e/_DcIM6e7",,,,,,
"1005002395536366","https://ae04.alicdn.com/kf/H414df549e7d346a9a54987f426a49ac6T.jpg",,"Sexy Mermaid Wedding Dresses 2021 Open Back Scoop Neck Plus Size Lace Appliques Bride Dress Sweep Train Vestido De Novie Custom","USD 187.87","USD 112.72","40%","USD","7","USD 7.89","21","100.0%","https://s.click.aliexpress.com/e/_DeQubkj",,,,,,
"1005003106232601","https://ae04.alicdn.com/kf/S975a37507d1d461a99d98a481d7b2fde1.jpg","http://cloud.video.taobao.com/play/u/2675628091/p/1/e/6/t/1/337289725675.mp4","2023 Solid V-neck Batwing Sleeve Plus Size Loose Maxi Dress For Women Summer Beach Wear Kaftan Long Bathing Dresses Q1306","USD 27.98","USD 16.79","40%","USD","9","USD 1.51","66","81.1%","https://s.click.aliexpress.com/e/_DDck1mP",,,,,,
"32531724472","https://ae04.alicdn.com/kf/HTB1C4LxbVTM8KJjSZFlq6yO8FXaz.jpg",,"ZJ9128 2022 New Style Fashion White Ivory Wedding Dresses For Brides Plus Size Maxi Formal Sweetheart With Lace Edge","USD 124.99","USD 89.99","28%","USD","8.0","USD 7.20","22","100.0%","https://s.click.aliexpress.com/e/_Dlbx8TV",,,,,,
"1005004375090680","https://ae04.alicdn.com/kf/Sa55a656fe6d9415495b51e70cfd6a9762.jpg","http://cloud.video.taobao.com/play/u/2675628091/p/1/e/6/t/1/1100062713133.mp4","Elegant Lace Dresses Plus Size 3XL 4XL Long Lantern Sleeve White Pink Bodycon Vintage Prom Dress Gowns for Ladies Evening Party","USD 69.98","USD 34.99","50%","USD","9.0","USD 3.15","188","95.4%","https://s.click.aliexpress.com/e/_DFtT4Dh",,,,,,
"4000785265398","https://ae04.alicdn.com/kf/Hcfeed09e638b49ce9528730c8c88aa7ee.jpg",,"Luxury Wedding Dresses Lace Up Dreamy Half-sleeve Bride Plus Size Wedding Dress Embroidery Ball Gowns vestidos de novia","USD 89.00","USD 61.41","31%","USD","7","USD 4.30","24","0.0%","https://s.click.aliexpress.com/e/_DFlbdkj",,,,,,
"1005004570905147","https://ae04.alicdn.com/kf/S3fd15d13b72749d7b3b19364a2afa2d9J.jpg",,"Plus Size Princess Party Lace Flower Girl Dress Baby Kids Summer Wedding Birthday Dresses Children Clothing 2 4  6 8 10 12 14","USD 25.25","USD 15.91","37%","USD","9","USD 1.43","59","89.1%","https://s.click.aliexpress.com/e/_DlE93Cj",,,,,,
"1005004635033614","https://ae04.alicdn.com/kf/S76a73e7fa0874f768c76f4ddefd9c034o.jpg",,"Plus Size Ruffles Midi Dress 4XL Long Sleeve V Neck Green Elegant Casual Party Dresses 2022 Summer Autumn Vintage Clothing","USD 30.04","USD 15.02","50%","USD","9","USD 1.35","30","90.0%","https://s.click.aliexpress.com/e/_DmX5WkR",,,,,,
"1005003906205599","https://ae04.alicdn.com/kf/Se04bf3db4bca4a2ea0fcc5ced7bd6fd65.jpg",,"Plus Size Casual Velvet Dresses For Women Basic v Neck Long Sleeve a-Line Dress 2022 Fashion Slim Velour Dress Vestidos De Mujer","USD 30.36","USD 15.48","49%","USD","9","USD 1.39","32","92.0%","https://s.click.aliexpress.com/e/_DmhqVfh",,,,,,
"1005003781422880","https://ae04.alicdn.com/kf/H085f6b64cc934ef797955526409f50edc.jpg",,"Long Sleeves Ball Gown Wedding Dress Robe De Mariee 2022 Luxury Plus Size Lace Appliques Bride Dresses vestidos de noiva","USD 104.98","USD 78.73","25%","USD","7","USD 5.51","23","96.7%","https://s.click.aliexpress.com/e/_DErtWbl",,,,,,
"4000694073244","https://ae04.alicdn.com/kf/H01062ea4e30340458051c75acf8ed96bu.jpg",,"NUOXIFANG Elegant Long Sleeves Plus Size Wedding Dress White Robe De Mariee 2022 Appliques Lace Bridal Gowns Vestido De Novias","USD 156.21","USD 85.91","45%","USD","8.0","USD 6.87","44","97.3%","https://s.click.aliexpress.com/e/_Den0vmn",,,,,,
"4000781539524","https://ae04.alicdn.com/kf/H4870c20263304f97a848460986a3f7d4L.jpg","http://cloud.video.taobao.com/play/u/2675628091/p/1/e/6/t/1/338416952874.mp4","Wedding Dress 2022 New Birde Long Sleeve Ball Gown Luxury Lace Wedding Dresses Vestido De Noiva Robe De Mariee Plus Size","USD 67.77","USD 44.05","35%","USD","7","USD 3.08","200","94.9%","https://s.click.aliexpress.com/e/_DBsBnEJ",,,,,,
"1005003206965856","https://ae04.alicdn.com/kf/S51221887ba6047839ddf3eb46740155bb.jpg",,"Elegant Evening Dresses V-Neck Burgundy Red Chiffon Bridesmaid 2022 Ever Pretty fo Plus Size Long Wome Prom Dress EP07851","USD 131.97","USD 35.63","73%","USD","8.0","USD 2.85","55","98.3%","https://s.click.aliexpress.com/e/_DEZCwlZ",,,,,,
"1005004863188230","https://ae04.alicdn.com/kf/Se95731f284464b86b030dfdc9b9a19733.jpg",,"Y&M Novias Off Shoulder Plus Size Vestido De Noiva 2023 Wedding Dress Long Train or Floor Appliqes Pearls Bridal Tulle Mariage","USD 86.50","USD 58.82","32%","USD","7","USD 4.12","42","100.0%","https://s.click.aliexpress.com/e/_DkWRAUf",,,,,,
"4000981310946","https://ae04.alicdn.com/kf/Hf00b702e137143ffa6e1269327a46e86N.jpg",,"Plus Size 6XL 150kg High Quality Autumn Sweater Dress for Women Solid Color V Neck Pullover Thick Winter Long Dress Maxi Dresses","USD 34.14","USD 23.90","30%","USD","9","USD 2.15","42","96.0%","https://s.click.aliexpress.com/e/_DEm65ob",,,,,,
"4001260716745","https://ae04.alicdn.com/kf/Hcac3b12fb5194b7c88d42cd75b2b8c1bd.jpg",,"Blue Plus Size Evening Mother Of The Bride Dresses A-line 3/4 Sleeves Tulle Appliques Groom Long Mother Dresses For Weddings","USD 126.00","USD 86.94","31%","USD","7","USD 6.09","23","100.0%","https://s.click.aliexpress.com/e/_DdyA5en",,,,,,
"1005003772469897","https://ae04.alicdn.com/kf/S330bde5ba8c64c6d91728c112634ee83m.jpg",,"Black Sexy Elegant Short Party Dress One Shoulder Long Sleeves Applique Plus Size Women Mini Cocktail Evening Gowns Custom Made","USD 175.55","USD 87.77","50%","USD","8.0","USD 7.02","27","100.0%","https://s.click.aliexpress.com/e/_DDPoJPt",,,,,,
"1005003205756352","https://ae04.alicdn.com/kf/Se377ba9758d5435b8333049ce3a6c90f3.jpg",,"Plus size Evening Dresses long A-LINE Sleeveless V-neck Chiffon 2022 ever pretty of Pink Elegant Bridesmaid dress Women","USD 170.97","USD 32.48","81%","USD","7","USD 2.27","46","96.7%","https://s.click.aliexpress.com/e/_DeNceq7",,,,,,
"1005003993928538","https://ae04.alicdn.com/kf/Sac6b0bdbca0c4342b5e82cf376f95104r.jpg",,"White Off the Shoulder Plus Size Vestido De Noiva 2022 Wedding Dress Train Custom Made Plus Size Bridal Tulle Mariage","USD 217.80","USD 91.48","58%","USD","16.5","USD 15.09","239","96.1%","https://s.click.aliexpress.com/e/_DedPvZN",,,,,,
"1005004507838073","https://ae04.alicdn.com/kf/S2d313f55331048c4bb7ac0cf071f4fdc7.jpg",,"Women's Plus Size Dresses Lace 3/4 Sleeves Evening Gown Party Cocktail Dress Crewneck Hollow Out","USD 40.00","USD 20.00","50%","USD","9","USD 1.80","28","86.7%","https://s.click.aliexpress.com/e/_DCNH4QF",,,,,,
"32862513691","https://ae04.alicdn.com/kf/HTB16ouzlwaTBuNjSszfq6xgfpXaN.jpg",,"Fashion Classic Real Photo Appliques Vintage White Pearls Wedding Dresses 2022 Vestidos De Noiva Bridal Gown Plus Size Strapless","USD 85.90","USD 66.14","23%","USD","7","USD 4.63","71","100.0%","https://s.click.aliexpress.com/e/_DBpxtux",,,,,,
"1005001686669791","https://ae04.alicdn.com/kf/He7813465620e4cba8d825696904c8104x.jpg",,"2022 Winter Casual Floral Knited Turtleneck Sweater Dress Autumn Vintage Chic Plus Size Women Elegant Bodycon Long Wool Sweaters","USD 45.00","USD 30.60","32%","USD","10.0","USD 3.06","304","92.3%","https://s.click.aliexpress.com/e/_DDIjckX",,,,,,
"1005003278493570","https://ae04.alicdn.com/kf/H58db964d3ff84501ab2bdd3fb72949d05.jpg",,"Sparkly Diamonds Lace Chiffon Plus Size Mother of the Bride Dress Half Sleeve Long Formal Evening Gowns Wedding Party Guest","USD 190.00","USD 95.00","50%","USD","8.0","USD 7.60","23","93.3%","https://s.click.aliexpress.com/e/_DkA4u4n",,,,,,
"1005004762643903","https://ae04.alicdn.com/kf/S5cebe8e1396344449f8c7eb341d80ed0X.jpg",,"Plus Size Luxury Evening Dresses Long A-LINE V-Neck Wrist Sleeve Floor-Length Gown 2023 Ever Pretty of Sequine Prom Women Dress","USD 239.97","USD 38.40","84%","USD","8.0","USD 3.07","23","100.0%","https://s.click.aliexpress.com/e/_DBOwRJD",,,,,,
"1005004658642127","https://ae04.alicdn.com/kf/Sa50e644332424872b9c474f1a39e7ab75.jpg",,"Beaded Bridal Cathedral Lace Appliqued plus size dress empire Ball Gown wedding dress robe de mariage Wedding Dresses 2023","USD 200.00","USD 170.00","15%","USD","7","USD 11.90","26","100.0%","https://s.click.aliexpress.com/e/_Dmrmz15",,,,,,
"1005003779342240","https://ae04.alicdn.com/kf/H038eb435ed3f43eb96dfc0e5f999e1989.jpg",,"Thinyfull Sexy Prom Dresses 2022 Off Shoulder Mermaid Evening Dress Side Slit Beading Saudi Arabia Cocktail Party Gown Plus Size","USD 141.99","USD 79.51","44%","USD","8.0","USD 6.36","39","100.0%","https://s.click.aliexpress.com/e/_DC9Jf0j",,,,,,
"4001009713168","https://ae04.alicdn.com/kf/H2513c45e5d7c4fc49d184567898b469ed.jpg",,"Long evening dress sexy one shoulder beading CHIFFON wedding party dress Plus size summer Dresses formal prom Cocktail Dresses","USD 91.41","USD 45.70","50%","USD","8.0","USD 3.66","45","93.3%","https://s.click.aliexpress.com/e/_DEeqn5d",,,,,,
"1005004224350896","https://ae04.alicdn.com/kf/S1158b70eec594d19b7e3bd611195e515Y.jpg","http://cloud.video.taobao.com/play/u/2675628091/p/1/e/6/t/1/1100019353403.mp4","New Hot 2022 Women summer Dress Floral Print short Sleeve FashionElegant Vintage V-Neck Plus size Casual Dresses","USD 25.00","USD 13.75","45%","USD","9.0","USD 1.24","27","97.6%","https://s.click.aliexpress.com/e/_DCGZqeb",,,,,,
"4001279962510","https://ae04.alicdn.com/kf/H1b7ee5f9ae754da99e6a5e71044f8611v.jpg","http://cloud.video.taobao.com/play/u/2675628091/p/1/e/6/t/1/1100092274359.mp4","XXN-12#Wedding dress Full sleeve Embroidered Lace Net Ball Gown Wholesale New In Cheap Items With Free Shipping Custom Plus Size","USD 40.74","USD 40.74","0%","USD","7","USD 2.85","38","94.1%","https://s.click.aliexpress.com/e/_DBV8WMr",,,,,,
"1005004121479635","https://ae04.alicdn.com/kf/Sf7658957a7434b6989799db00dc6b65eB.jpg",,"Princess Plus Size Wedding Dresses 2022 Lace Applique Long Sleeve Custom Made Tiered Skirt Dubai Arabic Bridal Wedding Dress","USD 364.02","USD 127.41","65%","USD","22.0","USD 28.03","19","86.7%","https://s.click.aliexpress.com/e/_DlPgmLH",,,,,,
"4000669111334","https://ae04.alicdn.com/kf/Hf671f4201e9b469f889b7e096142e1dfS.jpg",,"wei yin AE0382 Long Evening Dress Elegant Robe De Soiree Zipper Women Party Dresses Plus Size V Neck Sequin Formal Gowns","USD 130.00","USD 48.10","63%","USD","7","USD 3.37","31","100.0%","https://s.click.aliexpress.com/e/_DnDlIjl",,,,,,
"1005004256010448","https://ae04.alicdn.com/kf/S07a06c0d1cbc42c9acc404a4c497b2afk.jpg",,"New Hot Casual Vintage Summer Dress Plus Size Dresses Vestido Print Natural Regular Short Sleeve O-neck Cotton Women Clothing","USD 26.50","USD 14.57","45%","USD","9.0","USD 1.31","35","100.0%","https://s.click.aliexpress.com/e/_DkmMX8b",,,,,,
"1005004667465538","https://ae04.alicdn.com/kf/Aaef6dad9f3bb4260994f50c50e0331052.jpg",,"Add Elegant 2022 Autumn Plus Size Flower Mesh Cover Dresses for Women Flare Sleeve Sweet Female O Neck Waist Midi Dress B1095","USD 43.66","USD 19.21","56%","USD","9","USD 1.73","277","93.5%","https://s.click.aliexpress.com/e/_Dc8EJxh",,,,,,
"1005004709855409","https://ae04.alicdn.com/kf/S9d7616e69ec14cd9b4ffd0d77d81ba62g.jpg",,"L-5XL 2022 Fall Women Clothing Two Piece Sets Solid Color Printing Long Sleeve Plus Size Pant Suits Lady Outfits Dropshipping","USD 42.73","USD 21.36","50%","USD","9","USD 1.92","44","100.0%","https://s.click.aliexpress.com/e/_De5WS5D",,,,,,
"1005004339195566","https://ae04.alicdn.com/kf/Sbfebbdcd2a8d4091999d9b9b19b004eaz.jpg",,"2022 Satin Silk Pajamas for Women Summer Pyjamas Home Clothes Women Nightwear Pajama Set Long Nightgown Plus Size Sleepwear","USD 14.85","USD 9.80","34%","USD","8.0","USD 0.78","481","89.4%","https://s.click.aliexpress.com/e/_Dl7WPwP",,,,,,
"1005004787931245","https://ae04.alicdn.com/kf/S0a5296f2a8c44ab79706fb087f2fea36w.jpg","http://cloud.video.taobao.com/play/u/2675628091/p/1/e/6/t/1/1100074898225.mp4","DaiNaFang New Sexy High Quality Bras Set Lace Floral Push Up Underwear Beige Black Blue Pink Red White Plus Size Lingerie","USD 16.50","USD 8.25","50%","USD","7","USD 0.58","93","90.0%","https://s.click.aliexpress.com/e/_DEyqTUj",,,,,,
"1005004275220063","https://ae04.alicdn.com/kf/S8f9fe9a9577740c49c389e256657fa03B.jpg","http://cloud.video.taobao.com/play/u/2675628091/p/1/e/6/t/1/1100026277487.mp4","DaiNaFang New Style Lace Bow Women Bras Set 36/80 38/85 40/90 42/95 44/100 46/102 CD Cup Push Up Underwear Plus Size Lingerie","USD 16.80","USD 8.40","50%","USD","7","USD 0.59","28","92.0%","https://s.click.aliexpress.com/e/_DdycrXv",,,,,,
"1005004770853715","https://ae04.alicdn.com/kf/S50e3f43b3522490fa5a1e5a2d23f050fi.jpg",,"LW Plus Size Dropped Shoulder Knit Pants Set Women's Long Sleeve Knitted Casual Two-piece Sweater Long Sleeve Top Thick Sweaters","USD 51.63","USD 28.40","45%","USD","12.0","USD 3.41","487","87.0%","https://s.click.aliexpress.com/e/_DdmYvJp",,,,,,
"1005003445025241","https://ae04.alicdn.com/kf/Hb1c872fe69a54018a65da474dea28e08k.jpg",,"Baby Boys Clothing Sets Winter Plus Velvet Thick Warm 3Pcs Outift Cartoon Dinosaur Children Clothes Sport Tracksuit Set For Kids","USD 13.53","USD 10.96","19%","USD","9","USD 0.99","63","100.0%","https://s.click.aliexpress.com/e/_DdNNjh5",,,,,,
"1005003659258776","https://ae04.alicdn.com/kf/H4f66022662524f3590ea382959b5ca73v.jpg","http://cloud.video.taobao.com/play/u/2675628091/p/1/e/6/t/1/340041561395.mp4","2021 New Sexy Push Up Bra Sets Padded Lace Middle Mold Cup Underwear For Women BCDE Plus Size Female Lingerie","USD 13.80","USD 6.90","50%","USD","7","USD 0.48","353","91.6%","https://s.click.aliexpress.com/e/_DkjNhs7",,,,,,
"1005003146512141","https://ae04.alicdn.com/kf/S1d0a806c751b491db5e45ca1b8b99fb0S.jpg",,"PU Two Piece Plus Size Women Pants Sets Fashion Streetwear Half Sleeve Black Tshirt  Elastic Waist Pants Wholesale Dropshipping","USD 40.00","USD 21.20","47%","USD","9","USD 1.91","52","100.0%","https://s.click.aliexpress.com/e/_DDzMoNh",,,,,,
"1005004727545424","https://ae04.alicdn.com/kf/S247a9be3fabf41e9bc5ae7c6ca1869567.jpeg",,"LW Plus Size Letter Print Pants Set Round Neck Short Sleeve +trousers 2 pcs new autumn Casual women sportswear  set","USD 33.56","USD 17.79","47%","USD","16.0","USD 2.85","128","95.6%","https://s.click.aliexpress.com/e/_Dkwnrxv",,,,,,
"1005004694286162","https://ae04.alicdn.com/kf/Safa945ac45f045fea38f8b89e1550120l.jpg","http://cloud.video.taobao.com/play/u/2675628091/p/1/e/6/t/1/1100084523806.mp4","Brand Men's Fleece Tracksuits Set Autumn Winter Zipper Jackets Sweatshirts Sweatpants Suit Male Clothing Plus Size Sportswear","USD 33.65","USD 23.55","30%","USD","9","USD 2.12","70","97.8%","https://s.click.aliexpress.com/e/_DeOxULV",,,,,,
"1005005030915915","https://ae04.alicdn.com/kf/S803e7718dae24136952f9a0677269ccbk.jpg",,"Lover Tracksuit Hoodies Printing Trapstar Couple Sweatshirt Plus Size Hooded Clothes Hoodies Women Two Piece Set","USD 28.47","USD 17.08","40%","USD","9","USD 1.54","28","null%","https://s.click.aliexpress.com/e/_DkC2iMB",,,,,,
"4000939897370","https://ae04.alicdn.com/kf/H12de4c0ff93b4a0da1c4ec7e4a8067ad3.jpg","http://cloud.video.taobao.com/play/u/2675628091/p/1/e/6/t/1/260297398190.mp4","Women's Thermal Underwear Woman Winter Sets Plus Size Long Johns Women Thermal Pants Top Two Piece Set Thin Women Suits Warming","USD 35.50","USD 19.52","45%","USD","10.0","USD 1.95","97","96.4%","https://s.click.aliexpress.com/e/_Deg6uWb",,,,,,
"1005004009494866","https://ae04.alicdn.com/kf/Uf77f553801444981a92129d71ec2bbcb2.jpg",,"Women's Two Piece Set 2022 New 3D Butterfly Print Hoodies Trousers Suit Female Leisure Sweat Suit Plus Size Clothing For Women","USD 26.35","USD 14.49","45%","USD","9","USD 1.30","38","86.7%","https://s.click.aliexpress.com/e/_De7IQof",,,,,,
"32839440448","https://ae04.alicdn.com/kf/HTB1s4RDa9YH8KJjSspdq6ARgVXaf.jpg",,"B C D E F Cup 75 80 85 90 95 100 Women Bras Panties Sales Separate Hot Charms Plus Size Underwear Sexy Transparent Bralette Xmas","USD 12.60","USD 6.80","46%","USD","10.5","USD 0.71","120","94.1%","https://s.click.aliexpress.com/e/_DlDgTer",,,,,,
"4000142033679","https://ae04.alicdn.com/kf/H938fb52a01e74e05a21c2b60aa4dcaf78.jpg",,"Running Sets Men Sportswear Short sleeve Clothes Fitness Basketball tennis Soccer Plus Size Gym Clothing 2 pieces Sports Suits","USD 14.70","USD 10.58","28%","USD","10.5","USD 1.11","74","94.8%","https://s.click.aliexpress.com/e/_Dm5W2aT",,,,,,
"1005004794999778","https://ae04.alicdn.com/kf/S2e3a9a25208d4a2daf9bb5e8901f1905k.jpg",,"LW Plus Size Striped Drawstring Tracksuit Set Autumn Women Hoodie Pants Set Striped Printed Hooded Long Sleeve Warm Sweatshirts","USD 43.89","USD 26.33","40%","USD","17.0","USD 4.48","56","97.1%","https://s.click.aliexpress.com/e/_DetC9uj",,,,,,
"1005004285676883","https://ae04.alicdn.com/kf/Sd28c1fd51a8f4757934c749616a73d3a3.jpeg",,"LW Plus Size See-through Skinny Stretchy Pants Set Female Gauze Sexy Long Sleeve Turtleneck Top+Solid Sheath Matching Outfits","USD 34.28","USD 20.57","40%","USD","9","USD 1.85","28","100.0%","https://s.click.aliexpress.com/e/_DF3ANWR",,,,,,
"1005004263920670","https://ae04.alicdn.com/kf/S8df406be2cc846c1968703214e9c700d0.jpg",,"2022 New Sexy 34-42 BC Cup Bras Set For Women Brassiere Pink Red Blue Beige Black Panties Underwear Plus Size Lingerie","USD 15.60","USD 7.80","50%","USD","7","USD 0.55","50","93.0%","https://s.click.aliexpress.com/e/_DBbiNNl",,,,,,
"1005003357275811","https://ae04.alicdn.com/kf/H07655b7c9e0344bab228d2fa9c908e17w.jpg","http://cloud.video.taobao.com/play/u/2675628091/p/1/e/6/t/1/1100087905100.mp4","Winter Thick Warm Velvet Pajamas Nightgown Women Cute Hooded Flannel Robe Set Couple Long Homewear Plus Size Men's Home Clothes","USD 59.20","USD 24.27","59%","USD","8.0","USD 1.94","52","97.0%","https://s.click.aliexpress.com/e/_DdKmKhh",,,,,,
"1005004862065140","https://ae04.alicdn.com/kf/S61d03aa930cc4d62a9da2d72805bb8d2Y.jpg",,"XL-5XL 2022 Fall Plus Size Set Women Clothing Casual Ladies Top And Pants Suits Female Two Pieces Outfits Wholesale dropshopping","USD 43.08","USD 21.54","50%","USD","9","USD 1.94","33","100.0%","https://s.click.aliexpress.com/e/_DEDIKuf",,,,,,
"1005003979469192","https://ae04.alicdn.com/kf/S19b94f03cee84ff1828173f137f42ae3K.jpg",,"Men Clothing 2022 Men's Sets Designer Clothes T Shirts Shorts Tracksuit Korea Fashion Sweatsuits Sweatpants  Plus Size Two Piece","USD 26.00","USD 17.94","31%","USD","9","USD 1.61","47","72.9%","https://s.click.aliexpress.com/e/_DmDXWnH",,,,,,
"1005003654601582","https://ae04.alicdn.com/kf/H18ec085e0bbc4294a43a42726dc59e13I.jpg","http://cloud.video.taobao.com/play/u/2675628091/p/1/e/6/t/1/340734371605.mp4","2021 New Women Push Up Bra Sets Intimates Lace Thongs Underwear Solid Bow 70-105 BCDE Cup Female Plus Size Lingerie","USD 16.90","USD 8.45","50%","USD","7","USD 0.59","134","96.6%","https://s.click.aliexpress.com/e/_Dcio1c7",,,,,,
"1005003730202859","https://ae04.alicdn.com/kf/S754a7b1de6cf4b02b8de26a08753da002.jpg",,"Plus Size Tracksuit Women High Quality Winter Thickend Warm V-neck Pullover Sweater Wide Leg Pants Knitted Suit 2 Piece Set New","USD 33.32","USD 19.99","40%","USD","9","USD 1.80","79","84.2%","https://s.click.aliexpress.com/e/_Dk28yJd",,,,,,
"1005003936108589","https://ae04.alicdn.com/kf/S8c3f174b4c2c4805b72ba992958d4be8N.jpg",,"7 Colors Women Push Up Lingerie Bra and Panties Lace Wireless Bra Briefs Sexy Bra Top Female Seamless Plus Size Underwear Set","USD 21.68","USD 7.80","64%","USD","7","USD 0.55","1243","90.6%","https://s.click.aliexpress.com/e/_DCn3l6n",,,,,,
"1005002694709166","https://ae04.alicdn.com/kf/Sa3cc62b1276b4f4bab2d58573b98a19eD.jpg","http://cloud.video.taobao.com/play/u/2675628091/p/1/e/6/t/1/280119326557.mp4","Lingerie Bra Underwear for Women Sexy  Section Breathable Female Large  Plus Size Lace Push Up Bralette  Bra and Panty Set","USD 16.65","USD 9.99","40%","USD","7","USD 0.70","955","94.0%","https://s.click.aliexpress.com/e/_DDCMIt1",,,,,,
"1005002844574522","https://ae04.alicdn.com/kf/H0ffe250e2aa54062b27787fcd93d725ei.jpg",,"2 PC Women Pajamas Set Cotton Pyjama Femme Pizama Damska Pijamas Mujer Verano Ropa Conjuntos Clothes Suit  Plus Size Loungewear","USD 26.47","USD 18.79","29%","USD","7","USD 1.32","21","100.0%","https://s.click.aliexpress.com/e/_DddbBk7",,,,,,
"1005001397951461","https://ae04.alicdn.com/kf/S2f6c16de35484bdfbe8c728084d03b0aD.jpg",,"2022 Mens Sport Suit Set Running Sets Men 2 Piece Sweatshirt Sweatpants Set Plus Velvet Casual Tracksuit Sports 2 Piece Set","USD 38.89","USD 23.33","40%","USD","7","USD 1.63","77","89.3%","https://s.click.aliexpress.com/e/_DFXeP2n",,,,,,
"1005003271467828","https://ae04.alicdn.com/kf/H3eecbd35a4ea4ca6a80d2a7d2ab4940dW.jpg",,"Plus Size New Women Two Piece Sets Tops + Pants Matching Set Large Size Velvet Patchwork Women Tracksuit chandals mujer 5XL","USD 37.70","USD 37.70","0%","USD","9.0","USD 3.39","36","93.3%","https://s.click.aliexpress.com/e/_DE4uqYR",,,,,,
"1005004467401354","https://ae04.alicdn.com/kf/S0914f22a7929455f8a793dcc05c77107v.jpg",,"LW Plus Size Two Piece Letter Print Striped Skirt Set Fashion Casual Oblique Bateau Collar Summer Tops+Bottoms Matching Outfits","USD 28.28","USD 16.97","40%","USD","20.0","USD 3.39","492","94.4%","https://s.click.aliexpress.com/e/_DeGJbYb",,,,,,
"1005002474408880","https://ae04.alicdn.com/kf/Hd9be0a05679840b1847fb8cd3899bd42C.jpg","http://cloud.video.taobao.com/play/u/2675628091/p/1/e/6/t/1/306221847078.mp4","Sexy Lace Plus Size Female Lingerie Transparent Thin Thick BCDE Cup Bra Sets Breathable Women Underwear Panties Briefs","USD 11.90","USD 8.33","30%","USD","8.0","USD 0.67","803","94.1%","https://s.click.aliexpress.com/e/_DCo4DH9",,,,,,
"33027343705","https://ae04.alicdn.com/kf/HTB1jwqkaoKF3KVjSZFEq6xExFXa5.jpg",,"Yoga Set Quick Dry 2 Piece Female Short-sleeved long Pants Outdoor Sportswear Fitness suit Plus Size Sport outfit for woman","USD 18.00","USD 10.98","39%","USD","8.0","USD 0.88","269","94.4%","https://s.click.aliexpress.com/e/_DmRG0w7",,,,,,
"1005002554032255","https://ae04.alicdn.com/kf/Hc0bef06024764ebaa44aca5744b40ff7w.jpg","http://cloud.video.taobao.com/play/u/2675628091/p/1/e/6/t/1/349043305470.mp4","Sexy ultra-thin bra set plus size see-through lace mesh gauze big breasts gathers seamless comfortable underwear bralette suit","USD 33.88","USD 14.91","56%","USD","12.0","USD 1.79","56","97.6%","https://s.click.aliexpress.com/e/_DF4qmw3",,,,,,
"1005004342222101","https://ae04.alicdn.com/kf/S5852ac7e87934d3c8aaf46175e26d241S.jpg","http://cloud.video.taobao.com/play/u/2675628091/p/1/e/6/t/1/1100040646518.mp4","DaiNaFang New Sexy Women Bras Set Push Up Underwear 34/75 36/80 38/85 40/90 42/95 ABCDE Cup Plus Size Lace Lady Lingerie","USD 15.60","USD 7.80","50%","USD","7","USD 0.55","437","96.0%","https://s.click.aliexpress.com/e/_DBcKmgP",,,,,,
"1005001610696006","https://ae04.alicdn.com/kf/Hd628336cd9c14cff8ceb46459a6731ecg.jpg",,"Cartoon Children Clothing Winter Baby Boys Girls Thicken Hooded Jacket Pants 2Pcs/sets Kids Casual Plus Warm Cotton Sportswear","USD 24.55","USD 14.73","40%","USD","9","USD 1.33","43","100.0%","https://s.click.aliexpress.com/e/_DDgbNXt",,,,,,
"1005004710003813","https://ae04.alicdn.com/kf/S7cd665067b134f628fa149dfca5f0dd6k.jpg",,"Velvet Pajamas Set Sexy Full Sleepwear For Women Pyjama Women's Autumn/Winter Fashion Soft Lace 3PCS/Set Homewear Plus Size","USD 26.87","USD 15.85","41%","USD","15.0","USD 2.38","40","92.5%","https://s.click.aliexpress.com/e/_DEUwhFZ",,,,,,
"1005004729102138","https://ae04.alicdn.com/kf/S750985b5e09f45d19c4c0ec53d4b83031.jpg","http://cloud.video.taobao.com/play/u/2675628091/p/1/e/6/t/1/1100086611585.mp4","Winter Tracksuit Men Thick Warm Lamb Woolen Fleece Plus Size Hooded 2 Piece Set Jacket+pants Sportswear Casual Sweat Suits 8xl","USD 122.17","USD 58.64","52%","USD","9.0","USD 5.28","27","100.0%","https://s.click.aliexpress.com/e/_DCYtJ9l",,,,,,
"1005001563242359","https://ae04.alicdn.com/kf/S4c7c22f6468b4159b30b6fb093d1a615W.jpg","http://cloud.video.taobao.com/play/u/2675628091/p/1/e/6/t/1/282390291721.mp4","Plus Size L-5XL Two Piece Set Women Sweatsuit Zip Striped Top Slit Sweatpants Jogger Outfit Matching Set Wholesale Dropshipping","USD 44.00","USD 24.20","45%","USD","9","USD 2.18","211","88.0%","https://s.click.aliexpress.com/e/_Ddn4J5V",,,,,,
"1005004285662892","https://ae04.alicdn.com/kf/Sa5646ff8e20041e391ba42cc2e754831V.jpg",,"LW Plus Size Round Neck Geometric Print Pants Set Female Polyester Casual RegularLong Sleeve O-Neck Matching Outfits For Women","USD 34.47","USD 17.92","48%","USD","9","USD 1.61","68","90.0%","https://s.click.aliexpress.com/e/_DBZPUWF",,,,,,
"32836022007","https://ae04.alicdn.com/kf/HTB13MYsrEQIL1JjSZFhq6yDZFXaZ.jpg",,"Winter Warm Pyjamas Women Plus Size Sleepwear Female Kingurumi Teddy Fleece Pajamas Plush Flannel Pajamas Sets For Women Adults","USD 45.98","USD 25.75","44%","USD","8.0","USD 2.06","51","100.0%","https://s.click.aliexpress.com/e/_DEyOxIJ",,,,,,
"1005001917156652","https://ae04.alicdn.com/kf/H2d08a9ce26d74449812070e6381f632eg.jpg",,"Autumn Winter Kids Clothes Set Cartoon Print Plus Velvet Thickening Boy And Girl Clothes+Pants 2 And 3-Layer Thick 2-Piece Suit","USD 25.62","USD 13.07","49%","USD","9","USD 1.18","50","93.3%","https://s.click.aliexpress.com/e/_De9P7f1",,,,,,
