"ProductId","Image Url","Video Url","Product Desc","Origin Price","Discount Price","Discount","Currency","Commission Rate","Commission","Sales180Day","Positive Feedback","Promotion Url","Code Name","Code Start Time","Code End Time","Code Value","Code Quantity","Code Minimum Spend"
"1005003832593042","https://ae04.alicdn.com/kf/S4109bf6a03464114883a48ed1aeb69f77.jpg",,"Spring Summer Black Blue Baggy Jeans Men Streetwear Denim Joggers Casual Cotton Harem Pants Jean Trousers Plus Size 6XL 7XL 8XL","USD 45.98","USD 22.99","50%","USD","9","USD 2.07","140","97.7%","https://s.click.aliexpress.com/e/_DkJcFBt",,,,,,
"1005004399070928","https://ae04.alicdn.com/kf/S3748bc7a9f254c6e9be4f90762428fccW.jpg","http://cloud.video.taobao.com/play/u/2675628091/p/1/e/6/t/1/1100068353697.mp4","Autumn Men Pants Military Tactical Jeans Male Multiple Pockets Cargo Pant Casual Straight Dimem Jeans Trousers Plus Size S-4Xl","USD 35.00","USD 19.95","43%","USD","9","USD 1.80","229","95.3%","https://s.click.aliexpress.com/e/_Dmn0YvZ",,,,,,
"1005004810136529","https://ae04.alicdn.com/kf/Sf6f0c288c4ae45f1b5c8a939277ff38av.jpg",,"40 42 44 46 Plus Size Winter Fleece Jeans Classic Business Casual Straight Loose Men's Thick Warm Denim Pants Office Trousers","USD 55.45","USD 28.28","49%","USD","9","USD 2.55","31","96.0%","https://s.click.aliexpress.com/e/_DFuDHQr",,,,,,
"1005003682581914","https://ae04.alicdn.com/kf/He82dc719700b4a0a82cba40b1db8f45a8.jpg",,"SIMWOOD 2022 Autumn Winter New Men's Fleece Ankle-Length Jeans Comfortable Tapered Denim Trousers Plus Size Brand Clothing","USD 81.13","USD 41.38","49%","USD","9","USD 3.72","206","97.8%","https://s.click.aliexpress.com/e/_DBYlHGT",,,,,,
"1005003294288572","https://ae04.alicdn.com/kf/Sd47dca494df4481599f390c2e8e05c9cW.jpg",,"2021 New Men's Winter Fleece Jeans Thick Warm Denim Pants Men Streetwear Black Joggers Harem Jean Thermal Trousers Plus Size 8XL","USD 59.98","USD 29.99","50%","USD","9","USD 2.70","200","95.8%","https://s.click.aliexpress.com/e/_DknAqNZ",,,,,,
"4001316093003","https://ae04.alicdn.com/kf/H454a465b1f6d4c6ebd5db701ef846fc3M.jpg",,"Anbenser Cotton Basic Long Sleeve Womens T-shirt Casual Black White Fashion Solid Top Ladies Fashion Korean Tee Shirt Plus Size","USD 17.41","USD 9.23","47%","USD","9.0","USD 0.83","176","89.0%","https://s.click.aliexpress.com/e/_DdKqjdH",,,,,,
"1005004355902553","https://ae04.alicdn.com/kf/Se5b93d3444614117ad8729a761ad7e7cO.jpg",,"Womens T-shirt Harajuku Y2K Street Tops Harajuku Dragon Gothic Myth Print Short Sleeve Clothes Plus Size Loose Oversized T-shirt","USD 9.98","USD 2.00","80%","USD","9.0","USD 0.18","825","84.6%","https://s.click.aliexpress.com/e/_DkB7bCj",,,,,,
"1005004341506367","https://ae04.alicdn.com/kf/S0db84e9ee83e4f188356c8d30612b2401.jpg",,"Plus Size Women Autumn Washing loose stretchy pant 5XL 6XL women 100kgs trouse boyfriend Black Large Size Ladies Denims Jeans","USD 60.99","USD 31.71","48%","USD","9.0","USD 2.85","167","98.7%","https://s.click.aliexpress.com/e/_DDhctiJ",,,,,,
"32964656044","https://ae04.alicdn.com/kf/Sc82e366cfedf4493a76b486d52471a43N.jpg",,"Spring season loose big size pants pants black plus size XL stretch jeans men's summer thin section 48 46 44 42 40 38","USD 35.86","USD 22.24","38%","USD","9","USD 2.00","92","96.8%","https://s.click.aliexpress.com/e/_DEbeG51",,,,,,
"1005002598671899","https://ae04.alicdn.com/kf/H397cf7c51b444207a265618fa8441c5fP.jpg","http://cloud.video.taobao.com/play/u/2675628091/p/1/e/6/t/1/1100097416509.mp4","2020 New Unique Design Vintage Style Men Plus Size Ancient Viking Embroidery Lace Up V Neck Long Sleeve T-Shirt Top trendy","USD 6.50","USD 5.13","21%","USD","9","USD 0.46","79","92.7%","https://s.click.aliexpress.com/e/_DEefGmF",,,,,,
"4001146771255","https://ae04.alicdn.com/kf/H3948a3f88fdc40fc988ad48d045c5f77B.jpg",,"New Skinny Jeans for Women Female Pant Slim Elastic Plus Size Stretch Jeans Plus Size Denim Blue Skinny Pencil Pant Trousers","USD 16.68","USD 11.68","30%","USD","12.0","USD 1.40","36","88.0%","https://s.click.aliexpress.com/e/_DDhVyzD",,,,,,
"1005003026549270","https://ae04.alicdn.com/kf/S2d64b7c76ec34882ae751bfe62fd2755o.jpg",,"GINGTTO Man Pants Skinny Jeans Light Blue Men Denim Trousers Hip Hop Style Plus Size Jean Male Clothing Summer Slim Fit zm1012","USD 36.83","USD 36.83","0%","USD","13.0","USD 4.79","38","95.0%","https://s.click.aliexpress.com/e/_DDJjQsB",,,,,,
"1005004828288577","https://ae04.alicdn.com/kf/S50fef16fc66d4fb6bce9e50de1492d706.jpg",,"Plus Size Loose Midi Tunic Dress Lantern Sleeve O Neck Casual Oversized Dresses Woman 2022 Autumn 4XL Large Cotton Red Clothing","USD 31.60","USD 15.48","51%","USD","9","USD 1.39","28","100.0%","https://s.click.aliexpress.com/e/_DDC4OBN",,,,,,
"1005004728444254","https://ae04.alicdn.com/kf/Sac5fdf7a6bd043e48e36e316a126b2c3t.jpg",,"Della Mel Plus Size Women Clothing Sexy V Neck Lace Long Sleeves Maxi Dress Ladies Elegant Casual Large Size Dresses 3XL 4XL","USD 38.42","USD 18.44","52%","USD","9.0","USD 1.66","38","100.0%","https://s.click.aliexpress.com/e/_DFhQaAL",,,,,,
"1005004436225504","https://ae04.alicdn.com/kf/S2ae030a8597242a5b861954902fc3d82j.jpg",,"KEBY ZJ Plus Size Women Clothing Black Sexy Deep V Lace Long Sleeves Maxi Dress Ladies Elegant Casual Large Size Dresses 3XL 4XL","USD 22.45","USD 18.41","18%","USD","9","USD 1.66","62","96.0%","https://s.click.aliexpress.com/e/_DkcaNpd",,,,,,
"1005004754026588","https://ae04.alicdn.com/kf/S3fcc3b4617eb472eb52f1d6a3f803930k.jpg",,"Autumn Winter Fashion Plus Size Folk-custom A-line Dress Women Striped Three-quarter Sleeve Oversized Aesthetic Chic Party Dress","USD 34.13","USD 20.48","40%","USD","9.0","USD 1.84","93","95.0%","https://s.click.aliexpress.com/e/_Dk88kjN",,,,,,
"1005004678730846","https://ae04.alicdn.com/kf/Sf5d9defd288c47cc9bbc6173a752275ae.jpg",,"TOLEEN Women Plus Size Maxi Dresses 2022 Luxury Chic Elegant Long Sleeve Embroidery Muslim Turkey Evening Party Wedding Clothing","USD 79.98","USD 39.99","50%","USD","9","USD 3.60","26","73.3%","https://s.click.aliexpress.com/e/_DFKLIbl",,,,,,
"1005003263692036","https://ae04.alicdn.com/kf/Sc05607a8527e46d6b995d3f368783045Y.jpg",,"Plus Size Holiday One Shoulder Sundress Women Maxi Dress 2022 VONDA Long Sleeve Floral Printed Pleated Long Dress Casual Vestido","USD 24.58","USD 16.71","32%","USD","9.0","USD 1.50","85","93.3%","https://s.click.aliexpress.com/e/_DDVq0W3",,,,,,
"1005004780051948","https://ae04.alicdn.com/kf/Se3adbfb851ca408a93e800758b046ff25.jpg","http://cloud.video.taobao.com/play/u/2675628091/p/1/e/6/t/1/1100089625822.mp4","Della Mel 3XL 4XL Plus Size Elegant Dresses for Women Black V Neck Belted Lantern Sleeve Ladies Large Size Evening Party Dress","USD 37.22","USD 19.35","48%","USD","9.0","USD 1.74","31","100.0%","https://s.click.aliexpress.com/e/_DmCdeuB",,,,,,
"1005004754348007","https://ae04.alicdn.com/kf/Sbfa302da6eb74d71b7a20d58bf170e74V.jpg","http://cloud.video.taobao.com/play/u/2675628091/p/1/e/6/t/1/1100088250329.mp4","Della Mel Plus Size Dresses For Women 2022 Casual V Neck Long Sleeves Elegant Party Vintage Large Size Female Midi Dress 3XL 4XL","USD 36.22","USD 18.11","50%","USD","9.0","USD 1.63","45","86.0%","https://s.click.aliexpress.com/e/_DFdCEEb",,,,,,
"4000296196744","https://ae04.alicdn.com/kf/H47e83c818abb46b383a960f734a34048P.jpg",,"Humor Bear Winter Baby Girl Long Sleeve Dress Plus Velvet Children's Color Polka Dot Velvet Babies Dress Infant Christmas Dress","USD 9.97","USD 6.98","30%","USD","7","USD 0.49","52","92.5%","https://s.click.aliexpress.com/e/_DFGTOpZ",,,,,,
"1005002228051924","https://ae04.alicdn.com/kf/H0b0bf1db7fba4b1499a776984979b260n.jpg","http://cloud.video.taobao.com/play/u/2675628091/p/1/e/6/t/1/1100028021070.mp4","NYFS 2022 Summer New Korea Loose Woman Dress Vestidos Robe Ete Femme Elbise Solid Plus Size Pure cotton Short Sleeve Long Dress","USD 38.02","USD 19.01","50%","USD","9","USD 1.71","27","95.6%","https://s.click.aliexpress.com/e/_DCgNlcb",,,,,,
"1005001265081084","https://ae04.alicdn.com/kf/H331010cf77374f49ab9c9d01d4374177E.jpg","http://cloud.video.taobao.com/play/u/2675628091/p/1/e/6/t/1/337139324010.mp4","2022 Autumn Women Dress Plus Size 5XL Ladies Vestidos Long Sleeve T-Shirt Dress Patchwork Dress Cotton Print Robe Fake Two Piece","USD 25.77","USD 16.75","35%","USD","9.0","USD 1.51","270","89.4%","https://s.click.aliexpress.com/e/_DDfzpOr",,,,,,
"1005004647368474","https://ae04.alicdn.com/kf/Sc63dad4972c74eb4b836637725f2de816.jpg",,"Elegant Luxury Autumn Women Evening Dresses Fur Collar Long Sleeve Plus Size Patchwork Maxi Dress Wholesale Dropshipping","USD 44.66","USD 24.12","46%","USD","9","USD 2.17","102","94.0%","https://s.click.aliexpress.com/e/_DdWleUP",,,,,,
"1005004294415466","https://ae04.alicdn.com/kf/Sd0f9d6b0b9704fa69128b0276f90da1f8.jpg",,"TOLEEN Plus Size Women Maxi Dress 2022 Luxury Chic Elegant Long Sleeve Embroidery Turkish African Evening Party Wedding Clothing","USD 85.98","USD 42.99","50%","USD","9","USD 3.87","22","100.0%","https://s.click.aliexpress.com/e/_DcYU0nd",,,,,,
"1005003680629617","https://ae04.alicdn.com/kf/H99be3f500e514d54b8f250f77d11aa4bE.jpg",,"TOLEEN Women Plus Size Maxi Dresses 2022 Spring Green Large Long Sleeve Luxury Designer Chic Elegant Evening Party Robe Clothing","USD 79.98","USD 39.99","50%","USD","9","USD 3.60","81","93.0%","https://s.click.aliexpress.com/e/_DkeRd6P",,,,,,
"1005004733436599","https://ae04.alicdn.com/kf/Sc6d192ff7d2f4b1eb4fcb781f9213645H.jpg","http://cloud.video.taobao.com/play/u/2675628091/p/1/e/6/t/1/1100086914799.mp4","2022 Casual V-Neck Women's Loose Plus Size Dress Women's Golden Velvet Spring Leopard Print Long Sleeve Slim Fit Women's Dress","USD 56.93","USD 30.74","46%","USD","9","USD 2.77","33","100.0%","https://s.click.aliexpress.com/e/_Dnsag9p",,,,,,
"1005004294970966","https://ae04.alicdn.com/kf/Sa8229eec794c4026bada496f95b9b7fei.jpg",,"TOLEEN Large Plus Size Maxi Dresses For Women 2022 Spring Luxury Chic Elegant Long Sleeve Muslim Party Evening Festival Clothing","USD 79.98","USD 39.99","50%","USD","9","USD 3.60","27","100.0%","https://s.click.aliexpress.com/e/_DDdOnQB",,,,,,
"1005004605379754","https://ae04.alicdn.com/kf/Sfddd6fb830fe41e08942bdfd7dc778f8Y.jpg",,"Temperament Commuter Plus Size Dress 2022 Autumn New Fashion  Stripe Lace Up Shirt Women's Wear Wholesale Dropshipping","USD 42.50","USD 16.15","62%","USD","20.0","USD 3.23","29","96.4%","https://s.click.aliexpress.com/e/_Dd9UMMR",,,,,,
"1005003803541279","https://ae04.alicdn.com/kf/H6c10375fd088424480a7c957e89673a4q.jpg",,"TOLEEN Women's Elegant Plus Size Oversized Maxi Dresses 2022 Spring Giant Puff Long Large Muslim Evening Party Festival Clothing","USD 77.98","USD 38.99","50%","USD","9","USD 3.51","38","98.0%","https://s.click.aliexpress.com/e/_DnOir2P",,,,,,
"33043379750","https://ae04.alicdn.com/kf/HTB1U42Hc.CF3KVjSZJnq6znHFXan.jpg",,"Plus size prom party evening dresses vestido de noiva sereia gown boat neck robe de soiree prom party satin pleat dress soirée","USD 75.00","USD 41.25","45%","USD","7","USD 2.89","37","100.0%","https://s.click.aliexpress.com/e/_DeIG9Hz",,,,,,
"1005004708563459","https://ae04.alicdn.com/kf/S2f9a8b5e3c7b40f583f4a464add57919p.jpg",,"Plus Size Floor-length Elegant Dress Solid Color High Waist Pleated Bohemian Women Clothing Temperament V-neck Formal Dresses","USD 28.79","USD 17.27","40%","USD","13.0","USD 2.25","48","88.7%","https://s.click.aliexpress.com/e/_DmTjKX5",,,,,,
"1005004500742011","https://ae04.alicdn.com/kf/Sa27fc736774a4188b9a4529f65b839a7v.jpg",,"TOLEEN Plus Size Maxi Dress Large 2022 Spring Women Long Sleeve Luxury Chic Elegant Evening Party Wedding Festival Robe Clothing","USD 73.98","USD 35.51","52%","USD","9","USD 3.20","163","98.9%","https://s.click.aliexpress.com/e/_DcYY8sB",,,,,,
"1005004671522632","https://ae04.alicdn.com/kf/S2f43302f683548339dc593652b2b4092M.jpg",,"ROSEGAL Bicolor Lace Up High Low Dresses Red Women's Clothing Vestidos 5XL Sleeveless Asymmetrical Tulip Party Xmas Dress","USD 27.39","USD 15.89","42%","USD","9","USD 1.43","63","93.3%","https://s.click.aliexpress.com/e/_Dm6URkT",,,,,,
"1005004649356837","https://ae04.alicdn.com/kf/S787463f9602048cc883eec13f9294836R.jpeg",,"LW Plus Size Faith Letter Print Ruffle Design Loose Dress Elegant Summer Butterfly Sleeve Drop Shoulder A Line Women Clothing","USD 32.35","USD 17.79","45%","USD","9","USD 1.60","47","100.0%","https://s.click.aliexpress.com/e/_DCl51M3",,,,,,
"1005004351875423","https://ae04.alicdn.com/kf/S6469e10100af4c5091d271cafbdbaecdb.jpg",,"Backless Sexy Dresses For Women 2022 Summer Halter Neck Club Party Bodycon Dress Sleeveless Female Black O-neck Elegant Vestidos","USD 3.60","USD 2.52","30%","USD","9","USD 0.23","124","88.6%","https://s.click.aliexpress.com/e/_DdbdKyf",,,,,,
"4000242189464","https://ae04.alicdn.com/kf/H830338586bc2488a9e94847c8502577bS.jpg","http://cloud.video.taobao.com/play/u/2675628091/p/1/e/6/t/1/253234229997.mp4","Plus size Women's Fashion 1920s Flapper Dress Vintage Great Gatsby Charleston Sequin Tassel 20s Party Dress","USD 27.47","USD 24.72","10%","USD","9","USD 2.22","53","97.5%","https://s.click.aliexpress.com/e/_DcvaBXv",,,,,,
"4001105229551","https://ae04.alicdn.com/kf/H90a7e1eb7c3c479a8fa6f4d43b4e65ddB.jpg",,"TOLEEN 2022 Women Plus Size Large Maxi Dresses Elegant Evening Party Summer Black Abayas Long Muslim Festival Oversized Clothing","USD 63.98","USD 31.99","50%","USD","9","USD 2.88","33","96.7%","https://s.click.aliexpress.com/e/_DFYbn47",,,,,,
"1005003293777639","https://ae04.alicdn.com/kf/S74967055f2e24ce6affd3b6e5b85c6b6a.jpg",,"VONDA 2022 Autumn Party Dress Women Plus Size Vestidos Casual O Neck Vintage Patchwork Long Lantern Sleeve Dresses Short Robe","USD 24.65","USD 16.52","33%","USD","9","USD 1.49","179","90.3%","https://s.click.aliexpress.com/e/_Dk8gsyP",,,,,,
"1005004148870783","https://ae04.alicdn.com/kf/Scd4df40189ad420593248cabb38cdc52T.jpg",,"Vintage Graphic Print Half Sleeve Elegant Party Dresses for Women 2022 Summer Fashion Ladies Plus Size A Line Midi Dress Robe","USD 30.89","USD 16.99","45%","USD","9.0","USD 1.53","203","94.9%","https://s.click.aliexpress.com/e/_DCKI8Uf",,,,,,
"1005003626272786","https://ae04.alicdn.com/kf/S0fa61bfe8d0448fca7a53732ee185717a.jpg",,"VONDA Plus Size 5XL Women Dress Vintage Bohemian Vestido 2022 Autumn Sexy V Neck Long Sleeve Holiday Robe Femme Printed Sundress","USD 23.87","USD 15.99","33%","USD","9","USD 1.44","291","92.3%","https://s.click.aliexpress.com/e/_DEYkkFl",,,,,,
"33009264952","https://ae04.alicdn.com/kf/HTB1ULjxTQzoK1RjSZFlq6yi4VXae.jpg",,"Robe De Mariee Grande Taille New Wedding Dress Lace appliques pearls Sweetheart Ball Gown Princess Plus Size Vintage Brides 25","USD 63.90","USD 48.56","24%","USD","7","USD 3.40","50","98.3%","https://s.click.aliexpress.com/e/_DmQJgun",,,,,,
"1005004294811185","https://ae04.alicdn.com/kf/Sf1d3d3a04cf64463affc8978fe73dadbp.jpg",,"TOLEEN Plus Size Women Maxi Dress 2022 Luxury Chic Elegant Long Sleeve Embroidery Turkish African Evening Party Wedding Clothing","USD 85.98","USD 41.27","52%","USD","9","USD 3.71","61","98.5%","https://s.click.aliexpress.com/e/_DEOFkWL",,,,,,
"4001120189629","https://ae04.alicdn.com/kf/Hb0e0e66c3862495689265df4034ab90cR.jpg",,"Pregnancy Dress for Photo Shoot Maternity Photography Props Sexy V Neck Lace Maxi Gown Dress Plus Size Pregnant Women Clothes","USD 8.30","USD 4.98","40%","USD","7","USD 0.35","81","97.1%","https://s.click.aliexpress.com/e/_DFGX6K7",,,,,,
"1005003035863351","https://ae04.alicdn.com/kf/H6d5196679ef9455a962c096154e11c76K.jpg",,"New 2022 Summer 3D Flower Print Bohemian Dress Women Short Sleeve Mini Dress Casual O-Neck Loose Dress Plus Size Women Clothing","USD 11.77","USD 6.47","45%","USD","10.0","USD 0.65","167","90.0%","https://s.click.aliexpress.com/e/_DCrdAKx",,,,,,
"1005004460360476","https://ae04.alicdn.com/kf/S8c13fd658e214273adefb7769a1a5d89p.jpg",,"TOLEEN Women Plus Size Large Maxi Dresses 2022 Black Luxury Chic Elegant Long Sleeve Sequin Evening Party Festival Robe Clothing","USD 73.98","USD 36.99","50%","USD","9","USD 3.33","59","100.0%","https://s.click.aliexpress.com/e/_Dnd77n1",,,,,,
"1005004291648918","https://ae04.alicdn.com/kf/S81ece22bc7144118bafa1893426bb450c.jpg",,"LIH HUA Women's Plus Size Denim Dress Fall Casual Fashion High Stretch Cotton Knit Dress with Pockets","USD 66.00","USD 33.00","50%","USD","20.0","USD 6.60","80","97.9%","https://s.click.aliexpress.com/e/_DFxtozv",,,,,,
"32922268046","https://ae04.alicdn.com/kf/S30545581820a4fd4b1473494b944f6c9q.jpg","http://cloud.video.taobao.com/play/u/2675628091/p/1/e/6/t/1/284809950360.mp4","Real Vedio Luxury Lace Applique Plus Size Wedding Dress Embroidery 2022 New Long Train Sweetheart Bride Gown Vestidos De Noiva","USD 106.00","USD 72.08","32%","USD","7","USD 5.05","79","93.3%","https://s.click.aliexpress.com/e/_DdkjXxt",,,,,,
"1005004831517609","https://ae04.alicdn.com/kf/S3bd686ba379f45a5a73dc1794150f9d6N.jpg",,"Plus Size Pink Midi Dress Women Floral Print Ruffles Sleeve 2022 Summer Autumn Casual Oversized 4XL Elegant Loose Dresses","USD 23.89","USD 12.42","48%","USD","9","USD 1.12","88","99.0%","https://s.click.aliexpress.com/e/_DDJfind",,,,,,
"1005004392531207","https://ae04.alicdn.com/kf/S5cecf3677a764407ad14b8d6422d11a9n.jpg","http://cloud.video.taobao.com/play/u/2675628091/p/1/e/6/t/1/1100047611240.mp4","Plus Size Evening Dresses 4XL O Neck Lace Lantern Sleeve Hollow Out Patchwork White Pink Gowns for Ladies Event Cocktail Outfits","USD 69.98","USD 34.29","51%","USD","9.0","USD 3.09","71","92.7%","https://s.click.aliexpress.com/e/_DDN3lpN",,,,,,
"1005004749245176","https://ae04.alicdn.com/kf/S2d6daa2ae15a4d96a4e262a2b771ce60p.jpg",,"Autumn Winter Plus Size Sexy Irregular Design Bag Hip Dress Women Off-shoulder Sequin Fashion Oversized Chic Vestidos De Fiesta","USD 21.25","USD 12.75","40%","USD","9.0","USD 1.15","166","98.6%","https://s.click.aliexpress.com/e/_Dd3Vm0X",,,,,,
"1005004658613959","https://ae04.alicdn.com/kf/Sa815393db46a43919cd5e20cc81856f8S.jpg","http://cloud.video.taobao.com/play/u/2675628091/p/1/e/6/t/1/1100085842037.mp4","Burgundy Lace Dresses Plus Size Short Sleeve Off Shoulder Elegant Ladies Empire Peplum Midi Outfits for Women Evening Party 4XL","USD 59.98","USD 29.39","51%","USD","9.0","USD 2.65","78","100.0%","https://s.click.aliexpress.com/e/_DCHxcHZ",,,,,,
"1005004251020929","https://ae04.alicdn.com/kf/S530908dfb1214c60929ac6f82f45ed58P.jpg","http://cloud.video.taobao.com/play/u/2675628091/p/1/e/6/t/1/1100023808866.mp4","Plus Size 7XL Women Clothing Satin Silk Night Dress Ladies Night wear Solid Slip Sleep Dress  V-neck Fashion Pajamas Dress","USD 19.99","USD 13.99","30%","USD","9","USD 1.26","36","100.0%","https://s.click.aliexpress.com/e/_DlmYZU7",,,,,,
"1005004766349951","https://ae04.alicdn.com/kf/Sf9bcc3272aea42b59701443d33709888G.jpg","http://cloud.video.taobao.com/play/u/2675628091/p/1/e/6/t/1/1100088873870.mp4","Della Mel Plus Size Women Clothing Black O Neck Lace Long Sleeves Maxi Dress Ladies Elegant Casual Large Size Dresses 3XL 4XL","USD 39.62","USD 19.02","52%","USD","9.0","USD 1.71","42","100.0%","https://s.click.aliexpress.com/e/_DEfy8vv",,,,,,
"32700665835","https://ae04.alicdn.com/kf/HTB1YNohKVXXXXaGaXXXq6xXFXXXs.jpg",,"Big size 6XL 2022 Fat MM Woman dress Spring loose printing long dresses plus size women clothing 6xl dress party gown","USD 36.29","USD 12.70","65%","USD","9","USD 1.14","33","90.7%","https://s.click.aliexpress.com/e/_DEBywjH",,,,,,
"32646361768","https://ae04.alicdn.com/kf/HTB1rMztEv1TBuNjy0Fjq6yjyXXaA.jpg",,"DONGCMY ROBE DE SOIRE CG1020 LONG FORMAL EVENING DRESS PARTY ONE SHOULDER CHIFFON LACE-UP PLUS SIZE VESTIDO FESTA","USD 62.60","USD 34.43","45%","USD","8.0","USD 2.75","38","100.0%","https://s.click.aliexpress.com/e/_DdIaw6b",,,,,,
"1005004539128565","https://ae04.alicdn.com/kf/S533acef1740c41d1953fee067efde41b7.jpg","http://cloud.video.taobao.com/play/u/2675628091/p/1/e/6/t/1/1100075647525.mp4","Wmstar Plus Size Dresses for Women Elegant Party  Solid Ruffles Sleeve Big Hem Midi Dress Hot Sale New Wholesale Dropshipping","USD 38.27","USD 20.28","47%","USD","9","USD 1.83","62","97.8%","https://s.click.aliexpress.com/e/_DEmA1td",,,,,,
"1005004351687704","https://ae04.alicdn.com/kf/Scd9cff7d7fea44d3b148a8d742eb23f1n.jpg",,"LW Plus Size Dress V Neck Plaid Print  Summer Women Casual Loose Office Lady Fashion Streetwear Vintage Vestidos","USD 23.86","USD 14.32","40%","USD","9","USD 1.29","38","91.4%","https://s.click.aliexpress.com/e/_DmNbGcB",,,,,,
"1005004542411843","https://ae04.alicdn.com/kf/S728769b9ad2c4815a8ed892a196e2593x.png","http://cloud.video.taobao.com/play/u/2675628091/p/1/e/6/t/1/1100074057726.mp4","Dress Plus Size Sexy One Shoulder Long Sleeve Sequin Long Dress Shiny Elegant Slim Fit Velvet Large Women Party Evening Dress","USD 68.53","USD 35.64","48%","USD","9.0","USD 3.21","65","97.9%","https://s.click.aliexpress.com/e/_DkxIdM7",,,,,,
"1005003879127234","https://ae04.alicdn.com/kf/S967e188e86bb414ab369c426ef56ca742.jpg",,"TOLEEN Plus Size Women Dress For Elegant Lady 2022 Muslim Maxi Summer Floral Wide Long Large Clothing For Evening Festival Party","USD 67.98","USD 33.99","50%","USD","9","USD 3.06","81","98.4%","https://s.click.aliexpress.com/e/_DDnGm2b",,,,,,
"32890704138","https://ae04.alicdn.com/kf/HTB1xtI8B4GYBuNjy0Fnq6x5lpXag.jpg","http://cloud.video.taobao.com/play/u/2675628091/p/1/e/6/t/1/50230432580.mp4","Beading Prom Dresses 2022 Plus Size Pink High Split Tulle Sweep Train Sleeveless Evening Gown A-line Lace Up Backless Vestido De","USD 149.90","USD 65.96","56%","USD","8.0","USD 5.28","42","100.0%","https://s.click.aliexpress.com/e/_DlMHiFN",,,,,,
"4000830773317","https://ae04.alicdn.com/kf/H4cd155b42a174c15aa1a8a5ccca9f9b9I.jpg",,"Pink/White/Red Bride Wedding Dress Lace Up Tube Top Floor-length Wedding Dresses Plus Size Flower Dresses Ball Gowns","USD 61.00","USD 42.09","31%","USD","7","USD 2.95","27","98.5%","https://s.click.aliexpress.com/e/_DewP9AX",,,,,,
"1005004821100754","https://ae04.alicdn.com/kf/Seee8e370d5404954b0780e67a730f9df7.jpg",,"Plus Size A Line Midi Tunic Casual Dress Women's 2022 Summer Cotton Short Sleeve Wine Red Clothing Stylish Elegant Dresses","USD 22.23","USD 12.67","43%","USD","9","USD 1.14","20","90.0%","https://s.click.aliexpress.com/e/_DDWYnrv",,,,,,
"1005004632774697","https://ae04.alicdn.com/kf/S416578304cc2444097bc06b9786c10d5z.jpg",,"Maternity Photography Sexy Shiny Goddess Bodysuit Rhinestone Maternity Dress For Photo Shoot Plus Size Senior Pregnant","USD 134.00","USD 104.52","22%","USD","8.0","USD 8.36","33","95.0%","https://s.click.aliexpress.com/e/_DdBJ54b",,,,,,
"1005004737812456","https://ae04.alicdn.com/kf/S0dd891f490814bd2a5d0527b726babcaO.jpg",,"Plus Size Elegant Midi Dress for Women 2022 Autumn Winter Leopard Long Sleeve Wine Red Black Casual Dresses Large Size Clothing","USD 25.21","USD 13.11","48%","USD","9","USD 1.18","25","100.0%","https://s.click.aliexpress.com/e/_DE1qtMx",,,,,,
"1005004453440114","https://ae04.alicdn.com/kf/S47cffecb38aa47b6b3ef419c50b6ecd8b.jpg",,"Simple Short Wedding Dresses 2022 Satin V Neck Bride Dress Big Bow on Back Beach Country White Vestido De Novia Plus Size","USD 109.00","USD 70.85","35%","USD","7","USD 4.96","73","96.7%","https://s.click.aliexpress.com/e/_DE4fyqx",,,,,,
"4000262158748","https://ae04.alicdn.com/kf/He071817051d6452d86fe083bfb0c63d7r.jpg","http://cloud.video.taobao.com/play/u/2675628091/p/1/e/6/t/1/241265116707.mp4","Lace Embroidery 2022 Spring Africa Style  Wedding Dress Long Train Sweet Elegant Plus Size Vestido De Noiva Bride V Neck 7","USD 66.90","USD 46.16","31%","USD","7","USD 3.23","42","92.0%","https://s.click.aliexpress.com/e/_DmeBK6F",,,,,,
"4000908196633","https://ae04.alicdn.com/kf/H137caffda5994827ab8aab0ae9895059f.jpg",,"Plus Size 5XL Elegant Spring Autumn Women Dress Casual Bohmia Flower Print Maxi Dresses Fashion Hollow Out Tunic Vestidos Dress","USD 14.57","USD 9.76","33%","USD","9","USD 0.88","80","89.4%","https://s.click.aliexpress.com/e/_DkIslZd",,,,,,
"1005004561593697","https://ae04.alicdn.com/kf/S02872526e6d44deaaf25962039c521baV.jpg",,"Plus Size Women Dress Flare Short Sleeve Cold Shoulder Embroidery Elegant Dress Party Lace Patchwork High-low Hem Dress Summer","USD 12.69","USD 6.98","45%","USD","9","USD 0.63","34","63.3%","https://s.click.aliexpress.com/e/_DB0g3iR",,,,,,
"1005004832567448","https://ae04.alicdn.com/kf/S9c757318616848e1867edbfdd783b1c0g.jpg",,"Large Plus Size 4XL Leopard Midi Dress Women Black Patchwork Cotton Short Sleeve O Neck Casual Elegant Oversized Loose Dresses","USD 29.89","USD 14.65","51%","USD","9","USD 1.32","34","100.0%","https://s.click.aliexpress.com/e/_DkWJq27",,,,,,
"1005004208098246","https://ae04.alicdn.com/kf/Sfd9e967246744da8aa75f2e9509f8e9fU.jpg","http://cloud.video.taobao.com/play/u/2675628091/p/1/e/6/t/1/1100017216519.mp4","Hot Sale Dresses For Summer 2022 Women Bronzing Butterfly Dress Short Sleeve Casual Oversized Dress Fashion Clothing Plus Size","USD 11.98","USD 5.99","50%","USD","9","USD 0.54","69","87.8%","https://s.click.aliexpress.com/e/_DeZv4aj",,,,,,
"1005003993743902","https://ae04.alicdn.com/kf/Sae26d2c829bb42ae9e7950491093862aO.jpg",,"White Ball Gown Wedding Dress Long Sleeves Lace Sequin Appliques 2021 Plus Size  Formal Bridal Dresses Princess Wedding Gowns","USD 182.81","USD 93.23","49%","USD","13.0","USD 12.12","115","93.7%","https://s.click.aliexpress.com/e/_DFXzbFZ",,,,,,
"4000545455125","https://ae04.alicdn.com/kf/H0964850313d8417687cadd051a4d1f713.jpg",,"Big size 9XL Dress for Fat MM 2022 Woman Summer dress Loose plus size dresses off the shoulder women clothing 9XL dress vestidos","USD 14.27","USD 9.99","30%","USD","9","USD 0.90","57","85.7%","https://s.click.aliexpress.com/e/_DdSx7Ux",,,,,,
