"ProductId","Image Url","Video Url","Product Desc","Origin Price","Discount Price","Discount","Currency","Commission Rate","Commission","Sales180Day","Positive Feedback","Promotion Url","Code Name","Code Start Time","Code End Time","Code Value","Code Quantity","Code Minimum Spend"
"4000803517914","https://ae04.alicdn.com/kf/S98d7c7c5c34246e6b26d7c608cfd69132.jpg","http://cloud.video.taobao.com/play/u/2675628091/p/1/e/6/t/1/342803025009.mp4","Women's Casual Fashion Air Cushion Lightweight Training Shoes Mesh Breathable Sneakers","USD 17.90","USD 17.90","0%","USD","8.0","USD 1.43","159","93.8%","https://s.click.aliexpress.com/e/_DEeeEyJ",,,,,,
"1005004548104860","https://ae04.alicdn.com/kf/Sb88c4fb6f0944e6694520e7a70c0c8d0W.jpg",,"2022 Spring Summer New  Women's Single Shoes Fashion Saturn PVC Jelly Shoes Ladies Soft Sole Beach Shoes with Fragrant","USD 16.46","USD 11.52","30%","USD","8.0","USD 0.92","68","90.0%","https://s.click.aliexpress.com/e/_Dnr355H",,,,,,
"1005004715515740","https://ae04.alicdn.com/kf/Sd2d6f2d7ef914e1380cebf22386b8bcaV.jpg",,"2022 New Snow Women's Boots Keep Warm Fur Ankle Boots Comfortable Winter Women Shoes Outdoor Botas Plus Size 35-45","USD 19.96","USD 9.98","50%","USD","8.0","USD 0.80","46","97.1%","https://s.click.aliexpress.com/e/_DdcvLCT",,,,,,
"1005003320145064","https://ae04.alicdn.com/kf/S44ed5461bfc14565baacd47db21962f9F.jpg",,"2022 Winter Boots Women Low Heel Ankle Boot Skull Flower Printing Punk Goth Fashion Lace-up Warm Women's Shoes Botas De Mujer","USD 22.59","USD 13.10","42%","USD","7","USD 0.92","53","93.3%","https://s.click.aliexpress.com/e/_DcuuLTh",,,,,,
"1005004043363791","https://ae04.alicdn.com/kf/S62a0b5e61857463eba061785a02d5f13Z.jpg",,"Thick-soled Biscuit Shoes Women's 2022 New Low-top Canvas Shoes Women's Platform Small White Shoes Casual Student Sneakers","USD 22.80","USD 11.40","50%","USD","8.0","USD 0.91","47","92.9%","https://s.click.aliexpress.com/e/_DFWuXdd",,,,,,
"1005001802647275","https://ae04.alicdn.com/kf/Sba05655ce9674526a59b27f7d33566b7b.jpg","http://cloud.video.taobao.com/play/u/2675628091/p/1/e/6/t/1/297907183568.mp4","Spring Women Thick Sole Ankle Boots Autumn Luxury Platform Casual Boots Women's 8cm High Heels Wedge Boots Shoes Woman Sneakers","USD 38.88","USD 27.22","30%","USD","8.0","USD 2.18","124","99.3%","https://s.click.aliexpress.com/e/_DCFwCWT",,,,,,
"32970839073","https://ae04.alicdn.com/kf/Sa74882deb2d24588b5541ba906f6d47bt.jpg",,"STRONGSHEN New Spring Flat Women's Shoes Suede Leather Casual Shoes Low Heel Black Women's Shoes Flat Loafers Jazz Oxford","USD 25.68","USD 21.83","15%","USD","10.0","USD 2.18","41","100.0%","https://s.click.aliexpress.com/e/_DDpWa2j",,,,,,
"1005003744981868","https://ae04.alicdn.com/kf/S6bfa85c303464ff580f595f0a9095302e.jpg",,"Women Mary Janes Shoes Plus Velvet Warm Cotton Shoes Ladies Girls Students Casual Hook&loop Flat Shoes Woman Shearling Loafers","USD 28.78","USD 13.81","52%","USD","8.0","USD 1.10","44","100.0%","https://s.click.aliexpress.com/e/_DmMhf7v",,,,,,
"1005002458733142","https://ae04.alicdn.com/kf/S1b5f6c9278d84356bd4b58ec6c565640E.jpg","http://cloud.video.taobao.com/play/u/2675628091/p/1/e/6/t/1/305603858075.mp4","Rhinestone Square-head Transparent Jelly Flip-flop Platform Women's Sandles Summer 2021 PVC Beach Open-toed Outdoor Slides Women","USD 27.57","USD 12.41","55%","USD","7","USD 0.87","50","97.6%","https://s.click.aliexpress.com/e/_DE12v1H",,,,,,
"1005003230204565","https://ae04.alicdn.com/kf/H61dad7668df74de083eced937af9fdc0p.jpg",,"2021 Winter Plush Slippers Fashion Open Toe Solid Color Women's Sandals Metal Chain Outdoor Casual Women's Shoes  Fashion Shoes","USD 5.64","USD 3.95","30%","USD","14.5","USD 0.57","647","90.4%","https://s.click.aliexpress.com/e/_DlUHXVl",,,,,,
"1005003088779399","https://ae04.alicdn.com/kf/H3e831be48f5d4cfe964d46fd4eafb231B.jpg",,"JIANBUDAN Winter plush slippers Home cotton shoes Women's comfortable Flat Slippers Winter Indoor Warm Non slip slippers Unisex","USD 23.74","USD 11.63","51%","USD","7","USD 0.81","20","100.0%","https://s.click.aliexpress.com/e/_Dcyma8r",,,,,,
"1005004845350672","https://ae04.alicdn.com/kf/S9eea8f48bbe6466bb346da1bb47a8ab8m.jpg","http://cloud.video.taobao.com/play/u/2675628091/p/1/e/6/t/1/1100093091314.mp4","Women's Winter Cartoon Cute Panda Plush Cotton Slippers Indoor Soft Soled House Slippers Comfortable Lightweight Chaussons Plats","USD 16.83","USD 8.42","50%","USD","7","USD 0.59","46","91.4%","https://s.click.aliexpress.com/e/_DlY3WRH",,,,,,
"1005004416546414","https://ae04.alicdn.com/kf/A3efc3a48753140978807e6ab21954f025.jpg",,"JaneTroides 2022 Fashion Baotou Slippers Women's Summer Indoor Home Thick Cloud Non-slip Bow Sandals Girls Outside Flat Shoes","USD 11.98","USD 5.99","50%","USD","7","USD 0.42","47","96.0%","https://s.click.aliexpress.com/e/_Dli4WUX",,,,,,
"1005004792755388","https://ae04.alicdn.com/kf/S3d8f16e743e04dd2b7fc06a33a2f1d865.jpg",,"Mo Dou Women's Cotton Slippers Concise Wrapped Toe Indoor Winter Warm Non Slip Waterproof Slippers Platform Nurse Doctor Shoes","USD 28.29","USD 19.80","30%","USD","7","USD 1.39","161","92.7%","https://s.click.aliexpress.com/e/_DCvR1j1",,,,,,
"4001221343196","https://ae04.alicdn.com/kf/Sdc41de30a7b24bc6a1af7cfd24b3eeb0o.jpg",,"Fur Slippers Women Furry Slides Summer Fluffy Slippers House Shoes Woman Real Fur Slides Home Wholesale Women's Fur Fox Slippers","USD 31.80","USD 20.35","36%","USD","8.0","USD 1.63","78","92.0%","https://s.click.aliexpress.com/e/_DeGDWoX",,,,,,
"1005004806270097","https://ae04.alicdn.com/kf/Sbd04b2a1e7db49869e6cbfdaff2200c4b.jpg","http://cloud.video.taobao.com/play/u/2675628091/p/1/e/6/t/1/1100091053023.mp4","Genuine Leather Woven Ankle Boots Women's Winter Fur Shoes Big Size 42 Designer Plait Chelsea Boots Woman Winter Plush Booties","USD 31.77","USD 15.25","52%","USD","8.0","USD 1.22","23","96.5%","https://s.click.aliexpress.com/e/_Depqvsb",,,,,,
"1005004741419573","https://ae04.alicdn.com/kf/Sca59eea985574f1d83a5587c699ba655E.jpg","http://cloud.video.taobao.com/play/u/2675628091/p/1/e/6/t/1/1100087568765.mp4","QSGFC Gold Comfortable Streamlined Pointed Toe Women's Shoes Matching Trapezoid Handbag Party Women's Shoes And Bag Set","USD 95.99","USD 61.43","36%","USD","8.0","USD 4.91","22","100.0%","https://s.click.aliexpress.com/e/_DBDTGcJ",,,,,,
"1005002222297247","https://ae04.alicdn.com/kf/See95612cd7ac4e9eb8b86c00773f0fd6F.jpg","http://cloud.video.taobao.com/play/u/2675628091/p/1/e/6/t/1/297176020268.mp4","ZANPACE 2022 Spring Women's Sneakers New Canvas Breathable Vulcanized Platform White Shoes Fashion Winter Casualot Women Shoes","USD 14.26","USD 8.56","40%","USD","9.0","USD 0.77","35","93.3%","https://s.click.aliexpress.com/e/_DBkRjP1",,,,,,
"1005004314433411","https://ae04.alicdn.com/kf/Sb87e6e8a985c488b802f57ceb6d73ea2m.jpg","http://cloud.video.taobao.com/play/u/2675628091/p/1/e/6/t/1/1100033292147.mp4","Rhinestone Platform Mules Shoes Women Embroidered Print Slippers Female New Retro Chain Half Drag Light Non-slip Women's Sandals","USD 39.33","USD 17.70","55%","USD","7","USD 1.24","46","98.0%","https://s.click.aliexpress.com/e/_DDsrWIb",,,,,,
"1005002440529948","https://ae04.alicdn.com/kf/S3b9520af89f548748456c609b6f0cf708.jpg",,"New Pointed Women Sandals 2021 Spring Summer Mid Heel Hollow Shoes Fashion Women's Shoes Obuv Zapatos Mujer Size 41","USD 22.24","USD 16.46","26%","USD","8.0","USD 1.32","150","91.9%","https://s.click.aliexpress.com/e/_DEOb0S3",,,,,,
"1005004523262384","https://ae04.alicdn.com/kf/S037d2eacb6d64a1880b4b71601ab518f5.jpg","http://cloud.video.taobao.com/play/u/2675628091/p/1/e/6/t/1/1100065454594.mp4","New Women's Mesh Sneakers 2022 Fashion Breathable Mesh Casual Shoes Summer Socks Vulcanized Shoes Sports Zapatillas Mujer","USD 8.29","USD 4.56","45%","USD","8.0","USD 0.36","35","98.8%","https://s.click.aliexpress.com/e/_DkjK3NV",,,,,,
"1005004448809287","https://ae04.alicdn.com/kf/S915f9e6be8ad4db5bf8d7f3a39c596f2F.jpg","http://cloud.video.taobao.com/play/u/2675628091/p/1/e/6/t/1/1100068511837.mp4","Rimocy Breathable Knitting Women's Sneakers 2022 Summer Slip-on Striped Soft Bottom Flats Woman Outdoor Non-slip Casual Shoes","USD 25.02","USD 13.76","45%","USD","7","USD 0.96","49","97.9%","https://s.click.aliexpress.com/e/_DlvelDH",,,,,,
"1005003949193613","https://ae04.alicdn.com/kf/S2cfe69993db543f6a19f02d40a7691e8Z.jpg",,"2022 Autumn Loafers Shoe Sneakers for Women Shoes Breathable Women's Casual Shoes Lace Up Solid Color Woman Shoes","USD 9.58","USD 6.23","35%","USD","7","USD 0.44","32","93.3%","https://s.click.aliexpress.com/e/_DkZt3uj",,,,,,
"4000761305265","https://ae04.alicdn.com/kf/S38f33e6a465f4a7cb78b47df669bcaf8I.jpg","http://cloud.video.taobao.com/play/u/2675628091/p/1/e/6/t/1/254533442328.mp4","Women's Walking Shoes Fashion Casual Sport Shoes Sneakers Autumn Platform Flat Slip-on Comfortable Outdoor","USD 16.74","USD 14.23","15%","USD","7","USD 1.00","51","95.3%","https://s.click.aliexpress.com/e/_DlfdlVd",,,,,,
"1005003785344112","https://ae04.alicdn.com/kf/S0f64586d1c944be18f8470d930e1c4e2P.jpg",,"Spring New 2022 Women's Sneakers Haze Blue Love Breathable Students Casual Sports Shoes Women Couple Borads Shoes","USD 8.69","USD 5.74","34%","USD","15.0","USD 0.86","68","97.3%","https://s.click.aliexpress.com/e/_Dl7XmEL",,,,,,
"1005004771451270","https://ae04.alicdn.com/kf/Se5f825b2d50d4262a5e1e37345b152da8.jpg","http://cloud.video.taobao.com/play/u/2675628091/p/1/e/6/t/1/1100089149006.mp4","Fashion Women Sneakers Air Cushion Soft Bottom Running Shoes  Outdoor Mesh Breathable Tennis Shoes","USD 11.44","USD 11.44","0%","USD","8.0","USD 0.92","157","96.0%","https://s.click.aliexpress.com/e/_Dmh3BG7",,,,,,
"1005003713508854","https://ae04.alicdn.com/kf/Hf64f1004d524411780e0d79679af3b7a0.jpg","http://cloud.video.taobao.com/play/u/2675628091/p/1/e/6/t/1/341542528212.mp4","2022 Winter Boots Women Multi-color Snow Boots Thickened Warm And Anti-skid Couple's Boots Plush Waterproof Casual Winter Shoes","USD 47.63","USD 28.58","40%","USD","7","USD 2.00","633","97.5%","https://s.click.aliexpress.com/e/_DCTKBEf",,,,,,
"1005003732028119","https://ae04.alicdn.com/kf/H77ba9ce6d17c4bc890ecec94153fd170Z.jpg","http://cloud.video.taobao.com/play/u/2675628091/p/1/e/6/t/1/343350851301.mp4","Loafer Cloth Shoes Women's Flat Loafers Women 2022 New Style Korean White Casual Canvas Zapatillas Mujer Espadrilles Mujer Lona","USD 20.50","USD 10.25","50%","USD","8.0","USD 0.82","97","97.6%","https://s.click.aliexpress.com/e/_DBo5KYB",,,,,,
"1005004757752307","https://ae04.alicdn.com/kf/S65306078ce734a07a5441f4ec04a2a61M.jpg","http://cloud.video.taobao.com/play/u/2675628091/p/1/e/6/t/1/1100087791004.mp4","FASHION SHOE Matching Shoes and Bag Set Women's Evening Wear Rhinestone Pump heels Gold Color Party Pointed Toe Ladies Sandals","USD 35.00","USD 29.75","15%","USD","10.0","USD 2.98","29","96.0%","https://s.click.aliexpress.com/e/_Dc6fPCb","XET7RX6WMGJB","2022/11/11 00:00:00","2023/01/11 23:59:59","USD 3.00","70219","USD 3.01"
"4000468119222","https://ae04.alicdn.com/kf/H40c00e533a5e498fb8e1b3358b1da43aP.jpg","http://cloud.video.taobao.com/play/u/2675628091/p/1/e/6/t/1/247719827267.mp4","Foot Massage Sandals Women's Home Summer Couple Home Indoor Bathroom Non-slip Soft Bottom Summer Home Slippers For Men","USD 18.34","USD 18.34","0%","USD","8.0","USD 1.47","70","93.3%","https://s.click.aliexpress.com/e/_DBNitX1",,,,,,
"1005004745825319","https://ae04.alicdn.com/kf/S82dd7ae09bcd4824948d37597d678584q.png",,"Winter Women's Boots Thick Plush Waterproof Women Snow Boots Non-slip Mid-Calf Outdoor Boots Fashion Warm Fur Woman Winter Shoes","USD 29.58","USD 17.75","40%","USD","7","USD 1.24","28","100.0%","https://s.click.aliexpress.com/e/_DeIB2OT",,,,,,
"1005004866606376","https://ae04.alicdn.com/kf/Sf927d19f4b144bdfa2b1d2bb15cb76f3X.jpg","http://cloud.video.taobao.com/play/u/2675628091/p/1/e/6/t/1/1100094481811.mp4","Mo Dou Cotton Slippers Women's Winter Indoor Home Warm Couple Thick Sole Cute Slippers Winter Men's Comfortable Non Slip Slipper","USD 18.56","USD 12.99","30%","USD","7","USD 0.91","58","100.0%","https://s.click.aliexpress.com/e/_DBxhkEj",,,,,,
"1005001369930205","https://ae04.alicdn.com/kf/H908ab3fdb33a43f4964df248763b5b43y.jpg",,"Women's High Boots Pleated Mid Calf High Heel Shoes 2020 Thin Heels Suede Boots Women Pointed Toe Sexy Pumps Party Female Winter","USD 31.75","USD 19.05","40%","USD","7","USD 1.33","74","100.0%","https://s.click.aliexpress.com/e/_DdHn3DV",,,,,,
"1005004378846209","https://ae04.alicdn.com/kf/S37c5e76d55d1462ab29e73f725f4c0c8L.jpg","http://cloud.video.taobao.com/play/u/2675628091/p/1/e/6/t/1/1100045489565.mp4","Fashion Rain Boots Women's Galoshes Ladies Shoes Walking Non-slip Waterproof Ankle Rainboots Female Home Garden Work Short Boots","USD 12.27","USD 4.91","60%","USD","8.0","USD 0.39","96","91.8%","https://s.click.aliexpress.com/e/_DlRHh9d",,,,,,
"32889816210","https://ae04.alicdn.com/kf/S46b7fc99c325497180baab573b4c5771Q.jpg",,"New 2022 Winter High Heel Boots Warm Plush Square Heels Winter Shoes Women's Boots Ladies Fashion Brand Ankle Snow Boots A056","USD 32.38","USD 19.43","40%","USD","7","USD 1.36","25","100.0%","https://s.click.aliexpress.com/e/_DdtmkGn",,,,,,
"1005003775747196","https://ae04.alicdn.com/kf/Scacc0f4f189c4885addc057ae6fdc390A.jpg","http://cloud.video.taobao.com/play/u/2675628091/p/1/e/6/t/1/344013925758.mp4","Platform Chain High Heels Slippers Women's Wedding Shoes Summer 2022 New Casual White Black Wedges Slides Ladies Beach Slippers","USD 6.30","USD 5.67","10%","USD","16.0","USD 0.91","104","98.0%","https://s.click.aliexpress.com/e/_DlRhVUb",,,,,,
"4000155639621","https://ae04.alicdn.com/kf/H342a296966dd4c458cfec5a1daaa54310.jpg",,"Glglgege New Women's Shallow Warm Shoes Thick Plush Warm Indoor Shoes Non - slip Soft Bottom Indoor Cute Bow Home Floor Shoes","USD 5.99","USD 3.65","39%","USD","8.0","USD 0.29","50","97.1%","https://s.click.aliexpress.com/e/_DEDCz15",,,,,,
"1005004696913984","https://ae04.alicdn.com/kf/S7faddc3131cc49e8acfc8a7705d442ecv.jpg","http://cloud.video.taobao.com/play/u/2675628091/p/1/e/6/t/1/1100101128212.mp4","2022 Women's winter boots Snow Boots Women Ski Boots Fluffy Hairy Space Deer Waterproof With Fur Casual Ladies winter Shoes","USD 38.98","USD 22.61","42%","USD","7","USD 1.58","44","90.0%","https://s.click.aliexpress.com/e/_DDfvhTp",,,,,,
"1005003619446410","https://ae04.alicdn.com/kf/Scd2a846f740a4838ad0e812fdf458f1af.jpg","http://cloud.video.taobao.com/play/u/2675628091/p/1/e/6/t/1/338271228278.mp4","2022 Summer New Women's Boots Fashion Square Toe Hollow Mesh Zipper Stiletto Ankle Boots Sandals Nightclub Banquet Shoes","USD 33.00","USD 24.75","25%","USD","8.0","USD 1.98","281","93.3%","https://s.click.aliexpress.com/e/_DF3WhSJ",,,,,,
"1005004688922189","https://ae04.alicdn.com/kf/S7a3fa2a5680e4116acb13be99fed3865G.jpg","http://cloud.video.taobao.com/play/u/2675628091/p/1/e/6/t/1/1100084167118.mp4","Women's Canvas Sneakers Pattern Casual Shoes 2022 Woman Flat Sneakers Lace Sports Trend Elegant Platform Fashion Tennis Ladies","USD 12.88","USD 3.86","70%","USD","7","USD 0.27","25","90.0%","https://s.click.aliexpress.com/e/_Dmuc8tv",,,,,,
"1005004441002684","https://ae04.alicdn.com/kf/Sb035467dd7f44f70a9e8923c3f76ff3ft.jpg",,"Sandals Woman Summer 2022 New Fashion Outdoor Beach Casual Breathable Platform Shoes Women's High Heels Plus Size 43 Women Shoe","USD 15.90","USD 7.95","50%","USD","7","USD 0.56","42","82.5%","https://s.click.aliexpress.com/e/_DkPF9ux",,,,,,
"33000952961","https://ae04.alicdn.com/kf/HTB1ZxplQW6qK1RjSZFmq6x0PFXaE.jpg","http://cloud.video.taobao.com/play/u/2675628091/p/1/e/6/t/1/291073933136.mp4","Women's shoes Roman fashion rivet sandals 10CM PUMPS Sexy nightclub stiletto heels patent-leather metallic rivet hollow","USD 30.00","USD 18.00","40%","USD","7","USD 1.26","156","94.1%","https://s.click.aliexpress.com/e/_DE1m9sj",,,,,,
"1005004710377806","https://ae04.alicdn.com/kf/Se46ba2685a164266a877dd9b69c0ff23N.jpg","http://cloud.video.taobao.com/play/u/2675628091/p/1/e/6/t/1/1100085551284.mp4","Breathable Platform Shoes Luxury Shoes for Women Chains Designer Women's Shoes Light Leisure Walk Shoes Fashion Women's Sneakers","USD 36.10","USD 20.58","43%","USD","7","USD 1.44","68","90.9%","https://s.click.aliexpress.com/e/_DeEV4ij",,,,,,
"1005004149780570","https://ae04.alicdn.com/kf/S3136866b9ad64d418c7f66dcc851abfcb.jpg","http://cloud.video.taobao.com/play/u/2675628091/p/1/e/6/t/1/1100010540579.mp4","Large Size Women's Pointed High Heels Mixed Color Casual Breathable Knitted Shoes Fashionable Square Heel Shoes Zapatos De Mujer","USD 28.56","USD 14.57","49%","USD","8.0","USD 1.17","41","93.8%","https://s.click.aliexpress.com/e/_DdQU5ob",,,,,,
"1005004854654303","https://ae04.alicdn.com/kf/S506a4c04993f4a7e880c0cfc6172be2bJ.jpg",,"2022 New Winter Warm Couples Home Indoor Waterproof Women's Cotton Slippers Plush Bread Men's Slip-on Yellow Shoes Snow Boots","USD 33.81","USD 33.81","0%","USD","8.0","USD 2.70","67","96.5%","https://s.click.aliexpress.com/e/_DBeomw3",,,,,,
"4001277537302","https://ae04.alicdn.com/kf/Hf6b8526a849947e78eabf95b810a3da3y.jpg",,"Women Flats Ballet Shoes Women Flats Office Work Shoes Oversize Boat Shoes Cloth Sweet Loafers Women's Pregnant Flats Shoes","USD 16.43","USD 11.17","32%","USD","8.0","USD 0.89","195","95.4%","https://s.click.aliexpress.com/e/_DeAZAMR",,,,,,
"1005003800659852","https://ae04.alicdn.com/kf/S183d4085ce06448eb00f978b12ce433cL.jpg","http://cloud.video.taobao.com/play/u/2675628091/p/1/e/6/t/1/344424804194.mp4","Women's Boots Women's High-heeled Sandals Women's Chunky Heel Short Boots Women's Shoes Summer New Black Shoes Women's Shoes","USD 19.75","USD 13.82","30%","USD","7","USD 0.97","193","92.4%","https://s.click.aliexpress.com/e/_DlrBHRZ",,,,,,
"1005002693616660","https://ae04.alicdn.com/kf/S88d7d72676044c8482b80f7dde0905e6u.jpg","http://cloud.video.taobao.com/play/u/2675628091/p/1/e/6/t/1/318676322208.mp4","Comemore Comfortable Women's Casual Flat White Lace-up Shoes Summer Vulcanized Sneakers Ladies Light Soft Shallow Mouth Loafers","USD 11.00","USD 7.70","30%","USD","7","USD 0.54","139","90.0%","https://s.click.aliexpress.com/e/_DlioKLV",,,,,,
"1005004743521574","https://ae04.alicdn.com/kf/Sa85e6c35c3244feea62b2e00cb56af967.jpg",,"Flat Heels Women's Shoes 2022 Winter Furry Female Ankle Boots Warm Cute Plush Platform Woman Snow Boot Waterproof Footwear","USD 17.04","USD 12.10","29%","USD","7","USD 0.85","356","100.0%","https://s.click.aliexpress.com/e/_DFMxjZ5",,,,,,
"4000107974706","https://ae04.alicdn.com/kf/H4268649fbe014612ad091c3a2dc9b1ff4.jpg",,"Summer soft water shoes men's shoes beach slippers upstream river Aqua women's shoes retro sandals swimming diving socks Tenis","USD 10.96","USD 5.59","49%","USD","8.0","USD 0.45","28","94.0%","https://s.click.aliexpress.com/e/_Dm611pN",,,,,,
"1005004360794354","https://ae04.alicdn.com/kf/S3a2cf32db82248a897ca1088d5742e0dm.jpg",,"Aphixta New Dark Green Pearl Buckle Patent Leather Women's Pumps 7cm Square Heel Officile Pointed Toe Shoes Super Big Size 49 50","USD 25.53","USD 13.53","47%","USD","9.0","USD 1.22","150","85.2%","https://s.click.aliexpress.com/e/_Dep29mR",,,,,,
"4000344961563","https://ae04.alicdn.com/kf/H266927c0bc674b29814c834b150f3b48G.jpg",,"20Colors spring and summer wear women's flat shoes large comfortable shoes female candy color shoes Loafers EU 41/42/43 WSH2214","USD 9.07","USD 5.90","35%","USD","7","USD 0.41","65","94.4%","https://s.click.aliexpress.com/e/_Dm9z08B",,,,,,
"1005004070400650","https://ae04.alicdn.com/kf/S37f22b0668444e69943c920a247fd73fz.jpg","http://cloud.video.taobao.com/play/u/2675628091/p/1/e/6/t/1/1100092760181.mp4","Women's shoes 2022 new trend matching slippers designer beach EVA comfortable Clogs Street Style soft man ladies sandals shoes","USD 14.44","USD 13.72","5%","USD","12.0","USD 1.65","108","96.7%","https://s.click.aliexpress.com/e/_DCMY0V1",,,,,,
"1005002454909433","https://ae04.alicdn.com/kf/Se8787eb3c2a549f8888f1572591a86eev.jpg",,"Soft Leather Women's Shoes,Pointed Toe,2022 Spring New High Heels,Ankle Strap,Cover Heel,Female Footware,Big Size,BLACK,,BEIGE","USD 11.97","USD 8.38","30%","USD","7","USD 0.59","135","93.8%","https://s.click.aliexpress.com/e/_DDS4Kph",,,,,,
"1005001621839744","https://ae04.alicdn.com/kf/H0c1bd47a8ca04cbe94afdb5c86abec10y.jpg","http://cloud.video.taobao.com/play/u/2675628091/p/1/e/6/t/1/283872259622.mp4","Women's Genuine Leather Ankle Boots Women Autumn Winter Lace Up Vintage Women Punk Boots Flat Ladies Shoes Woman Botas Mujer","USD 118.66","USD 59.33","50%","USD","7","USD 4.15","26","98.6%","https://s.click.aliexpress.com/e/_DdF6R7h",,,,,,
"1005004505866303","https://ae04.alicdn.com/kf/S5a07cfd471f2410986ec8e684de539fbs.jpg","http://cloud.video.taobao.com/play/u/2675628091/p/1/e/6/t/1/1100062916518.mp4","Women's Shoes Fashion Sexy Medium Boots Elastic Cloth Pointed Stiletto High Heels Candy Large Women's Short Boots Large 35-43","USD 41.98","USD 25.19","40%","USD","7","USD 1.76","32","92.7%","https://s.click.aliexpress.com/e/_DBrajc3",,,,,,
"1005004441464219","https://ae04.alicdn.com/kf/S7f9fb1a473f74d97af3d8f4b58f1ef9fj.jpg",,"European and American Tulle Boots Women's Tassel Pointed High-heeled Cheongsam Shoes Rhinoceros Hollow Dinner Party Cool","USD 31.05","USD 15.83","49%","USD","7","USD 1.11","25","100.0%","https://s.click.aliexpress.com/e/_DDR7LPh",,,,,,
"1005004513155745","https://ae04.alicdn.com/kf/Sdc29c4d23c4b4c30b9b3521340564262W.jpg",,"Rimocy Fashion Crystal Cross-tied Women's Shoes Pumps Pointed Toe Med Heels Wedding Shoes Woman Elegant Thin Heels Party Shoes","USD 30.36","USD 16.70","45%","USD","7","USD 1.17","50","98.9%","https://s.click.aliexpress.com/e/_DCM88AT",,,,,,
"1005003027418835","https://ae04.alicdn.com/kf/Sca3900ffaebe4ccd8a8f455e3e695447Z.jpg",,"Women's Vulcanized Shoes Lace-up Platform Casual Shoes Breathable Hard-wearing Sneakers Lightweight Low Top Letter Walking Shoes","USD 11.50","USD 9.77","15%","USD","8.0","USD 0.78","22","100.0%","https://s.click.aliexpress.com/e/_DFBr5kb",,,,,,
"1005001994003320","https://ae04.alicdn.com/kf/H4191711ee7394d5fbd8a47cd3ba740ebQ.jpg",,"Big Size Summer Outdoor Women Sneakers Men Sport Shoes for Women Shoes Running Women's Sports Shoes White Blue Toning Walk A-634","USD 25.38","USD 17.77","30%","USD","7","USD 1.24","23","100.0%","https://s.click.aliexpress.com/e/_DEYc0Bd",,,,,,
"1005004584413538","https://ae04.alicdn.com/kf/Se9b64b55c73b4b968e92276894a33eb5h.jpg","http://cloud.video.taobao.com/play/u/2675628091/p/1/e/6/t/1/1100073706321.mp4","Venus Chan Nigerian Green Color Women's Party High Heel Shoes Full Diamond Design Fashion Summer Sandals Wedding Ladies Shoes","USD 34.50","USD 29.67","14%","USD","8.0","USD 2.37","40","100.0%","https://s.click.aliexpress.com/e/_DEKV1BZ","XET7RX6WMGJB","2022/11/11 00:00:00","2023/01/11 23:59:59","USD 3.00","70219","USD 3.01"
"1005002681950968","https://ae04.alicdn.com/kf/H051ba541ed044bbd829d8d5b02f7a5f9Y.jpg",,"Spring Autumn Women's fashion trend Pumps shoes woman wedge single casual shoes high heels shoes British thick-soled platform","USD 65.00","USD 32.50","50%","USD","7","USD 2.28","70","95.6%","https://s.click.aliexpress.com/e/_DluRQQj",,,,,,
"1005003973266292","https://ae04.alicdn.com/kf/S54d655c7aa0347ebbf7298a60039e07fs.jpg",,"Rimocy Women's Pumps 2022 Spring Autumn Fashion Mix Color High Heels Pumps Women Sexy Pointed Toe Stiletto Heeled Party Shoes","USD 26.13","USD 14.89","43%","USD","7","USD 1.04","67","93.8%","https://s.click.aliexpress.com/e/_Dd2sKBz",,,,,,
"1005004670651356","https://ae04.alicdn.com/kf/S0a409aa2bd6e400983ad92a1ebfd30c4z.jpg",,"Original A BATHING APE Women's Vibe BapeGoose Sports Top Quality Sneakers Men Air Durable Bapesta Low Force Walking Skate Shoes","USD 154.00","USD 77.00","50%","USD","7","USD 5.39","61","92.0%","https://s.click.aliexpress.com/e/_Desc3in",,,,,,
"1005003507045809","https://ae04.alicdn.com/kf/H1157aec4a7fe4f9f98a273902505d53bA.jpg",,"Summer Women's Single Shoes Platform Lightweight Suede Ladies Loafers Flat Platform Slip On Hiking Shallow Mouth Casual Shoes","USD 21.00","USD 13.65","35%","USD","7","USD 0.96","40","96.9%","https://s.click.aliexpress.com/e/_DBNAlOP",,,,,,
"1005003112971187","https://ae04.alicdn.com/kf/H4f6e131d345a453e81f294171d15a6d0W.jpg",,"Women's Summer Sandals For Beach Sports Women Men's Slip-on Shoes Slippers Female Male Crocks Mules","USD 9.40","USD 4.79","49%","USD","7","USD 0.34","56","100.0%","https://s.click.aliexpress.com/e/_DdczXpV",,,,,,
"1005004765189308","https://ae04.alicdn.com/kf/S52fc16341d564b65a4f41db825002697g.jpg",,"Winter Women Shoes Flat Casual Plush Keep Warm Shoes Fashion Home and Outing Women's Vulcanize Shoes","USD 23.00","USD 9.89","57%","USD","8.0","USD 0.79","64","90.0%","https://s.click.aliexpress.com/e/_DeEZ0xH",,,,,,
"1005004152651449","https://ae04.alicdn.com/kf/S64a597affdcd41ea86b1ff10755767e3d.jpg","http://cloud.video.taobao.com/play/u/2675628091/p/1/e/6/t/1/1100069248060.mp4","Summer Women's Sandals Beach Shoes Slippers For Ladies Bohemia Gladiator Solid Fashion Outdoor Flat Sandals","USD 15.98","USD 15.98","0%","USD","7","USD 1.12","721","93.5%","https://s.click.aliexpress.com/e/_DdCLW8n",,,,,,
"1005005081903577","https://ae04.alicdn.com/kf/Sbf761f660e954a63aff590dcb286a674o.jpg","http://cloud.video.taobao.com/play/u/2675628091/p/1/e/6/t/1/1100113131139.mp4","HOKA Men Sneakers Bondi 8 Lightweight Cushioning Outdoor Running Shoes Marathon Trail Running Shoes Elastic Women's Casual Shoes","USD 105.57","USD 48.56","54%","USD","7","USD 3.40","69","null%","https://s.click.aliexpress.com/e/_DDL7lQX",,,,,,
"1005004716952601","https://ae04.alicdn.com/kf/S121f145f514c4d8cb66592a2f0c06731Y.jpg",,"TMA EYES Genuine Leather Women's Flat Sneaker Shoes For Outdoor","USD 39.99","USD 39.99","0%","USD","7","USD 2.80","27","96.0%","https://s.click.aliexpress.com/e/_DdgLsi3",,,,,,
