"ProductId","Image Url","Video Url","Product Desc","Origin Price","Discount Price","Discount","Currency","Commission Rate","Commission","Sales180Day","Positive Feedback","Promotion Url","Code Name","Code Start Time","Code End Time","Code Value","Code Quantity","Code Minimum Spend"
"1005003078597942","https://ae04.alicdn.com/kf/H904d1cd1d9c9479bb20e4998cf7feb46b.jpg",,"2022 Winter Long Brand Women's Boots Knee High Luxury Chelsea Chunky Platform Shoes Ytmtloy Zipper Round Toe Botines De Mujer","USD 11.41","USD 7.99","30%","USD","7","USD 0.56","56","86.7%","https://s.click.aliexpress.com/e/_DcgnqvZ",,,,,,
"1005004682612368","https://ae04.alicdn.com/kf/S46cece151db84a85a246b3de54a92ea57.jpg","http://cloud.video.taobao.com/play/u/2675628091/p/1/e/6/t/1/1100085381162.mp4","Women's Thicken Plush Waterproof Snow Boots Platform Warm Fur Ankle Boots Woman Winter 2022 Casual Non Slip Cotton Padded Shoes","USD 38.04","USD 20.92","45%","USD","7","USD 1.46","220","95.8%","https://s.click.aliexpress.com/e/_DmRhaRV",,,,,,
"1005004713309477","https://ae04.alicdn.com/kf/Sa2ee45309328473daa1748e381652941A.jpg",,"Autumn Winter Breathable Knitting Sock Boots Women Thigh High Boot Knee High Boots Stretch High Heel Boots 2022 Plus Size Boots","USD 28.88","USD 14.44","50%","USD","10.0","USD 1.44","44","91.4%","https://s.click.aliexpress.com/e/_DexVE2F",,,,,,
"1005004715515740","https://ae04.alicdn.com/kf/Sd2d6f2d7ef914e1380cebf22386b8bcaV.jpg",,"2022 New Snow Women's Boots Keep Warm Fur Ankle Boots Comfortable Winter Women Shoes Outdoor Botas Plus Size 35-45","USD 19.96","USD 9.98","50%","USD","8.0","USD 0.80","46","97.1%","https://s.click.aliexpress.com/e/_DCNhHdd",,,,,,
"1005004680020735","https://ae04.alicdn.com/kf/S4829abd729f146249c79b0bde026ea67K.jpg","http://cloud.video.taobao.com/play/u/2675628091/p/1/e/6/t/1/1100083589010.mp4","Large Size Winter 2022 New Printed Cat Head Fashion European American Warm Snow Boots Women's Platform  Ankle Boots for Women","USD 49.67","USD 24.84","50%","USD","7","USD 1.74","41","81.5%","https://s.click.aliexpress.com/e/_DkJWMPV",,,,,,
"1005004678463892","https://ae04.alicdn.com/kf/Sc7c0afe4021c45969d30d0de6a90ca783.jpg",,"Snow Boots Women's Non-slip Flat-bottom Flock Winter Plus Velvet Thickening Warmth Shoes Inner-increasing Cotton Shoes Women","USD 11.10","USD 7.21","35%","USD","7","USD 0.50","34","88.6%","https://s.click.aliexpress.com/e/_DncynIB",,,,,,
"1005004706334276","https://ae04.alicdn.com/kf/Sce338b52186942c0bf6ad4f1a7f9e31cG.jpg",,"Large Size Women's Boots 2022 Autumn and Winter New Warm Cotton Boots Round Head Rhinestone Fashion Boots Fashion Short Boots","USD 21.98","USD 9.89","55%","USD","7","USD 0.69","23","100.0%","https://s.click.aliexpress.com/e/_DdqYf2R",,,,,,
"4000149480086","https://ae04.alicdn.com/kf/H23df2804d63440be870a394a7a299493f.jpg","http://cloud.video.taobao.com/play/u/2675628091/p/1/e/6/t/1/241946775497.mp4","Best Genuine Sheepskin Leather Woman Snow Boots 100% Natural Fur Snow Boots Warm Wool Women's Winter Boots","USD 64.14","USD 44.90","30%","USD","7","USD 3.14","108","98.8%","https://s.click.aliexpress.com/e/_DEZDYLV",,,,,,
"1005003252017812","https://ae04.alicdn.com/kf/Hec6ed838d5fb44aeaa4636a6f1aa6c6fD.jpg","http://cloud.video.taobao.com/play/u/2675628091/p/1/e/6/t/1/325575125083.mp4","2022 Warm Plush Cotton Shoes Size 43 Snow Boots Women's High Tube Waterproof Women's Boots Non-slip Winter Boots Botas De Mujer","USD 16.99","USD 9.17","46%","USD","7","USD 0.64","23","86.0%","https://s.click.aliexpress.com/e/_DmvDGAL",,,,,,
"1005004743873602","https://ae04.alicdn.com/kf/S8a5031b589ac4bcca38c06e405b6d6c5R.jpg","http://cloud.video.taobao.com/play/u/2675628091/p/1/e/6/t/1/1100087723313.mp4","Women's Shoes Female Booties Winter 2022 Flat Heeled Keep Warm Plush Cotton Ladies Footwear Outdoor Non-slip Soft Snow Boots","USD 20.50","USD 14.56","29%","USD","8.0","USD 1.16","102","94.7%","https://s.click.aliexpress.com/e/_DktyY7N",,,,,,
"1005004912028996","https://ae04.alicdn.com/kf/S26a8c210cfe2491280c498c1869127f5l.jpg","http://cloud.video.taobao.com/play/u/2675628091/p/1/e/6/t/1/1100096965452.mp4","7.5cm Elevator Shoes Genuine Leather Women Ankle Booties Platform Wedge Hidden Heels Warm Women Autumn Spring Casual Boots Shoes","USD 70.98","USD 35.49","50%","USD","8.0","USD 2.84","29","100.0%","https://s.click.aliexpress.com/e/_DeM4Yzp",,,,,,
"1005004472727132","https://ae04.alicdn.com/kf/Se453d5437a304ca2bd697fe17b259b51m.jpg",,"New Autumn Women's Ankle Boots Female Sexy Pu High Heels Platform Shoes Solid Thick Bottom Ladies Zipper Fashion Short Boot 2022","USD 72.50","USD 31.17","57%","USD","7","USD 2.18","107","94.0%","https://s.click.aliexpress.com/e/_DB1QSZ1",,,,,,
"1005002353360001","https://ae04.alicdn.com/kf/Sad1703c8dbbd424e8b693093a3099e03z.jpg","http://cloud.video.taobao.com/play/u/2675628091/p/1/e/6/t/1/346987931581.mp4","2022 Women's Snow Boots Genuine Leather Autumn Winter Flat Heel Daily Shoes Ankle Boots Plus Fur Platform Ladies British Girls","USD 64.10","USD 36.53","43%","USD","7","USD 2.56","951","96.9%","https://s.click.aliexpress.com/e/_De20nHV",,,,,,
"1005004705803064","https://ae04.alicdn.com/kf/Scb89824a6cb54dfd9ede9f7701986a1dJ.jpg","http://cloud.video.taobao.com/play/u/2675628091/p/1/e/6/t/1/1100085282080.mp4","Woman Booties Winter 2022 Female Cotton Shoes Platform Concise Design Non-slip Outside Warm Fluffy Women's Ankle Boots Pink Boot","USD 17.18","USD 12.20","29%","USD","8.0","USD 0.98","118","100.0%","https://s.click.aliexpress.com/e/_DEfHaHh",,,,,,
"1005001696028367","https://ae04.alicdn.com/kf/Hf56de9c35b9a424a9f24ff7b68dd2840k.jpg","http://cloud.video.taobao.com/play/u/2675628091/p/1/e/6/t/1/285874138078.mp4","Winter Women's Fluffy Faux Fox Fur Snow Boots Ladies Plush Boots Female Warm Luxury Footwear Girl's Furry Cotton Shoes 2020","USD 16.99","USD 11.38","33%","USD","8.0","USD 0.91","120","94.4%","https://s.click.aliexpress.com/e/_Ddy6HFD",,,,,,
"1005004754336123","https://ae04.alicdn.com/kf/Scb0cb79c96814df897e5caf818c8ea35J.jpg","http://cloud.video.taobao.com/play/u/2675628091/p/1/e/6/t/1/1100088233340.mp4","Rimocy 2022 New Warm Snow Boots for Women Waterproof Women's Winter Boots Thick Bottom Plush Lining Cotton Padded Shoes Woman","USD 28.03","USD 15.42","45%","USD","7","USD 1.08","50","100.0%","https://s.click.aliexpress.com/e/_DlwF5Or",,,,,,
"1005004634802779","https://ae04.alicdn.com/kf/S77878b03c327495992c6dacf45dc46b9j.jpg",,"Women's boots autumn winter high Combat boots women Platform women Lace Up Woman Shoes Winter Biker Ankle Women's military Boots","USD 13.00","USD 6.63","49%","USD","7","USD 0.46","40","95.0%","https://s.click.aliexpress.com/e/_DFH0wSb",,,,,,
"1005004701697956","https://ae04.alicdn.com/kf/S7ff1c160764043fabb455bfa1c0d9192f.jpg",,"Winter Boots for women Warm Botas Mujer leather Fur Snow boots women Top High quality Australia Boots Large size snow boots","USD 15.88","USD 7.94","50%","USD","10.0","USD 0.79","43","86.0%","https://s.click.aliexpress.com/e/_DnF9GL5",,,,,,
"32952874992","https://ae04.alicdn.com/kf/HTB1CMkXaInrK1RkHFrdq6xCoFXax.jpg","http://cloud.video.taobao.com/play/u/2675628091/p/1/e/6/t/1/218628087291.mp4","NIUFUNI Over The Knee Women's Boots Autumn And Winter Boots Knit Socks Boots Pointed Flat Shoes Stretch High Boots Size 34-40","USD 45.53","USD 30.51","33%","USD","8.0","USD 2.44","77","94.3%","https://s.click.aliexpress.com/e/_DEZlGUX",,,,,,
"1005004735881879","https://ae04.alicdn.com/kf/S9559b3579f7e4d718bfccc4204df96fdp.jpg",,"Luxury Brand 2023 New Women Thick-soled Thick-heeled Warm Boots Women's Towel Cotton Boots Motorcycle Boots 36-43 Boots Women","USD 11.62","USD 7.32","37%","USD","9.0","USD 0.66","1954","90.9%","https://s.click.aliexpress.com/e/_DeTenSP",,,,,,
"1005003909026027","https://ae04.alicdn.com/kf/S845e9f31986e4293865a781366744aa5i.jpg","http://cloud.video.taobao.com/play/u/2675628091/p/1/e/6/t/1/1100092085615.mp4","AIYUQI  Marton Boots Women Genuine Leather 2023 Autumn Winter New Women Boots Thick-soled Student Casual women's boots","USD 67.80","USD 42.04","38%","USD","8.0","USD 3.36","103","96.0%","https://s.click.aliexpress.com/e/_DnCSXUj",,,,,,
"1005004421426844","https://ae04.alicdn.com/kf/S27e1212aeecb4968844eb1c4dc663df2F.jpg",,"Retro Ankle Boots Square Heel Round Head Zipper Large Size Spring Autumn Women's Roman Fashion  Boots Botas De Mujer","USD 34.65","USD 17.33","50%","USD","7","USD 1.21","37","94.3%","https://s.click.aliexpress.com/e/_DmRHnEX",,,,,,
"1005004806270097","https://ae04.alicdn.com/kf/Sbd04b2a1e7db49869e6cbfdaff2200c4b.jpg","http://cloud.video.taobao.com/play/u/2675628091/p/1/e/6/t/1/1100091053023.mp4","Genuine Leather Woven Ankle Boots Women's Winter Fur Shoes Big Size 42 Designer Plait Chelsea Boots Woman Winter Plush Booties","USD 31.77","USD 15.25","52%","USD","8.0","USD 1.22","23","96.5%","https://s.click.aliexpress.com/e/_DczgScB",,,,,,
"1005004703716215","https://ae04.alicdn.com/kf/S09ca117fabb74d27803315f98195dd5ao.jpg",,"High-top Women's Cotton Shoes 2022 Winter Warm Furry Female Ankle Boots Simple Couple Outdoor Solid Color Platform Snow Boot","USD 24.55","USD 17.43","29%","USD","7","USD 1.22","132","97.5%","https://s.click.aliexpress.com/e/_DePva7z",,,,,,
"1005003443465234","https://ae04.alicdn.com/kf/S1836dbf9875248dfa13b461469bf4006g.jpg",,"Autumn and Winter New Women's Ankle Boots PU Thick-soled Fashion Women's Boots Patent Leather Zipper Casual Women's Short Boots","USD 16.93","USD 11.85","30%","USD","9.5","USD 1.13","24","85.7%","https://s.click.aliexpress.com/e/_DBOJ1yb",,,,,,
"1005004845456929","https://ae04.alicdn.com/kf/Scf1a2f34fab44e9091ae2b9b91755e58h.jpg",,"Baasploa Women's Boots Non-Slip Comfortable Winter Shoes Waterproof Fashion Outdoor Sneakers Keep Warm Female Hiking Shoes","USD 60.66","USD 35.79","41%","USD","7","USD 2.51","53","100.0%","https://s.click.aliexpress.com/e/_Dd3VwAT",,,,,,
"1005003713508854","https://ae04.alicdn.com/kf/Hf64f1004d524411780e0d79679af3b7a0.jpg","http://cloud.video.taobao.com/play/u/2675628091/p/1/e/6/t/1/341542528212.mp4","2022 Winter Boots Women Multi-color Snow Boots Thickened Warm And Anti-skid Couple's Boots Plush Waterproof Casual Winter Shoes","USD 47.63","USD 28.58","40%","USD","7","USD 2.00","633","97.5%","https://s.click.aliexpress.com/e/_DBOxABd",,,,,,
"1005004705678555","https://ae04.alicdn.com/kf/Seeb03d36b8d34af39d5cbeb5dcf5ba6bC.jpg",,"Women's Cotton Shoes 2022 Winter Trendy Furry Ankle Boots Non-slip Warm Plush Thick Bottom Platform Chunky Fur Female Snow Boot","USD 20.65","USD 14.66","29%","USD","7","USD 1.03","175","99.0%","https://s.click.aliexpress.com/e/_DCoineJ",,,,,,
"1005004611876352","https://ae04.alicdn.com/kf/S78b93e1b868d462080265aed9990b32bk.jpg","http://cloud.video.taobao.com/play/u/2675628091/p/1/e/6/t/1/341542528212.mp4","2023 Winter Boots Women Multi-color Snow Boots Thickened Warm And Anti-skid Couple's Boots Plush Waterproof Casual Winter Shoes","USD 45.61","USD 27.37","40%","USD","7","USD 1.92","68","98.3%","https://s.click.aliexpress.com/e/_DEfvmQj",,,,,,
"1005004809116353","https://ae04.alicdn.com/kf/S167ddd38221c4e008439b9fd4e890787c.jpg",,"Women's Over Knee High Boots Winter 2022 New Thigh Socks Boots Knit Heels Warm Sexy Stilettos Autumn Square Toe Over Knee Boots","USD 32.57","USD 14.98","54%","USD","8.0","USD 1.20","18","100.0%","https://s.click.aliexpress.com/e/_DEfzLDH",,,,,,
"1005003355727777","https://ae04.alicdn.com/kf/Sfd893ec17510412283d54fb13fd27317T.jpg",,"Brand Design Plus Size 43 Black Gothic Cool Punk Motorcycle Boots Women's Platform Boots Wedge High Heels Calf Boots Women Boots","USD 26.47","USD 18.53","30%","USD","9.5","USD 1.76","35","80.0%","https://s.click.aliexpress.com/e/_DC7oGcP",,,,,,
"1005004503085634","https://ae04.alicdn.com/kf/Sa5fd40af873a4ed7acbc1efb295ce515e.jpg","http://cloud.video.taobao.com/play/u/2675628091/p/1/e/6/t/1/1100063313632.mp4","AIYUQI Women's Chelsea Boots Genuine Leather Fashion Fur Winter Boots Women Front Zipper British Style Women's Short Boots","USD 84.19","USD 42.93","49%","USD","8.0","USD 3.43","591","95.8%","https://s.click.aliexpress.com/e/_DcilbDV",,,,,,
"1005002341890480","https://ae04.alicdn.com/kf/H7cc67d3ad0b047ec91a5bcb032286cabg.jpg","http://cloud.video.taobao.com/play/u/2675628091/p/1/e/6/t/1/302790178436.mp4","Spring 2021 New cotton socks tube hundreds of high heel boots 16cm hate sky high heel thin over knee-length women's boots","USD 30.00","USD 30.00","0%","USD","11.0","USD 3.30","24","90.0%","https://s.click.aliexpress.com/e/_DmDY4Nh",,,,,,
"1005001835128475","https://ae04.alicdn.com/kf/Hbbfb9c4194354ec68ee604542e38dfc4G.jpg","http://cloud.video.taobao.com/play/u/2675628091/p/1/e/6/t/1/341959507607.mp4","New 2022 women winter boots thicken fur snow boots women's leather shoes soft high top winter shoes ladies non-slip boots","USD 49.65","USD 36.24","27%","USD","7","USD 2.54","49","95.7%","https://s.click.aliexpress.com/e/_Dd0Q9Ux",,,,,,
"1005004553371098","https://ae04.alicdn.com/kf/Sc836f296593640fc95a4ed9f8155686fs.jpg","http://cloud.video.taobao.com/play/u/2675628091/p/1/e/6/t/1/1100069321534.mp4","MORAZORA Genuine Leather Boots Women Dubble Zip Ankle Boots Lace Up Autumn Winter Brown Black Women's Boots Size 35-41","USD 76.60","USD 40.60","47%","USD","7","USD 2.84","66","100.0%","https://s.click.aliexpress.com/e/_DmawwbV",,,,,,
"4000262845995","https://ae04.alicdn.com/kf/H84bc7f2b5d1843bfa4255cfc2e7271c4O.jpg","http://cloud.video.taobao.com/play/u/2675628091/p/1/e/6/t/1/285708001942.mp4","JIANBUDAN/ Genuine Leather Plush women's short Boots Retro Casual Autumn Winter Women's Boots Waterproof leather warm Snow boots","USD 51.99","USD 25.48","51%","USD","7","USD 1.78","405","97.0%","https://s.click.aliexpress.com/e/_DCdmAkr",,,,,,
"1005004501305011","https://ae04.alicdn.com/kf/Sa37944cb00804437b177580824ea915au.jpg","http://cloud.video.taobao.com/play/u/2675628091/p/1/e/6/t/1/1100062270536.mp4","HOPUS Women's Boots High Quality Retro British Style Leather Shoes For Women 2022 New Short Boots Square Heel Platform Shoes","USD 83.58","USD 41.79","50%","USD","8.0","USD 3.34","641","98.4%","https://s.click.aliexpress.com/e/_DnC6RIJ",,,,,,
"1005004871317737","https://ae04.alicdn.com/kf/S8c8f8666847649e6a8d207ab19e6f49ex.jpg","http://cloud.video.taobao.com/play/u/2675628091/p/1/e/6/t/1/1100094744341.mp4","Women winter boots 2022 women's snow boots female winter shoes woman thick warm waterproof anti-skid lady boots for -40 degrees","USD 47.76","USD 23.88","50%","USD","7","USD 1.67","95","93.7%","https://s.click.aliexpress.com/e/_DCrTj6B",,,,,,
"1005004842884128","https://ae04.alicdn.com/kf/Sb11fbf7256434a53b49d08739a8fa957T.jpg",,"Women's Boots Plus Velvet Warm Casual Shoes One Step Suede Leather Trendy Women's Ankle Boots Chelsea Women's Boots Botas Mujer","USD 17.61","USD 11.45","35%","USD","7","USD 0.80","404","94.4%","https://s.click.aliexpress.com/e/_Dl3tdQJ",,,,,,
"1005003089191592","https://ae04.alicdn.com/kf/H286bd67a30c24ddb81e0fba70ba33e57y.jpg",,"2022 Women's Height-increasing Thick-soled Boots Wedge Heel Lace-up Decorative Women's Shoes Fashion Winter Women's Boots","USD 18.56","USD 12.99","30%","USD","7","USD 0.91","655","89.4%","https://s.click.aliexpress.com/e/_DFhwSj5",,,,,,
"1005004879015429","https://ae04.alicdn.com/kf/Sef4a1c7487a343e798354b4015d442ea7.jpg","http://cloud.video.taobao.com/play/u/2675628091/p/1/e/6/t/1/1100070908971.mp4","TMA EYES Strape-Accent Washed PU Leather Flat  Winter Warmth Women's Boot With Plus Size","USD 49.99","USD 49.99","0%","USD","7","USD 3.50","70","95.0%","https://s.click.aliexpress.com/e/_DBsBxsj",,,,,,
"1005004695551148","https://ae04.alicdn.com/kf/S209e463d2c154edbb33a78ecef12b326Q.jpg",,"Snow Boots Women's Short Tube Thickened Cotton Shoes Non-slip Winter New Shoes Student Women's Shoes 2022 Black Boots","USD 12.27","USD 9.20","25%","USD","7","USD 0.64","458","93.3%","https://s.click.aliexpress.com/e/_Dd3NSMP",,,,,,
"1005004612600162","https://ae04.alicdn.com/kf/S2f18347463064ee8b4de28690b150888t.jpg","http://cloud.video.taobao.com/play/u/2675628091/p/1/e/6/t/1/1100077148598.mp4","Women's Martens Boots PU Leather White Ankle Boots Autumn Winter Motorcycle Boots Fashion Female Chunky Heel Platform Boots","USD 29.96","USD 14.98","50%","USD","8.0","USD 1.20","95","83.6%","https://s.click.aliexpress.com/e/_DDCwxY7",,,,,,
"1005004586618159","https://ae04.alicdn.com/kf/S8197d325836d45cfa389d8a599833bedb.jpg",,"Lucyever Autumn Winter Women's Over The Knee Sock Boots 2022 Stretch Knitted Thick Heels Long Boots Woman Slip On Platform Shoes","USD 35.95","USD 20.85","42%","USD","7","USD 1.46","78","98.2%","https://s.click.aliexpress.com/e/_Dc7LMUr",,,,,,
"1005003224034212","https://ae04.alicdn.com/kf/Hae5bb650c3a94781986a84d1b9b30fe3k.jpg",,"2022 Spring New Women's Socks Boots Thick-Soled Casual Large Size Fashion Knit Short Boots Couple High Sstreet Socks Shoes","USD 32.35","USD 17.79","45%","USD","7","USD 1.25","35","96.7%","https://s.click.aliexpress.com/e/_DEmWH4x",,,,,,
"1005004708122927","https://ae04.alicdn.com/kf/S8fb3c1a5587447af8f9296560d345218o.jpg","http://cloud.video.taobao.com/play/u/2675628091/p/1/e/6/t/1/1100085410235.mp4","Designer Platform Shoes Women's Short Leather Boots 2023 Autumn Luxury Ankle Boots Female Chunky Botins Free Shipping Large Size","USD 69.81","USD 41.89","40%","USD","8.5","USD 3.56","27","100.0%","https://s.click.aliexpress.com/e/_DdhBqoX",,,,,,
"1005004692016686","https://ae04.alicdn.com/kf/S9255824dc4ff4d01947ed018156618f5y.jpg",,"Women's PU high heels over the knee boots women's new autumn and winter fashion 12CM thigh high boots sexy women's shoes","USD 65.00","USD 65.00","0%","USD","8.0","USD 5.20","109","95.0%","https://s.click.aliexpress.com/e/_DeIhnwJ",,,,,,
"32944932321","https://ae04.alicdn.com/kf/HTB1Jdo9XjvuK1Rjy0Faq6x2aVXaz.jpg",,"Winter Boots Women 2020 Women Snow Boots Wedge Heels Winter Shoes Women Warm Fur Casual Shoes  Zip Women's Shoes Botas Mujer","USD 30.00","USD 13.80","54%","USD","7","USD 0.97","377","97.1%","https://s.click.aliexpress.com/e/_DetDMCf",,,,,,
"1005004782939727","https://ae04.alicdn.com/kf/S882c7d6d26a84c119632bfe33fc55edeb.jpg","http://cloud.video.taobao.com/play/u/2675628091/p/1/e/6/t/1/1100089774492.mp4","Boots Women Plus Oversized Plush Designer Shoes for Women Outdoor Warm Fur Boots Waterproof Snow Boots Flat Zipper Winter Boots","USD 35.98","USD 18.35","49%","USD","7","USD 1.28","21","90.0%","https://s.click.aliexpress.com/e/_DCUPnPp",,,,,,
"1005003300012329","https://ae04.alicdn.com/kf/Seb8314d8dccf41fc950a9ad6e56f91a3N.jpg",,"Size 41 Shiny Leather Ankle Boots Women's Thick Heels 2021 Half Heels  Winter Patent Leather Shoes Square Heels","USD 30.36","USD 22.47","26%","USD","7","USD 1.57","33","92.0%","https://s.click.aliexpress.com/e/_DdkGqF5",,,,,,
"1005004743271011","https://ae04.alicdn.com/kf/Sb563b4d3ba29428886561639110737905.jpg",,"Winter High-top Cotton Shoes Woman Waterproof Down Cloth Comfortable Women's Ankle Boots Platform Soft Warm Furry Snow Boot","USD 21.37","USD 14.96","30%","USD","7","USD 1.05","448","96.5%","https://s.click.aliexpress.com/e/_DD6FDF1",,,,,,
"1005003328468920","https://ae04.alicdn.com/kf/Hd5166436a6d24707b928920dd8127d84y.jpg",,"Cotton Shoes Women 2021 New Winter Plus Velvet All-match Student Thick-soled Thickened Warm Snow Women's Cotton Boots","USD 31.96","USD 15.98","50%","USD","8.0","USD 1.28","28","91.4%","https://s.click.aliexpress.com/e/_Dk5EAqF",,,,,,
"1005003592138631","https://ae04.alicdn.com/kf/Aced9218b29a0460485bd6b4c34f3bd1cV.jpg",,"Soraia Shoes, Lacing Tracks, martens Style, with Platform and Side Zipper, Military Model, Black, camel, Green, beige, Women's Footwear, 2022 Fashion","USD 34.86","USD 28.32","0%","USD","8.0","USD 2.27","25","100.0%","https://s.click.aliexpress.com/e/_DkQsbcj",,,,,,
"1005004601274577","https://ae04.alicdn.com/kf/S3e3a51d6003d410fa0631873c4f2c75dy.jpg",,"Woman Thigh High Boots Fashion Women Knight Knee-High Boots Leather 2022 Flats Women's Shoes Winter Long Boots","USD 54.77","USD 23.55","57%","USD","7","USD 1.65","21","100.0%","https://s.click.aliexpress.com/e/_DCEaY1Z",,,,,,
"1005003449449035","https://ae04.alicdn.com/kf/H6fca1c341e45478d9d60eb6abbe6661fM.jpg","http://cloud.video.taobao.com/play/u/2675628091/p/1/e/6/t/1/342191038149.mp4","Brand Women's Shoes Australian Boots Winter Footwear Round Toe Flat Heel Boots-Women Fashion Snow Low 2022 Ladies Ankle Cotton","USD 25.23","USD 25.23","0%","USD","7","USD 1.77","650","90.8%","https://s.click.aliexpress.com/e/_DCNIbmB",,,,,,
"1005004686319297","https://ae04.alicdn.com/kf/Sd393c0cf2f204a40873a6bc749ab3cf2P.jpg",,"Women's Ankel Boots Autumn Winter Women Chelsea Boots Womens Short Boots Flat Shoes Fashion Platform Boots Gothic Botas De Mujer","USD 26.98","USD 16.19","40%","USD","7","USD 1.13","87","91.1%","https://s.click.aliexpress.com/e/_DE5sLuF",,,,,,
"1005004429828890","https://ae04.alicdn.com/kf/Sa804b338c6634e16ac636eecef1c68c5g.jpg",,"Black Beige Women's Boots Non-Slip Snow Boots Women Raise The Bottom Warm with Velvet Short Lattice Boots Platform Boots","USD 18.24","USD 8.94","51%","USD","7","USD 0.63","909","93.6%","https://s.click.aliexpress.com/e/_DdNK5In",,,,,,
"1005003402053524","https://ae04.alicdn.com/kf/Sca5639d5c4b0434c9dd138cf171c2711v.jpg",,"Fashion Boots Women's Ankle 2022 Round Toe New luxury Style Platfrom Chelsea Boots Snow Warm Goth Shoes Slip-on Mujer Zapatos","USD 28.84","USD 17.88","38%","USD","7","USD 1.25","249","91.7%","https://s.click.aliexpress.com/e/_DFAJAoJ",,,,,,
"1005004961615016","https://ae04.alicdn.com/kf/S8df894aea71c4af1964db554007435a0n.jpg",,"Snow Boots Women's Short Tube Thickened Cotton Shoes Non-slip Winter New Shoes Student Women's Shoes 2022 Black Boots","USD 21.52","USD 11.84","45%","USD","7","USD 0.83","202","94.5%","https://s.click.aliexpress.com/e/_DlWKCwx",,,,,,
"1005004868312824","https://ae04.alicdn.com/kf/S40dd77765ffe4131a2e54a79abfcbf052.jpg",,"Women's Thick-soled Boots Wedge Heel Lace-up Decorative Women's Shoes Fashion Winter Women's Boots Vulcanized shoes Modern Boots","USD 29.99","USD 14.99","50%","USD","7","USD 1.05","110","100.0%","https://s.click.aliexpress.com/e/_DdKnCR9",,,,,,
"1005003909019476","https://ae04.alicdn.com/kf/S6b72a1f2984e4061a824c97dddf6505eW.jpg","http://cloud.video.taobao.com/play/u/2675628091/p/1/e/6/t/1/1100093194529.mp4","Women's Winter Boots Genuine Leather Female Boots Size dropshipping Warm High-heeled Wool Boots Women Trend Riding Boots Women","USD 69.68","USD 44.59","36%","USD","8.0","USD 3.57","85","100.0%","https://s.click.aliexpress.com/e/_Dlwn1Xt",,,,,,
"1005003206760264","https://ae04.alicdn.com/kf/H0621a43c28fb46cf80ca50eda50c5737P.jpg","http://cloud.video.taobao.com/play/u/2675628091/p/1/e/6/t/1/324173713388.mp4","Women's Mother Female Ladies Leather Shoes Boots Botas Knee High Zipper Winter Warm Plush Mid Calf Plus Size Mid-calf Snow Boot7","USD 7.62","USD 5.33","30%","USD","7","USD 0.37","253","81.4%","https://s.click.aliexpress.com/e/_DmRvL3Z",,,,,,
"1005003762859363","https://ae04.alicdn.com/kf/H91254469a32c4678a6e5ae72602f8421a.jpg","http://cloud.video.taobao.com/play/u/2675628091/p/1/e/6/t/1/343132328365.mp4","New Arrival Genuine Leather Australia Classic Women Mini Snow Boots Women's Cow Leather Ankle Boots Winter Women Shoes","USD 54.58","USD 32.75","40%","USD","7","USD 2.29","52","97.5%","https://s.click.aliexpress.com/e/_DedMLAr",,,,,,
"1005004528487047","https://ae04.alicdn.com/kf/S3da568cfbb3944f698f8fd31a6064fdaf.jpg","http://cloud.video.taobao.com/play/u/2675628091/p/1/e/6/t/1/1100066149687.mp4","AIYUQI Women's Snow Boots Large Size Warm Wool Women's Winter Boots Non-slip New Genuine Leather Women's Short Boots","USD 79.42","USD 42.89","46%","USD","8.0","USD 3.43","39","95.6%","https://s.click.aliexpress.com/e/_DBFC5KX",,,,,,
"1005004589817342","https://ae04.alicdn.com/kf/S37c091df5fc64ed2bb6a4404419034a7v.jpg",,"Thick-heeled patent leather short boots women's autumn/winter 2021 new  boots black pointed high heels beige women's shoes","USD 36.53","USD 36.53","0%","USD","7","USD 2.56","56","93.3%","https://s.click.aliexpress.com/e/_DCUXXh5",,,,,,
"1005002570417560","https://ae04.alicdn.com/kf/H7de5232ab6a8455fac228c8d3d70f825j.jpg",,"Faux Suede Slim Boots Sexy over the knee high women snow boots women's fashion winter thigh high boots shoes woman 025","USD 18.16","USD 9.99","45%","USD","7","USD 0.70","46","86.7%","https://s.click.aliexpress.com/e/_Dm00187",,,,,,
"1005004687219276","https://ae04.alicdn.com/kf/S161c35a8aeb4462bad9ce99f55358f3dJ.jpg","http://cloud.video.taobao.com/play/u/2675628091/p/1/e/6/t/1/1100084097466.mp4","Mid Calf Women's High boots Classic Style Woman Winter Boots Leather Riding Equestrian Boots With Buckle Large Girth Size 42","USD 138.00","USD 70.38","49%","USD","8.5","USD 5.98","20","100.0%","https://s.click.aliexpress.com/e/_DEMEaNt",,,,,,
"1005004505866303","https://ae04.alicdn.com/kf/S5a07cfd471f2410986ec8e684de539fbs.jpg","http://cloud.video.taobao.com/play/u/2675628091/p/1/e/6/t/1/1100062916518.mp4","Women's Shoes Fashion Sexy Medium Boots Elastic Cloth Pointed Stiletto High Heels Candy Large Women's Short Boots Large 35-43","USD 41.98","USD 25.19","40%","USD","7","USD 1.76","32","92.7%","https://s.click.aliexpress.com/e/_DBVUwsn",,,,,,
"1005003275498004","https://ae04.alicdn.com/kf/H465c3bff199d4df1a56737f6d39ee729s.jpg","http://cloud.video.taobao.com/play/u/2675628091/p/1/e/6/t/1/1100092580627.mp4","Women's stiletto heel 2021 pointed toe middle boot western cowboy boots fall/winter frosted high-heeled knight boots Thin legs","USD 31.00","USD 21.70","30%","USD","15.0","USD 3.26","61","88.9%","https://s.click.aliexpress.com/e/_DFHZ4GB",,,,,,
"1005003332874374","https://ae04.alicdn.com/kf/S6323a3815003463484cfb7c42daafaf9u.jpg",,"Black Patent Leather Ankle Boots Round Toe Patent Leather Beige Ladies Fashion Winter Long Women's Boots Botas Mujer","USD 41.59","USD 20.38","51%","USD","8.0","USD 1.63","2005","92.8%","https://s.click.aliexpress.com/e/_DkXPjjv",,,,,,
